,newsID,secID,equType,assetClass,ticker,secShortName,exchangeCD,partyID,newsPublishTime,newsInsertTime,degreeProp1St,degreeProp2St,relatedCompanyDegree,relatedCompanyScore,sentiment,sentimentScore,updateTime,newsTitle,newsSummary,newsOriginSource,newsAuthor,newsPublishSite
2132,97705762,603899.XSHG,A,E,603899,晨光文具,XSHG,67053,2021-10-20 09:07:43,2021-10-20 09:07:45,0.000233120299526,0.999760210514,2,0.999876770664,0,0.0138481855392,2021-10-20 09:07:47,晨光文具：常销品基本不涨价 定期评估主要原材料价格走势影响,公司近年来常销品基本不涨价，价格的变化主要体现在新品和精品文创类产品。公司会定期评估主要原材料价格走势的影响。,e公司,,东方财富网
2133,97705867,603899.XSHG,A,E,603899,晨光文具,XSHG,67053,2021-10-20 09:08:11,2021-10-20 09:08:12,0.999943256378,2.22296384891e-05,1,0.499993857828,1,0.663535159826,2021-10-20 09:08:14,轻工制造及纺织服装行业周报：中美贸易摩擦现缓和迹象 成品家具企业有望受益,中美贸易摩擦现缓和迹象，成品家具板块上市公司出口业务未来有望受益。本周上证综指下跌0.55%，轻工制造行业下跌2.97%，跑输大盘，纺织服装行业下跌1.14%，跑输大盘。,首创证券股份有限公司,陈梦,新浪财经
2134,97707368,603899.XSHG,A,E,603899,晨光文具,XSHG,67053,2021-10-20 09:12:11,2021-10-20 09:21:17,0.000244379742071,0.999031066895,2,0.999153256766,0,0.0125006318092,2021-10-20 09:21:17,晨光文具：常销品基本不涨价 定期评估主要原材料价格走势影响,公司近年来常销品基本不涨价，价格的变化主要体现在新品和精品文创类产品。公司会定期评估主要原材料价格走势的影响。,云财经,,腾讯网
2135,97708108,603899.XSHG,A,E,603899,晨光文具,XSHG,67053,2021-10-20 09:23:55,2021-10-20 09:23:56,0.00301520829089,0.993201911449,2,0.994709515595,0,-0.00910077095032,2021-10-20 09:23:57,晨光文具：常销品基本不涨价 定期评估主要原材料价格走势影响,公司近年来常销品基本不涨价，价格的变化主要体现在新品和精品文创类产品。公司会定期评估主要原材料价格走势的影响。,证券时报网,,和讯网
2136,97711913,603899.XSHG,A,E,603899,晨光文具,XSHG,67053,2021-10-20 09:46:56,2021-10-20 09:46:58,0.00570015423,0.993955910206,2,0.996805987321,0,0.04976978302,2021-10-20 09:46:59,晨光文具：近年来常销品基本不涨价 价格变化主要体现在新品和精品文创类产品,晨光文具在在“上证e互动”平台回答投资者提问时称，公司近年来常销品基本不涨价，价格的变化主要体现在新品和精品文创类产品。公司会定期评估主要原材料价格走势的影响。,界面新闻,,东方财富网
2137,97711921,603899.XSHG,A,E,603899,晨光文具,XSHG,67053,2021-10-20 09:47:00,2021-10-20 09:47:01,0.999941468239,2.25341445912e-05,1,0.499993268264,1,0.663535159826,2021-10-20 09:47:04,轻工制造及纺织服装行业周报：中美贸易摩擦现缓和迹象 成品家具企业有望受益,中美贸易摩擦现缓和迹象，成品家具板块上市公司出口业务未来有望受益。本周上证综指下跌0.55%，轻工制造行业下跌2.97%，跑输大盘，纺织服装行业下跌1.14%，跑输大盘。,首创证券,,东方财富网
2138,97717886,603899.XSHG,A,E,603899,晨光文具,XSHG,67053,2021-10-20 10:40:49,2021-10-20 10:40:50,0.00367021327838,0.996289730072,2,0.998124836711,-1,-0.594720208645,2021-10-20 10:40:50,晨光文具盘中异动 早盘大跌5.0%,2021年10月20日早盘10时38分，晨光文具出现异动，股价大幅下跌5.0%。过去一年内该股还未有涨停，没有跌停。,自选股智能写手,,腾讯网
2139,97719922,603899.XSHG,A,E,603899,晨光文具,XSHG,67053,2021-10-20 11:06:30,2021-10-20 11:06:31,0.999414920807,0.000453287764685,1,0.500160748168,1,0.632710966468,2021-10-20 11:06:32,家居文娱月报：9月家居文娱景气偏弱 持续看好龙头份额提升,家居文娱月报以实时跟踪行业和重点公司最新动态，线下&amp。9月竣工面积同比下滑、地产销售持续偏弱。文娱用品9月社会零售额整体保持稳定增长态势，金银珠宝类9月零售额同比+20.1%，增速环比8月提升12.7%。,,,新浪财经
2140,97720998,603899.XSHG,A,E,603899,晨光文具,XSHG,67053,2021-10-20 11:18:34,2021-10-20 11:18:37,0.00764226727188,0.986801922321,2,0.990623055957,0,0.0209662437439,2021-10-20 11:18:37,晨光文具：近年来常销品基本不涨价,晨光文具在在“上证e互动”平台回答投资者提问时称，公司近年来常销品基本不涨价，价格的变化主要体现在新品和精品文创类产品。公司会定期评估主要原材料价格走势的影响。,界面新闻,,新浪财经
2141,97725705,603899.XSHG,A,E,603899,晨光文具,XSHG,67053,2021-10-20 12:33:39,2021-10-20 12:33:58,0.00285788089968,0.978801429272,2,0.980230369722,0,0.0272633075714,2021-10-20 12:33:59,晨光文具：常销品基本不涨价 定期评估主要原材料价格走势影响,公司近年来常销品基本不涨价，价格的变化主要体现在新品和精品文创类产品。公司会定期评估主要原材料价格走势的影响。,证券时报网,,国际金融报网
2142,97737270,603899.XSHG,A,E,603899,晨光文具,XSHG,67053,2021-10-20 15:46:10,2021-10-20 15:46:25,0.701731085777,0.0233255270869,1,0.374191069975,0,0.028975892067,2021-10-20 15:46:25,【互动掘金】深圳新星：公司年产800吨六氟磷酸锂生产线各项调试已经基本完毕,公司的云服务器密码机、电子签章等重点产品已完成与华为云平台的各项适配工作并广泛应用。公司近年来常销品基本不涨价，价格的变化主要体现在新品和精品文创类产品。,证券时报网,,证券时报网
2143,97737912,603899.XSHG,A,E,603899,晨光文具,XSHG,67053,2021-10-20 15:53:34,2021-10-20 15:53:36,0.609566688538,0.0197952948511,1,0.32457863912,0,0.028975892067,2021-10-20 15:53:39,深圳新星：公司年产800吨六氟磷酸锂生产线各项调试已经基本完毕,公司的云服务器密码机、电子签章等重点产品已完成与华为云平台的各项适配工作并广泛应用。公司近年来常销品基本不涨价，价格的变化主要体现在新品和精品文创类产品。,证券时报网,,东方财富网
2144,97738164,603899.XSHG,A,E,603899,晨光文具,XSHG,67053,2021-10-20 15:56:23,2021-10-20 15:56:23,0.647564411163,0.0135855302215,1,0.337367735803,0,0.028975892067,2021-10-20 15:56:25,【互动掘金】深圳新星：公司年产800吨六氟磷酸锂生产线各项调试已经基本完毕,公司的云服务器密码机、电子签章等重点产品已完成与华为云平台的各项适配工作并广泛应用。公司近年来常销品基本不涨价，价格的变化主要体现在新品和精品文创类产品。,证券时报网,陈勇洲,全景网
2145,97738544,603899.XSHG,A,E,603899,晨光文具,XSHG,67053,2021-10-20 16:00:27,2021-10-20 16:00:28,0.999901771545,4.81308816234e-05,1,0.499999016654,0,0.169709394872,2021-10-20 16:00:31,建筑招工移动平台鱼泡网完成2亿人民币Pre-A轮融资,建筑招工移动平台鱼泡网完成2亿人民币Pre-A轮融资，投资方为钟鼎资本。,亿邦动力,,亿邦动力网
2146,97777894,603899.XSHG,A,E,603899,晨光文具,XSHG,67053,2021-10-21 07:46:57,2021-10-21 07:46:59,0.00622641388327,0.993611752987,2,0.996724959929,-1,-0.925238737464,2021-10-21 07:47:02,晨光文具10月20日被沪股通减持16.84万股,晨光文具被沪股通减持16.84万股，已连续3日被沪股通减持，共计58.49万股，最新持股量为5674.71万股，占公司A股总股本的6.12%。,东方财富Choice数据,,东方财富网
2147,97781758,603899.XSHG,A,E,603899,晨光文具,XSHG,67053,2021-10-21 08:09:42,2021-10-21 08:09:44,0.0160583350807,0.956809341908,2,0.964838509448,1,0.733129370213,2021-10-21 08:09:45,晨光文具：融资净买入870.11万元，融资余额1.22亿元（10-20）,晨光文具融资融券信息显示，2021年10月20日融资净买入870.11万元。融资方面，当日融资买入1444.43万元，融资偿还574.32万元，融资净买入870.11万元。,东方财富Choice数据,,东方财富网
2148,97969045,603899.XSHG,A,E,603899,晨光文具,XSHG,67053,2021-10-24 10:41:58,2021-10-24 10:41:59,0.999935865402,2.22671969823e-05,1,0.499990199898,0,0.16379820928,2021-10-24 10:42:01,轻工行业周报：继续关注出口链反转及地产链估值修复机会,关税角度，若获得关税豁免，短期出口链企业盈利能力有望修复，长期来看，关税豁免落地后，头部企业在竞争优势下的收入增长值得期待，有望获得收入体量和盈利水平的同步提升。电子雾化烟品牌商雾芯科技受国内政策及舆论影响环比增速趋缓。,,,新浪财经
2149,97971150,603899.XSHG,A,E,603899,晨光文具,XSHG,67053,2021-10-24 13:02:59,2021-10-24 13:03:00,0.999903202057,1.03762631625e-05,1,0.499961977292,0,0.16379820928,2021-10-24 13:03:02,轻工行业周报：继续关注出口链反转及地产链估值修复机会,关税角度，若获得关税豁免，短期出口链企业盈利能力有望修复，长期来看，关税豁免落地后，头部企业在竞争优势下的收入增长值得期待，有望获得收入体量和盈利水平的同步提升。电子雾化烟品牌商雾芯科技受国内政策及舆论影响环比增速趋缓。,中泰证券,,东方财富网
2150,97976796,603899.XSHG,A,E,603899,晨光文具,XSHG,67053,2021-10-24 17:31:29,2021-10-24 17:31:31,0.00123646471184,0.998681485653,2,0.999299718009,-1,-0.552700090408,2021-10-24 17:31:33,主业毛利下降，新业连年亏损，晨光文具已到天花板？,晨光文具股价最高时突破百元，市值随之来到千亿，成为当之无愧的“文具茅”。净利润6.7亿元，同比增长44.43%，均高于前四个季度的营收、净利润增速。,,,创业邦
2151,97976870,603899.XSHG,A,E,603899,晨光文具,XSHG,67053,2021-10-24 17:33:48,2021-10-24 17:34:00,0.00123646471184,0.998681485653,2,0.999299718009,-1,-0.552700090408,2021-10-24 17:34:01,主业毛利下降，新业连年亏损，晨光文具已到天花板？,晨光文具股价最高时突破百元，市值随之来到千亿，成为当之无愧的“文具茅”。净利润6.7亿元，同比增长44.43%，均高于前四个季度的营收、净利润增速。,创业邦,,腾讯网
2152,98076819,603899.XSHG,A,E,603899,晨光文具,XSHG,67053,2021-10-25 00:00:00,2021-10-26 07:42:17,0.999541163445,0.00031653456972,1,0.500087116292,1,0.702023252845,2021-10-26 07:42:19,轻工制造行业周报：培育钻石-导入期高成长 珠宝巨头入局 行业有望进入快车道,近期市场对培育钻石关注度提升，随着全球珠宝巨头Debeers、施华洛世奇以及国内的珠宝品牌周大福、豫园珠宝陆续推出旗下培育钻石品牌，消费者认知提升有望带动行业终端需求快速提升，行业或加速渗透。,,,新浪财经
2153,98029434,603899.XSHG,A,E,603899,晨光文具,XSHG,67053,2021-10-25 15:47:32,2021-10-25 15:47:33,0.806316018105,0.187018975616,1,0.590176984668,0,0.149061380327,2021-10-25 15:47:34,国货崛起系列研究-文创：国货崛起的IP梦工厂,我国文创行业近年来的市场关注度持续提升，国潮IP出圈案例层出不穷，我们看好在需求端和供给端多重因素驱动下的国货文创广阔发展空间。,中国国际金融股份有限公司,樊俊豪/郑慧琳/吕沛航,新浪财经
2154,98080606,603899.XSHG,A,E,603899,晨光文具,XSHG,67053,2021-10-26 08:07:59,2021-10-26 08:08:01,0.000223015769734,0.999734818935,2,0.99984632682,1,0.85674354732,2021-10-26 08:08:01,晨光文具：10月25日融资净买入451.11万元 环比增加374.53%,10月25日融资买入834.58万元，融资偿还383.47万元，融资净买入451.11万元，当前融资余额为1.31亿元。晨光文具10月25日融资融券余额较昨日增加333.44万元至1.42亿元。,同花顺金融研究中心,,同花顺
2155,98082421,603899.XSHG,A,E,603899,晨光文具,XSHG,67053,2021-10-26 08:20:57,2021-10-26 08:21:00,0.99938082695,0.000376134674298,1,0.500066548149,1,0.702023252845,2021-10-26 08:21:01,轻工制造行业周报：培育钻石-导入期高成长 珠宝巨头入局 行业有望进入快车道,近期市场对培育钻石关注度提升，随着全球珠宝巨头Debeers、施华洛世奇以及国内的珠宝品牌周大福、豫园珠宝陆续推出旗下培育钻石品牌，消费者认知提升有望带动行业终端需求快速提升，行业或加速渗透。,华安证券,,东方财富网
2156,98104761,603899.XSHG,A,E,603899,晨光文具,XSHG,67053,2021-10-26 11:28:51,2021-10-26 11:28:52,0.999805271626,8.55562102515e-05,1,0.499988192023,1,0.686620901525,2021-10-26 11:28:54,轻工制造与纺织服装行业周报：Q3服装零售偏弱 看好Q4冬装销售表现,月服装鞋帽、针纺织品类零售额同比下降4.8%，增速环比提升1.2pct，我们认为主要原因一是今年气温偏高影响秋冬装换季需求，二是洪水以及疫情局部反复影响线下零售。本周郑交所棉花期货收盘价为21200 元/吨，较上周下跌1535 元/吨。,,,新浪财经
2157,98110680,603899.XSHG,A,E,603899,晨光文具,XSHG,67053,2021-10-26 13:21:19,2021-10-26 13:21:20,0.999762833118,8.56925325934e-05,1,0.499967109092,1,0.686620901525,2021-10-26 13:21:21,轻工制造与纺织服装行业周报：Q3服装零售偏弱 看好Q4冬装销售表现,月服装鞋帽、针纺织品类零售额同比下降4.8%，增速环比提升1.2pct，我们认为主要原因一是今年气温偏高影响秋冬装换季需求，二是洪水以及疫情局部反复影响线下零售。本周郑交所棉花期货收盘价为21200 元/吨，较上周下跌1535 元/吨。,首创证券,,东方财富网
2158,98195512,603899.XSHG,A,E,603899,晨光文具,XSHG,67053,2021-10-27 09:44:08,2021-10-27 09:45:58,0.3366073668,0.65872246027,2,0.82702614367,0,-0.0030032992363,2021-10-27 09:45:58,投资者提问：公司九木杂物社快去扩张过程中店面员工服务质量怎么保证，公司有培...,公司九木杂物社快去扩张过程中店面员工服务质量怎么保证，公司有培训安排吗，本人去过线下店，员工服务素质一言难尽，大众点评上有不少负面评价，你怎么看。,问董秘,,新浪财经
2159,98196214,603899.XSHG,A,E,603899,晨光文具,XSHG,67053,2021-10-27 09:50:04,2021-10-27 09:50:05,0.0146479224786,0.985293984413,2,0.992617945652,-1,-0.616241210699,2021-10-27 09:50:07,晨光文具早盘大跌5.0% 股价创1月新低,2021年10月27日早盘09时49分，晨光文具出现异动，股价大幅下跌5.0%，创1月新低。过去一年内该股还未有涨停，没有跌停。,自选股智能写手,,腾讯网
2160,98199833,603899.XSHG,A,E,603899,晨光文具,XSHG,67053,2021-10-27 10:08:57,2021-10-27 10:08:58,0.943592905998,1.43022657539e-06,1,0.471797883226,0,0.0224031686783,2021-10-27 10:08:59,10月27日文教休闲板块跌幅达2%,板块指数报574.958点，跌幅达2%，成交11.25亿元，换手率0.55%。,东方财富Choice数据,,东方财富网
2161,98202353,603899.XSHG,A,E,603899,晨光文具,XSHG,67053,2021-10-27 10:31:37,2021-10-27 10:31:40,0.662346899509,0.0011465169955,1,0.33231996675,0,0.0224031686783,2021-10-27 10:31:42,10月27日超级品牌板块跌幅达2%,10月27日10点28分，超级品牌板块指数报2673.888点，跌幅达2%，成交196.71亿元，换手率0.46%。,东方财富Choice数据,,东方财富网
2162,98203653,603899.XSHG,A,E,603899,晨光文具,XSHG,67053,2021-10-27 10:41:40,2021-10-27 10:41:41,0.990007162094,2.86476079054e-05,1,0.495032228655,0,0.0248138606548,2021-10-27 10:41:43,家用轻工板块持续走低，华瓷股份跌停，蒙娜丽莎、明牌珠宝、海鸥住工、张小泉、...,家用轻工板块持续走低，华瓷股份跌停，蒙娜丽莎、明牌珠宝、海鸥住工、张小泉、晨光文具、哈尔斯、玉马遮阳跌超5%。,,,新浪财经
2163,98207953,603899.XSHG,A,E,603899,晨光文具,XSHG,67053,2021-10-27 11:27:04,2021-10-27 11:27:05,0.590140998363,7.56345907575e-05,1,0.295146133773,0,0.0224031686783,2021-10-27 11:27:06,10月27日茅指数板块跌幅达2%,10月27日11点22分，茅指数板块指数报898.976点，跌幅达2%，成交627.79亿元，换手率0.55%。,东方财富Choice数据,,东方财富网
2164,98209227,603899.XSHG,A,E,603899,晨光文具,XSHG,67053,2021-10-27 11:41:04,2021-10-27 11:41:05,0.99984896183,3.38528298016e-05,1,0.499958333745,0,0.120622785389,2021-10-27 11:41:06,轻工行业周报：9月地产数据公布 家居聚焦份额集中,房地产税出台，9月地产数据表现较弱，关注强α龙头房地产税落地短期压制投机需求，央行表态地产市场发展健康。优选下游高景气的优质制造，并关注净利率修复条线个股。,,,新浪财经
2165,98215779,603899.XSHG,A,E,603899,晨光文具,XSHG,67053,2021-10-27 13:33:03,2021-10-27 13:33:07,0.999764025211,2.48610649578e-05,1,0.499906873671,0,0.120622785389,2021-10-27 13:33:11,轻工行业周报：9月地产数据公布 家居聚焦份额集中,房地产税出台，9月地产数据表现较弱，关注强α龙头房地产税落地短期压制投机需求，央行表态地产市场发展健康。优选下游高景气的优质制造，并关注净利率修复条线个股。,浙商证券,,东方财富网
2166,98218302,603899.XSHG,A,E,603899,晨光文具,XSHG,67053,2021-10-27 14:14:09,2021-10-27 14:14:11,0.953094542027,8.98550183592e-07,1,0.476548169563,0,0.0224031686783,2021-10-27 14:14:12,10月27日文教休闲板块跌幅达3%,板块指数报569.186点，跌幅达3%，成交29.35亿元，换手率1.42%。,东方财富Choice数据,,东方财富网
2167,98241703,603899.XSHG,A,E,603899,晨光文具,XSHG,67053,2021-10-27 17:50:36,2021-10-27 17:50:38,0.997486829758,0.00181858555879,1,0.500562000438,1,0.583998262882,2021-10-27 17:50:46,半年内获两轮融资，姜歌机器人能否抢跑智能仓储物流赛道？,AMR物流机器人在行业东风的催化下，正迎来新一轮爆发期，市场频繁传出有关机器人行业的融资。在这中间需要企业在市场之间找到一个平衡点。未来，智能仓储赛道的市场规模预计2025年达2500亿元。,新工业洞察,,OFweek
2168,98257187,603899.XSHG,A,E,603899,晨光文具,XSHG,67053,2021-10-27 19:51:56,2021-10-27 19:51:59,0.999948143959,3.02264270431e-05,1,0.500004298407,0,0.0127634584904,2021-10-27 19:52:01,险守千亿！ 张坤、刘彦春三季度管理规模环比下滑 明星基金经理后市怎么看,随着公募基金进入三季报密集披露期，部分明星经理的最新管理规模随之揭晓。北京商报记者注意到，千亿顶流基金经理张坤、刘彦春的最新管理规模分别为1057.48亿元、1029.15亿元，较二季度末有所下降，但仍能守住千亿规模。,北京商报网,,和讯网
2169,98262692,603899.XSHG,A,E,603899,晨光文具,XSHG,67053,2021-10-27 20:58:14,2021-10-27 20:58:17,0.996522545815,7.267818728e-05,1,0.498333951095,0,0.0224031686783,2021-10-27 20:58:19,【图解季报】东兴品牌精选混合C基金2021年三季报点评,基金经理孙继青拥有6.1年的基金投资经历，2018年11月14日正式接受东兴品牌精选混合C基金管理，任职期间回报为60.87%，位居同类2606只基金中第1655名。东兴品牌精选混合C基金的总资产为0.01亿元。,东方财富Choice数据,,东方财富网
2170,98280247,603899.XSHG,A,E,603899,晨光文具,XSHG,67053,2021-10-28 07:09:46,2021-10-28 07:09:47,0.934699773788,0.0276543200016,1,0.495004206896,0,0.0461522728205,2021-10-28 07:09:51,新华基金老将旗下两基金前三季跌14% 人才流失显窘境,新华基金今年内已经有多位基金经理陆续离职，董事长、总经理与副总经理同样接连出走，如此频繁的人才动荡，让这家成立已经17年之久的公募基金公司的未来之路更加风雨飘摇。,中国经济网,,中国经济网
2171,98280495,603899.XSHG,A,E,603899,晨光文具,XSHG,67053,2021-10-28 07:15:12,2021-10-28 07:15:13,0.91755259037,0.00698445364833,1,0.465760748833,0,0.0461522728205,2021-10-28 07:15:19,新华基金老将旗下两基金前三季跌14% 人才流失显窘境,新华基金今年内已经有多位基金经理陆续离职，董事长、总经理与副总经理同样接连出走，如此频繁的人才动荡，让这家成立已经17年之久的公募基金公司的未来之路更加风雨飘摇。,中国经济网,,新浪财经
2172,98280683,603899.XSHG,A,E,603899,晨光文具,XSHG,67053,2021-10-28 07:20:08,2021-10-28 07:20:10,0.935383617878,0.01813438721,1,0.485826196149,0,0.0478929013014,2021-10-28 07:20:13,新华基金老将旗下两基金前三季跌14% 人才流失显窘境,新华基金今年内已经有多位基金经理陆续离职，董事长、总经理与副总经理同样接连出走，如此频繁的人才动荡，让这家成立已经17年之久的公募基金公司的未来之路更加风雨飘摇。,,,同花顺
2173,98280734,603899.XSHG,A,E,603899,晨光文具,XSHG,67053,2021-10-28 07:20:51,2021-10-28 07:21:47,0.926503181458,0.0278965514153,1,0.491148142144,0,0.0461522728205,2021-10-28 07:21:51,新华基金老将旗下两基金前三季跌14% 人才流失显窘境,新华基金今年内已经有多位基金经理陆续离职，董事长、总经理与副总经理同样接连出走，如此频繁的人才动荡，让这家成立已经17年之久的公募基金公司的未来之路更加风雨飘摇。,中国经济网,,同花顺app
2174,98335385,603899.XSHG,A,E,603899,晨光文具,XSHG,67053,2021-10-28 15:59:54,2021-10-28 15:59:59,0.000623342872132,0.999265134335,2,0.999576805771,1,0.810816419125,2021-10-28 16:00:00,晨光文具：2021年第三季度净利润约4.51亿元，同比增长0.57%,第三季度公司实现营业收入约44.65亿元，同比增长18.24%。实现归属于上市公司股东的净利润约4.51亿元，同比增长0.57%。晨光文具近30日内北向资金持股量减少246.48万股，占流通股比例减少0.26%。,每日经济新闻,,腾讯网
2175,98335941,603899.XSHG,A,E,603899,晨光文具,XSHG,67053,2021-10-28 16:03:29,2021-10-28 16:03:30,0.000388872984331,0.999538421631,2,0.999732858123,1,0.886688520014,2021-10-28 16:03:31,晨光文具：2021年第三季度净利润约4.51亿元 同比增长0.57%,第三季度公司实现营业收入约44.65亿元，同比增长18.24%。实现归属于上市公司股东的净利润约4.51亿元，同比增长0.57%。,每日经济新闻,,东方财富网
2176,98340890,603899.XSHG,A,E,603899,晨光文具,XSHG,67053,2021-10-28 16:32:28,2021-10-28 16:32:30,0.400853097439,0.568966507912,2,0.769393056631,1,0.842942163348,2021-10-28 16:32:36,图解晨光文具三季报：第三季度单季净利润同比增0.57%,晨光文具2021三季报显示，公司主营收入121.52亿元，同比上升42.33%。2021年第三季度，公司单季度主营收入44.65亿元，同比上升18.24%。单季度归母净利润4.51亿元，同比上升0.57%。,证券之星数据,,证券之星
2177,98342149,603899.XSHG,A,E,603899,晨光文具,XSHG,67053,2021-10-28 16:39:24,2021-10-28 16:39:25,0.00170166254975,0.998242616653,2,0.999093447928,-1,-0.500594091415,2021-10-28 16:39:25,晨光文具董秘回复：九木杂物社目前处于扩张阶段，主要是新开店较多，且部分区域疫情反复的影响。公司将持续优化商品组合，标准化店铺运营，进而推动坪效和盈利水平的提升,九木杂物社目前处于扩张阶段，主要是新开店较多，且部分区域疫情反复的影响。公司将持续优化商品组合，标准化店铺运营，进而推动坪效和盈利水平的提升。晨光文具2021三季报显示，公司主营收入121.52亿元，同比上升42.33%。,证券之星智库,,证券之星
2178,98345275,603899.XSHG,A,E,603899,晨光文具,XSHG,67053,2021-10-28 16:56:07,2021-10-28 16:56:08,0.399231106043,0.571935772896,2,0.771551325917,0,-0.0030032992363,2021-10-28 16:56:08,投资者提问：您好，请问九木杂物社亏损的原因是什么？具体是哪类成本过高导致亏...,九木杂物社目前处于扩张阶段，主要是新开店较多，且部分区域疫情反复的影响。本信息由新浪财经从公开信息中摘录，不构成任何投资建议。,问董秘,,新浪财经
2179,98345810,603899.XSHG,A,E,603899,晨光文具,XSHG,67053,2021-10-28 17:00:12,2021-10-28 17:00:14,0.0405313782394,0.935546636581,2,0.955812325701,1,0.733066523075,2021-10-28 17:00:14,图解晨光文具三季报：第三季度单季净利润同比增0.57％,晨光文具2021三季报显示，公司主营收入121.52亿元，同比上升42.33%。单季度归母净利润4.51亿元，同比上升0.57%。单季度扣非净利润3.79亿元，同比下降6.53%。,金融界,,腾讯网
2180,98350153,603899.XSHG,A,E,603899,晨光文具,XSHG,67053,2021-10-28 17:29:02,2021-10-28 17:30:47,2.30316836678e-05,0.99997484684,2,0.999986362682,1,0.945285796374,2021-10-28 17:30:49,晨光文具(603899.SH)：第三季度净利增0.57%至4.51亿元,格隆汇10月28日丨晨光文具公布2021年第三季度报告，公司实现营业收入44.65亿元，同比增长18.24%。归属于上市公司股东的扣除非经常性损益的净利润3.79亿元，同比下降6.53%。,,,格隆汇
2181,98350594,603899.XSHG,A,E,603899,晨光文具,XSHG,67053,2021-10-28 17:34:00,2021-10-28 17:34:01,2.30316836678e-05,0.99997484684,2,0.999986362682,1,0.945285796374,2021-10-28 17:34:02,晨光文具(603899.SH)：第三季度净利增0.57%至4.51亿元,格隆汇10月28日丨晨光文具公布2021年第三季度报告，公司实现营业收入44.65亿元，同比增长18.24%。归属于上市公司股东的扣除非经常性损益的净利润3.79亿元，同比下降6.53%。,格隆汇,,腾讯网
