,newsID,secID,equType,assetClass,ticker,secShortName,exchangeCD,partyID,newsPublishTime,newsInsertTime,degreeProp1St,degreeProp2St,relatedCompanyDegree,relatedCompanyScore,sentiment,sentimentScore,updateTime,newsTitle,newsSummary,newsOriginSource,newsAuthor,newsPublishSite
1464,91009864,603899.XSHG,A,E,603899,晨光文具,XSHG,67053,2021-07-02 18:31:02,2021-07-02 18:31:03,0.408253669739,0.570725917816,2,0.774852752686,1,0.825407473743,2021-07-02 18:31:06,华创证券：维持晨光文具目标价为106.0 元 维持“强推”评级,传统业务线上线下共同发力，精细化管理和产品力持续提升。晨光旗舰店6 月单月销售额/销售量同比+117%/+34%。巩固传统核心业务，新业务新渠道放量可期，维持“强推”评级。,华创证券,,东方财富网
1465,91009918,603899.XSHG,A,E,603899,晨光文具,XSHG,67053,2021-07-02 18:31:38,2021-07-02 18:31:40,0.089639917016,0.906433403492,2,0.951253362,1,0.592665895894,2021-07-02 18:31:42,35股获机构买入型评级 晨光文具关注度最高,数据宝统计显示，35只个股今日获机构买入型评级。晨光文具关注度最高，共获4次机构买入型评级记录。,证券时报网,,东方财富网
1466,91010607,603899.XSHG,A,E,603899,晨光文具,XSHG,67053,2021-07-02 18:39:32,2021-07-02 18:39:34,0.101592883468,0.89504301548,2,0.945839457214,1,0.592665895894,2021-07-02 18:39:34,35股获机构买入型评级 晨光文具关注度最高,数据宝统计显示，35只个股今日获机构买入型评级。晨光文具关注度最高，共获4次机构买入型评级记录。,证券时报网,阙福生,全景网
1467,91011978,603899.XSHG,A,E,603899,晨光文具,XSHG,67053,2021-07-02 18:52:51,2021-07-02 18:52:53,0.0802641585469,0.908365011215,2,0.948497090489,1,0.595296510383,2021-07-02 18:52:55,35股获机构买入型评级 晨光文具关注度最高,数据宝统计显示，35只个股今日获机构买入型评级。晨光文具关注度最高，共获4次机构买入型评级记录。,证券时报网,,新浪财经
1468,91012888,603899.XSHG,A,E,603899,晨光文具,XSHG,67053,2021-07-02 19:00:20,2021-07-02 19:00:21,0.000196770852199,0.999662876129,2,0.999761261555,1,0.748751607537,2021-07-02 19:00:21,晨光文具(603899)：业绩预告好于预期 文具白马业绩持续稳健增长,业绩预告好于预期，文具白马业绩持续稳健增长。商场客流逐渐回暖，九木杂物社联合头部文创IP 打造爆款单品，门店销售同比改善，未来有望加速开店。,,,新浪财经
1469,91016634,603899.XSHG,A,E,603899,晨光文具,XSHG,67053,2021-07-02 19:57:01,2021-07-02 19:57:04,0.426807194948,0.501179397106,2,0.71458299458,1,0.596541873356,2021-07-02 19:57:05,东吴证券维持晨光文具买入评级 预计2021年净利润同比增长24.66%,东吴证券7月2日发布研报，维持晨光文具买入评级。东吴证券预测，晨光文具2021年归母净利润15.65亿元，同比增长24.66%。,东方财富Choice数据,,东方财富网
1470,91016936,603899.XSHG,A,E,603899,晨光文具,XSHG,67053,2021-07-02 20:00:39,2021-07-02 20:00:43,0.00875444803387,0.989819943905,2,0.994197167922,1,0.595130746588,2021-07-02 20:00:44,东吴证券维持晨光文具买入评级，2021年中报业绩预告点评：业绩超市场预期，淡季不淡增长势头良好,东吴证券07月02日发布研报称，维持晨光文具9.SH，最新价：86.45元)买入评级。AI点评：晨光文具近一个月获得5份券商研报关注，买入5家，平均目标价为110元，与最新价86.45元相比，高23.55元，目标均价涨幅27.24%。,每日经济新闻,,腾讯网
1471,91017386,603899.XSHG,A,E,603899,晨光文具,XSHG,67053,2021-07-02 20:07:48,2021-07-02 20:07:51,0.010054199025,0.93365842104,2,0.938685520552,0,0.119867628813,2021-07-02 20:07:53,晨光文具2021年中报业绩预告点评：业绩超市场预期，淡季不淡增长势头良好（东吴证券）,21Q2归母净利润预告中枢为3.27亿元，环比21Q1基本持平，淡季不淡业绩增长势头向好，判断业绩超我们预期的原因主要在于渠道端持续优化及SKU单品贡献度提升带来销售效率的优化。,同花顺金融研究中心,,同花顺
1472,91018143,603899.XSHG,A,E,603899,晨光文具,XSHG,67053,2021-07-02 20:23:58,2021-07-02 20:24:10,0.000207822362427,0.999613463879,2,0.99971737506,1,0.564616453648,2021-07-02 20:24:10,晨光文具(603899)2021年中报业绩预告点评：业绩超市场预期 淡季不淡增长势头良好,21Q2 归母净利润预告中枢为3.27 亿元，环比21Q1 基本持平，淡季不淡业绩增长势头向好，判断业绩超我们预期的原因主要在于渠道端持续优化及SKU 单品贡献度提升带来销售效率的优化。,东吴证券股份有限公司,张潇/邹文婕,新浪财经
1473,91026678,603899.XSHG,A,E,603899,晨光文具,XSHG,67053,2021-07-02 23:41:51,2021-07-02 23:41:54,0.000196770852199,0.999662876129,2,0.999761261555,1,0.748751607537,2021-07-02 23:41:56,晨光文具(603899)：业绩预告好于预期 文具白马业绩持续稳健增长,业绩预告好于预期，文具白马业绩持续稳健增长。商场客流逐渐回暖，九木杂物社联合头部文创IP 打造爆款单品，门店销售同比改善，未来有望加速开店。,申银万国研究所,,财联社
1474,91027294,603899.XSHG,A,E,603899,晨光文具,XSHG,67053,2021-07-03 00:14:01,2021-07-03 00:14:02,0.440922319889,0.503050208092,2,0.723511368036,1,0.678456917405,2021-07-03 00:14:04,华创证券维持晨光文具强推评级 目标价106元,华创证券7月2日发布研报，维持晨光文具强推评级，目标价位106元。华创证券预测，晨光文具2021年归母净利润15.22亿元，同比增长21.23%。晨光文具近一个月获得10份券商研报关注，平均目标价为106.67元。,东方财富Choice数据,,新浪财经
1475,91040502,603899.XSHG,A,E,603899,晨光文具,XSHG,67053,2021-07-03 14:58:58,2021-07-03 14:58:59,0.893174767494,0.103042028844,1,0.549629412591,0,0.148922979832,2021-07-03 14:59:00,点评报告：中报预告略超预期，核心业务表现靓丽,截至报告期末，公司在全国拥有36家一级合作伙伴、覆盖1，200个城市的二、三级合作伙伴和大客户，超过8万家使用“晨光文具”店招的零售终端。归母净利润16.10/20.10/25.14亿元，同比增长28.24%/24.88%/25.06%。,浙商证券,,新浪财经
1476,91071697,603899.XSHG,A,E,603899,晨光文具,XSHG,67053,2021-07-04 00:00:00,2021-07-05 09:17:44,0.878996729851,0.0432205721736,1,0.482718937099,1,0.931658481061,2021-07-05 09:17:46,轻工制造行业：晨光文具、太阳纸业半年度业绩高增长 推荐关注敏华控股、浙江自然报告,本周发布两篇首次覆盖报告《敏华控股：功能沙发全球销量领先，多元拓展打开发展空间》，《浙江自然：海内外扩产打开增长空间，持续迭代输出优质产品》，建议关注。,天风证券股份有限公司,范张翔,新浪财经
1477,91049564,603899.XSHG,A,E,603899,晨光文具,XSHG,67053,2021-07-04 09:18:00,2021-07-04 09:18:02,0.443539381027,0.546237587929,2,0.768007278442,1,0.594978037737,2021-07-04 09:18:03,开源证券维持晨光文具买入(Buy)评级 预计2021年净利润同比增长21.07%,开源证券7月4日发布研报，维持晨光文具买入评级。开源证券预测，晨光文具2021年归母净利润15.2亿元，同比增长21.07%。,东方财富Choice数据,,东方财富网
1478,91049744,603899.XSHG,A,E,603899,晨光文具,XSHG,67053,2021-07-04 09:25:37,2021-07-04 09:30:57,0.0122107649222,0.986325323582,2,0.992430706043,1,0.928004314005,2021-07-04 09:30:59,开源证券维持晨光文具买入评级，公司信息更新报告：业绩预告超出预期，新五年战略顺利起步,开源证券07月03日发布研报称，维持晨光文具买入评级。调结构，稳增长，立足一体两翼，新五年战略顺利起步。AI点评：晨光文具近一个月获得6份券商研报关注，买入6家，平均目标价为110元。,每日经济新闻,,腾讯网
1479,91050728,603899.XSHG,A,E,603899,晨光文具,XSHG,67053,2021-07-04 10:32:15,2021-07-04 10:32:16,0.00663726776838,0.993299484253,2,0.996618118137,1,0.787662728131,2021-07-04 10:32:17,晨光文具(603899)点评报告：中报预告略超预期 核心业务表现靓丽,截至报告期末，公司在全国拥有36家一级合作伙伴、覆盖1，200个城市的二、三级合作伙伴和大客户，超过8万家使用“晨光文具”店招的零售终端。归母净利润16.10/20.10/ 25.14亿元，同比增长28.24%/24.88%/25.06%。,浙商证券股份有限公司,,腾讯网
1480,91051003,603899.XSHG,A,E,603899,晨光文具,XSHG,67053,2021-07-04 10:53:30,2021-07-04 10:53:34,0.708422720432,0.196109935641,1,0.550321295857,1,0.595375236813,2021-07-04 10:53:37,浙商证券维持晨光文具买入评级 预计2021年净利润同比增长28.24%,浙商证券7月4日发布研报，维持晨光文具买入评级。浙商证券预测，晨光文具2021年归母净利润16.1亿元，同比增长28.24%。,东方财富Choice数据,,东方财富网
1481,91051118,603899.XSHG,A,E,603899,晨光文具,XSHG,67053,2021-07-04 11:01:49,2021-07-04 11:01:50,0.00714286509901,0.992466390133,2,0.996037822682,1,0.787662728131,2021-07-04 11:01:52,晨光文具(603899)点评报告：中报预告略超预期 核心业务表现靓丽,截至报告期末，公司在全国拥有36家一级合作伙伴、覆盖1，200个城市的二、三级合作伙伴和大客户，超过8万家使用“晨光文具”店招的零售终端。归母净利润16.10/20.10/ 25.14亿元，同比增长28.24%/24.88%/25.06%。,,,新浪财经
1482,91051343,603899.XSHG,A,E,603899,晨光文具,XSHG,67053,2021-07-04 11:18:28,2021-07-04 11:18:29,0.00028672881308,0.999672174454,2,0.99981553886,1,0.598259708071,2021-07-04 11:18:32,晨光文具(603899)：业绩好于预期 新业务羽翼渐丰,晨光文具公布2021 年半年度业绩预增公告，预计2021H1 实现归母净利润6.1-7.0 亿元，同比增长31.0%-50.0%，扣非归母净利润5.5-6.2 亿元，同比增长42.0%-60.0%。,光大证券股份有限公司,,腾讯网
1483,91051382,603899.XSHG,A,E,603899,晨光文具,XSHG,67053,2021-07-04 11:20:46,2021-07-04 11:20:48,0.000268904084805,0.999680876732,2,0.999815328774,1,0.598259708071,2021-07-04 11:20:48,晨光文具(603899)：业绩好于预期 新业务羽翼渐丰,晨光文具公布2021 年半年度业绩预增公告，预计2021H1 实现归母净利润6.1-7.0 亿元，同比增长31.0%-50.0%，扣非归母净利润5.5-6.2 亿元，同比增长42.0%-60.0%。,光大证券股份有限公司,朱悦,新浪财经
1484,91051383,603899.XSHG,A,E,603899,晨光文具,XSHG,67053,2021-07-04 11:20:46,2021-07-04 11:20:48,0.000317536818329,0.999500870705,2,0.999659639114,1,0.820628685504,2021-07-04 11:20:48,晨光文具(603899)公司信息更新报告：业绩预告超出预期 新五年战略顺利起步,业绩预告超出市场预期，净利润维持较快增长，维持“买入”评级2021H1 公司预计实现归母净利润6.1 亿-7.0 亿元，同比增长31%至50%，相较2019H1 增长29.5%至48.6%。,开源证券股份有限公司,吕明,新浪财经
1485,91052765,603899.XSHG,A,E,603899,晨光文具,XSHG,67053,2021-07-04 13:40:21,2021-07-04 13:41:26,0.000317536818329,0.999500870705,2,0.999659639114,1,0.820628685504,2021-07-04 13:41:26,晨光文具(603899)公司信息更新报告：业绩预告超出预期 新五年战略顺利起步,业绩预告超出市场预期，净利润维持较快增长，维持“买入”评级2021H1 公司预计实现归母净利润6.1 亿-7.0 亿元，同比增长31%至50%，相较2019H1 增长29.5%至48.6%。,开源证券,,财联社
1486,91052769,603899.XSHG,A,E,603899,晨光文具,XSHG,67053,2021-07-04 13:40:21,2021-07-04 13:41:34,0.000284188310616,0.999675869942,2,0.999817964097,1,0.598259708071,2021-07-04 13:41:35,晨光文具(603899)：业绩好于预期 新业务羽翼渐丰,晨光文具公布2021 年半年度业绩预增公告，预计2021H1 实现归母净利润6.1-7.0 亿元，同比增长31.0%-50.0%，扣非归母净利润5.5-6.2 亿元，同比增长42.0%-60.0%。,光大证券,,财联社
1487,91054661,603899.XSHG,A,E,603899,晨光文具,XSHG,67053,2021-07-04 16:15:59,2021-07-04 16:16:01,0.652840435505,0.30997890234,1,0.636399120092,1,0.978651905432,2021-07-04 16:16:03,光大证券维持晨光文具增持评级 预计2021年净利润同比增长17.65%,光大证券7月4日发布研报，维持晨光文具增持评级。光大证券预测，晨光文具2021年归母净利润14.77亿元，同比增长17.65%。,东方财富Choice数据,,东方财富网
1488,91054793,603899.XSHG,A,E,603899,晨光文具,XSHG,67053,2021-07-04 16:23:40,2021-07-04 16:23:42,0.00391417415813,0.995918095112,2,0.997875182191,1,0.930161646754,2021-07-04 16:23:43,开源证券维持晨光文具买入评级，公司信息更新报告：业绩预告超出预期，新五年战略顺利起步,开源证券07月03日发布研报称，维持晨光文具买入评级。调结构，稳增长，立足一体两翼，新五年战略顺利起步。AI点评：晨光文具近一个月获得6份券商研报关注，买入6家，平均目标价为110元。,,每日经济新闻,搜狐财经
1489,91147639,603899.XSHG,A,E,603899,晨光文具,XSHG,67053,2021-07-05 00:00:00,2021-07-06 09:04:00,0.999807417393,8.70912044775e-05,1,0.499990799901,1,0.719855853915,2021-07-06 09:04:01,轻工制造行业周报：7月瓦楞箱板纸市场震荡偏下运行 成交或以刚需为主,月份瓦楞纸市场震荡偏下运行，成交或以刚需为主。从目前供需面来看，瓦楞纸市场供应压力仍存，终端需求释放有限，下游订单跟进不足，纸厂库存压力逐步显现，中小纸厂或存先行下调价格预期，加重市场观望心态。,山西证券股份有限公司,杨晶晶,新浪财经
1490,91087597,603899.XSHG,A,E,603899,晨光文具,XSHG,67053,2021-07-05 06:39:07,2021-07-05 11:59:58,0.0221729837358,0.958171963692,2,0.96925845556,1,0.598709286675,2021-07-05 12:00:00,【点评】晨光文具2021年中报业绩预增：业绩好于预期，新业务羽翼渐丰,传统业务 21Q2小幅超预期，预计Q2传统文具表现靓丽。晨光文具传统主业在行业内持续保持领先地位，近年通过产品结构升级、渠道运营效率提升，盈利能力持续提升，看好公司主业通过渠道下沉及单店运营实现进一步的扩张。,朝阳永续,,益盟操盘手
1491,91065856,603899.XSHG,A,E,603899,晨光文具,XSHG,67053,2021-07-05 08:05:21,2021-07-05 08:05:24,0.000223015769734,0.999734818935,2,0.99984632682,1,0.732874011993,2021-07-05 08:05:41,晨光文具：7月2日融资净买入436.18万元 环比增加6.14%,7月2日融资买入2041.16万元，融资偿还1604.98万元，融资净买入436.18万元，当前融资余额为1.38亿元。晨光文具7月2日融资融券余额较昨日增加606.92万元至1.46亿元。,同花顺金融研究中心,,同花顺
1492,91066744,603899.XSHG,A,E,603899,晨光文具,XSHG,67053,2021-07-05 08:12:28,2021-07-05 08:12:31,0.0308382380754,0.928451120853,2,0.943870239891,1,0.592142019104,2021-07-05 08:12:33,【晨光文具（603899.SH）】业绩好于预期，新业务羽翼渐丰——2021年中报业绩预增公告点评（朱悦）,晨光文具公布2021年半年度业绩预增公告，预计2021H1实现归母净利润6.1-7.0亿元，同比增长31.0%-50.0%，扣非归母净利润5.5-6.2亿元，同比增长42.0%-60.0%。,光大证券研究,,腾讯网
1493,91069012,603899.XSHG,A,E,603899,晨光文具,XSHG,67053,2021-07-05 08:48:47,2021-07-05 08:48:48,0.0253109931946,0.925812542439,2,0.938468039036,1,0.573161808401,2021-07-05 08:48:50,【晨光文具（603899.SH）】业绩好于预期，新业务羽翼渐丰——2021年中报业绩预增公告点评（朱悦）,【晨光文具（603899.SH）】业绩好于预期，新业务羽翼渐丰——2021年中报业绩预增公告点评（朱悦）,光大证券研究,,新浪财经
1494,91073119,603899.XSHG,A,E,603899,晨光文具,XSHG,67053,2021-07-05 09:34:40,2021-07-05 09:34:49,0.381948918104,0.552734434605,2,0.743708893657,1,0.398761034012,2021-07-05 09:34:49,光大证券调整晨光文具评级为增持,光大证券7月4日将晨光文具评级调整为增持，评级维持不变，2021年EPS预测由1.83元调整为1.59元。,财联社星矿,,财联社
1495,91080141,603899.XSHG,A,E,603899,晨光文具,XSHG,67053,2021-07-05 10:29:17,2021-07-05 10:29:34,0.999807655811,6.76990239299e-05,1,0.49997152693,1,0.568052604795,2021-07-05 10:29:37,周一机构一致看好的十大金股,预告21H1 归母净利润同比增长50%~80%，超出市场预期公司预告21H1 营收为32.65 亿元至39.19 亿元，同比增长50%~80%，归母净利润为2.76 亿元至3.31 亿元，同比增长50%~80%。,证券之星原创,,证券之星
1496,91080590,603899.XSHG,A,E,603899,晨光文具,XSHG,67053,2021-07-05 10:33:20,2021-07-05 10:33:35,0.999770104885,0.000133840920171,1,0.500018893363,1,0.705019370466,2021-07-05 10:33:38,券商评级：三大指数震荡 九股迎来掘金良机,券商评级：三大指数震荡 九股迎来掘金良机,证券之星原创,,证券之星
1497,91081777,603899.XSHG,A,E,603899,晨光文具,XSHG,67053,2021-07-05 10:46:27,2021-07-05 10:46:29,0.991784453392,0.000162506941706,1,0.496054733638,0,0.0224031686783,2021-07-05 10:46:29,每周盈利预测报告,每周盈利预测报告,,,新浪财经
1498,91146235,603899.XSHG,A,E,603899,晨光文具,XSHG,67053,2021-07-05 11:17:00,2021-07-06 08:49:10,0.916005373001,0.00371110439301,1,0.461713790894,0,-0.0237545251846,2021-07-06 08:49:13,18股获20家以上机构调研 传音控股最受关注！,从行业分布来看，上周机构关注度集中在电子行业，有12家上市公司接受调研。2021年一季度持续保持较好增长，营收同比增长99.34%，净利润同比增长125.93%。,九方智投,,东方财富网
1499,91084216,603899.XSHG,A,E,603899,晨光文具,XSHG,67053,2021-07-05 11:17:04,2021-07-05 11:17:14,0.999673247337,3.87855143344e-05,1,0.499875409183,1,0.568052604795,2021-07-05 11:17:17,周一机构一致看好的十大金股,预告21H1 归母净利润同比增长50%~80%，超出市场预期公司预告21H1 营收为32.65 亿元至39.19 亿元，同比增长50%~80%，归母净利润为2.76 亿元至3.31 亿元，同比增长50%~80%。,证券之星原创,佚名,中金在线
1500,91098436,603899.XSHG,A,E,603899,晨光文具,XSHG,67053,2021-07-05 15:01:55,2021-07-05 15:01:57,0.000366204214515,0.999591648579,2,0.999774750686,-1,-0.29095492363,2021-07-05 15:01:59,晨光文具：线下渠道称王，办公集采撑起4成营收，文创新业态连亏7年,相比之下，书写工具毛利率达到40.83%，学生文具毛利率达到33.43%，二者合计贡献了55%的毛利润。,,搜狐财经,搜狐财经
1501,91099674,603899.XSHG,A,E,603899,晨光文具,XSHG,67053,2021-07-05 15:17:44,2021-07-05 15:17:47,0.00022033485584,0.999764859676,2,0.999875027104,-1,-0.291807293892,2021-07-05 15:17:48,晨光文具：线下渠道称王 办公集采撑起4成营收 文创新业态连亏7年,相比之下，书写工具毛利率达到40.83%，学生文具毛利率达到33.43%，二者合计贡献了55%的毛利润。,搜狐网,,同花顺
1502,91104071,603899.XSHG,A,E,603899,晨光文具,XSHG,67053,2021-07-05 16:06:20,2021-07-05 16:06:26,0.000132862696773,0.999843478203,2,0.999909909551,-1,-0.284277224541,2021-07-05 16:06:29,晨光文具：线下渠道称王 办公集采撑起4成营收 文创新业态连亏7年,相比之下，书写工具毛利率达到40.83%，学生文具毛利率达到33.43%，二者合计贡献了55%的毛利润。,搜狐网,,新浪财经
1503,91106789,603899.XSHG,A,E,603899,晨光文具,XSHG,67053,2021-07-05 16:36:20,2021-07-05 16:36:24,0.999594032764,0.000171022024006,1,0.499968038406,1,0.623077774793,2021-07-05 16:36:26,轻工制造行业周报本周专题：轻工制造行业2021年中报业绩前瞻,2021H1 晨光文具预计录得营收74.4-76.9 亿元，同比增长56-61%，预计实现利润6.1-7.0 亿元，同比增长31-51%。,华创证券有限责任公司,刘佳昆/陈梦,新浪财经
1504,91107718,603899.XSHG,A,E,603899,晨光文具,XSHG,67053,2021-07-05 16:43:17,2021-07-05 16:43:20,0.732646942139,0.211133316159,1,0.577456787229,0,0.149676667899,2021-07-05 16:43:21,广博股份董秘回复：公司长期致力于品牌建设，通过加强产品质量控制、做好市场营销、提升用户体验、加强精益管理等各方面来提升公司品牌的知名度及影响力。经过多年的积累，公司品牌已进入国内综合文具供应商第一品牌的阵容，陆续中标了中海油、国家电网、中直,您好，公司长期致力于品牌建设，通过加强产品质量控制、做好市场营销、提升用户体验、加强精益管理等各方面来提升公司品牌的知名度及影响力。,证券之星智库,,证券之星
1505,91109543,603899.XSHG,A,E,603899,晨光文具,XSHG,67053,2021-07-05 17:03:04,2021-07-05 17:03:06,0.0219104308635,0.974245131016,2,0.985200346448,1,0.548090916872,2021-07-05 17:03:19,投资者提问：董秘您好，广博目前主营文具销售占比不小，对标晨光文具有很大的估...,您好，公司长期致力于品牌建设，通过加强产品质量控制、做好市场营销、提升用户体验、加强精益管理等各方面来提升公司品牌的知名度及影响力。,问董秘,,新浪财经
1506,91110373,603899.XSHG,A,E,603899,晨光文具,XSHG,67053,2021-07-05 17:10:00,2021-07-05 17:10:04,0.0286280885339,0.958037912846,2,0.972351957113,1,0.599289112296,2021-07-05 17:10:06,光大证券：维持晨光文具21/22/23 年净利润预测14.77/17.84/20.19亿元 维持“增持”评级,晨光文具公布2021 年半年度业绩预增公告，预计2021H1 实现归母净利润6.1-7.0 亿元，同比增长31.0%-50.0%，扣非归母净利润5.5-6.2 亿元，同比增长42.0%-60.0%。,光大证券,,东方财富网
1507,91111030,603899.XSHG,A,E,603899,晨光文具,XSHG,67053,2021-07-05 17:16:39,2021-07-05 17:16:40,0.138355910778,0.742258667946,2,0.811436623335,1,0.593644726411,2021-07-05 17:16:41,开源证券：预计晨光文具2021-2023 年归母净利润15.20/18.73/22.80 亿元 维持“买入”评级,业绩预告超出市场预期，净利润维持较快增长，维持“买入”评级2021H1 公司预计实现归母净利润6.1 亿-7.0 亿元，同比增长31%至50%，相较2019H1 增长29.5%至48.6%。,开源证券,,东方财富网
1508,91111359,603899.XSHG,A,E,603899,晨光文具,XSHG,67053,2021-07-05 17:20:23,2021-07-05 17:20:28,0.138355910778,0.742258667946,2,0.811436623335,1,0.593644726411,2021-07-05 17:20:29,开源证券：预计晨光文具2021-2023 年归母净利润15.20/18.73/22.80 亿元 维持“买入”评级,业绩预告超出市场预期，净利润维持较快增长，维持“买入”评级2021H1 公司预计实现归母净利润6.1 亿-7.0 亿元，同比增长31%至50%，相较2019H1 增长29.5%至48.6%。,开源证券,,腾讯网
1509,91112961,603899.XSHG,A,E,603899,晨光文具,XSHG,67053,2021-07-05 17:35:55,2021-07-05 17:35:56,0.523656785488,0.416874498129,1,0.678702890873,1,0.589961238243,2021-07-05 17:35:58,浙商证券：预计晨光文具21-23 年归母净利润16.10/20.10/ 25.14亿元 维持“买入”评级,公司发布21H1业绩预告：21H1归母净利润6.1-7.0亿元，同增31%-50%。截至报告期末，公司在全国拥有36家一级合作伙伴、覆盖1，200个城市的二、三级合作伙伴和大客户，超过8万家使用“晨光文具”店招的零售终端。,浙商证券,,东方财富网
1510,91118074,603899.XSHG,A,E,603899,晨光文具,XSHG,67053,2021-07-05 18:34:32,2021-07-05 18:34:34,0.201529324055,0.792245030403,2,0.89300969243,1,0.592709686905,2021-07-05 18:34:36,48股获机构买入型评级 晨光文具关注度最高,数据宝统计显示，48只个股今日获机构买入型评级。晨光文具关注度最高，共获3次机构买入型评级记录。,证券时报网,,东方财富网
1511,91118267,603899.XSHG,A,E,603899,晨光文具,XSHG,67053,2021-07-05 18:37:42,2021-07-05 18:37:43,0.390017211437,0.609177589417,2,0.804186195135,1,0.631843057275,2021-07-05 18:37:44,轻工制造行业双周报：半年报业绩预告开启 关注龙头业绩弹性,虽大宗商品提价对企业成本端形成压制，但考虑疫情趋缓后国内外需求的持续复苏，以及疫情期间中小企业出清带来的龙头市占率提升和去年同期低基数效应，家居企业业绩仍有望保持高增，关注龙头企业绩弹性。,华福证券有限责任公司,朱飞飞,新浪财经
1512,91118271,603899.XSHG,A,E,603899,晨光文具,XSHG,67053,2021-07-05 18:37:42,2021-07-05 18:37:43,0.994063556194,0.00555010931566,1,0.502581887413,1,0.574872215837,2021-07-05 18:37:44,轻工制造行业周报：晨光2021H业绩预增 看好床垫龙头慕思成长,慕思股 份招股书拆解，看好床垫龙头成长。公司旗下床垫与床架产品收入稳步增长，毛利率保持稳定。本轮由于进口减少形成的原材料缺口，叠加纸厂协同提价，使得废纸浆在淡季价格仍然坚挺。,华安证券股份有限公司,虞晓文,新浪财经
1513,91118388,603899.XSHG,A,E,603899,晨光文具,XSHG,67053,2021-07-05 18:39:28,2021-07-05 18:39:30,0.224077031016,0.770201146603,2,0.882239662111,1,0.592709686905,2021-07-05 18:39:31,48股获机构买入型评级 晨光文具关注度最高,数据宝统计显示，48只个股今日获机构买入型评级。晨光文具关注度最高，共获3次机构买入型评级记录。,证券时报网,阙福生,全景网
