,newsID,secID,equType,assetClass,ticker,secShortName,exchangeCD,partyID,newsPublishTime,newsInsertTime,degreeProp1St,degreeProp2St,relatedCompanyDegree,relatedCompanyScore,sentiment,sentimentScore,updateTime,newsTitle,newsSummary,newsOriginSource,newsAuthor,newsPublishSite
737,86198942,603899.XSHG,A,E,603899,晨光文具,XSHG,67053,2021-03-31 16:34:16,2021-03-31 16:34:18,0.00188897480257,0.99794536829,2,0.998889855691,1,0.947689228505,2021-03-31 18:41:18,晨光文具(603899)：20年业绩靓丽超预期 传统业务稳健 科力普高速增长,公司2020 年实现营业收入131.38 亿元，同比增长17.92%。归母净利润12.55亿元，同比增长18.43%。公司主要产品毛利率均显著提升，2020 年公司书写工具毛利率同比增长4.08pct 至40.83%。,中信建投证券股份有限公司,,腾讯网
738,86199742,603899.XSHG,A,E,603899,晨光文具,XSHG,67053,2021-03-31 16:43:20,2021-03-31 16:43:21,0.999972224236,4.63693459096e-06,1,0.499990749052,1,0.649086797237,2021-03-31 18:51:25,轻工行业周报：关注1-2月社零数据 轻工消费和住宅市场全面回弹,由于2020 年初疫情影响导致社零低基数，2021 年1-2 月轻工消费品零售额增速同比大幅回升，子行业回暖的幅度与先前受疫情冲击的程度大体一致：家具&gt。,山西证券股份有限公司,杨晶晶,新浪财经
739,86200415,603899.XSHG,A,E,603899,晨光文具,XSHG,67053,2021-03-31 16:49:33,2021-03-31 16:49:39,0.0449854470789,0.830357134342,2,0.852849857882,1,0.804399323463,2021-03-31 19:00:06,长城证券--晨光文具2020年报点评：下半年增长强劲业绩超预期 产品结构优化带动核心品类毛利率上行,实现归母净利润 12.55亿元，同比+18.43%。2020年公司毛利率同比-0.77pcpts 至 25.36%。分产品看，几大核心品类毛利率均有明显提升：书写工具毛利率同比+4.08pp 至 40.83%。,金融界,,同花顺
740,86200549,603899.XSHG,A,E,603899,晨光文具,XSHG,67053,2021-03-31 16:50:31,2021-03-31 16:50:40,0.999919891357,5.00468831888e-06,1,0.499964950367,1,0.632602459192,2021-03-31 19:02:03,上市公司日报：又逢年报披露时间节点 高分红成一大看点！茅台拿出一半盈利分红,两千亿市值白马股竟遭“业绩杀”。贵州茅台披露2020年年报，公司去年全年净利润为466.97亿元，同比增长13.33%。营收和权益净利润符合预期，需关注结算毛利率进入明显下降周期。,东方财富研究中心,,腾讯网
741,86207562,603899.XSHG,A,E,603899,晨光文具,XSHG,67053,2021-03-31 18:09:13,2021-03-31 18:09:16,0.22739341855,0.755414247513,2,0.869110956788,1,0.592390930727,2021-03-31 18:09:29,141股获机构买入型评级 晨光文具关注度最高,数据宝统计显示，141只个股今日获机构买入型评级。晨光文具关注度最高，共获9次机构买入型评级记录。,证券时报网,,全景网
742,86207678,603899.XSHG,A,E,603899,晨光文具,XSHG,67053,2021-03-31 18:10:33,2021-03-31 18:10:34,0.0883797109127,0.904936373234,2,0.94912622869,1,0.589518171847,2021-03-31 18:10:36,141股获机构买入型评级 晨光文具关注度最高,数据宝统计显示，141只个股今日获机构买入型评级。晨光文具关注度最高，共获9次机构买入型评级记录。,证券时报网,,和讯网
743,86210563,603899.XSHG,A,E,603899,晨光文具,XSHG,67053,2021-03-31 18:55:48,2021-03-31 18:55:50,0.592136561871,0.00233595282771,1,0.298404233763,0,-0.016346102953,2021-03-31 18:56:04,“板王”顺控发展收获17连板 西水股份将被“戴帽”,行业龙头股“茅18”集中披露年报。最让人瞩目还是2021年“板王”顺控发展，受“碳中和”主题热炒，今日再度涨停收获17连板。净利润同比下降的个股仅有2只，为福耀玻璃和上港集团。,数据宝,,新浪财经
744,86210636,603899.XSHG,A,E,603899,晨光文具,XSHG,67053,2021-03-31 18:56:44,2021-03-31 18:56:45,0.99949836731,0.000107628642581,1,0.499856812297,1,0.649086797237,2021-03-31 18:56:50,轻工行业周报：关注1-2月社零数据 轻工消费和住宅市场全面回弹,由于2020 年初疫情影响导致社零低基数，2021 年1-2 月轻工消费品零售额增速同比大幅回升，子行业回暖的幅度与先前受疫情冲击的程度大体一致：家具&gt。,山西证券,,东方财富网
745,86211718,603899.XSHG,A,E,603899,晨光文具,XSHG,67053,2021-03-31 19:08:27,2021-03-31 19:08:42,0.998955726624,0.000995820970275,1,0.500473684282,0,-0.016346102953,2021-03-31 19:08:54,行业龙头股“茅18”集中披露 增幅最高的是有色板块龙头,2021年一季度即将结束，A股市场迎来年报集中披露期。净利润同比下降的个股仅有2只，为福耀玻璃和上港集团。贵州茅台再现大手笔分红，对全体股东每10股派现192.93元，共分配利润242.36亿元，是茅台史上金额最大的一次分红。,腾讯自选股,,新浪财经
746,86211933,603899.XSHG,A,E,603899,晨光文具,XSHG,67053,2021-03-31 19:12:50,2021-03-31 19:12:54,0.224133253098,0.758797168732,2,0.87086379528,1,0.591597614735,2021-03-31 19:12:56,141股获机构买入型评级 晨光文具关注度最高,证券时报数据宝统计显示，141只个股今日获机构买入型评级。晨光文具关注度最高，共获9次机构买入型评级记录。,证券时报网,,腾讯网
747,86212245,603899.XSHG,A,E,603899,晨光文具,XSHG,67053,2021-03-31 19:19:11,2021-03-31 19:19:13,0.998955726624,0.000995820970275,1,0.500473684282,0,-0.016346102953,2021-03-31 19:19:14,行业龙头股“茅18”集中披露 增幅最高的是有色板块龙头,2021年一季度即将结束，A股市场迎来年报集中披露期。净利润同比下降的个股仅有2只，为福耀玻璃和上港集团。贵州茅台再现大手笔分红，对全体股东每10股派现192.93元，共分配利润242.36亿元，是茅台史上金额最大的一次分红。,第一财经,,腾讯网
748,86214706,603899.XSHG,A,E,603899,晨光文具,XSHG,67053,2021-03-31 20:00:13,2021-03-31 20:00:21,0.726293683052,0.00827146042138,1,0.371418301947,0,-0.016346102953,2021-03-31 20:00:26,“板王”顺控发展收获17连板 西水股份将被“戴帽”,行业龙头股“茅18”集中披露年报。最让人瞩目还是2021年“板王”顺控发展，受“碳中和”主题热炒，今日再度涨停收获17连板。净利润同比下降的个股仅有2只，为福耀玻璃和上港集团。,数据宝,,腾讯网
749,86218233,603899.XSHG,A,E,603899,晨光文具,XSHG,67053,2021-03-31 20:56:48,2021-03-31 20:56:50,0.000133521767566,0.999642848969,2,0.999709609852,1,0.848130230606,2021-03-31 20:56:52,晨光文具(603899)：业绩靓丽成长无忧 产品结构持续提升,传统文具产品升级带动盈利性提升，渠道优化升级推进卓有成效：20 年传统核心业务收入为75.8 亿元，同比增长9.1%，由于产品结构的升级带来公司整体盈利性的持续提升。,海通证券股份有限公司,,腾讯网
750,86219040,603899.XSHG,A,E,603899,晨光文具,XSHG,67053,2021-03-31 21:08:17,2021-03-31 21:08:21,5.32455487701e-05,0.999912142754,2,0.999938765528,1,0.917338386178,2021-03-31 21:08:22,晨光文具(603899)：业绩靓丽成长无忧 产品结构持续提升,传统文具产品升级带动盈利性提升，渠道优化升级推进卓有成效：20 年传统核心业务收入为75.8 亿元，同比增长9.1%，由于产品结构的升级带来公司整体盈利性的持续提升。,海通证券股份有限公司,,新浪财经
751,86226066,603899.XSHG,A,E,603899,晨光文具,XSHG,67053,2021-03-31 23:23:13,2021-03-31 23:23:17,0.0887012407184,0.835301160812,2,0.879651781172,0,0.0500669822097,2021-03-31 23:23:30,技术解析：晨光文具（603899），未来五年有翻倍机会？,2020年中报显示营业收入47.61亿元，同比增加-1.60%，净利润为4.49亿元，同比增加-5.42%。2020年三季度营业收入37.76亿元，同比增加21.48%，净利润为4.45亿元，同比增加31.70%。,,眼镜说历史,搜狐财经
752,86227930,603899.XSHG,A,E,603899,晨光文具,XSHG,67053,2021-04-01 00:41:35,2021-04-01 00:41:37,0.00063468067674,0.999121129513,2,0.999438469851,1,0.686904619634,2021-04-01 00:41:44,估值解析：晨光文具（603899）未来3年有望5倍价值股？,今天阅读了晨光文具最近几年的财务报表，有点悔恨当初没有关注这家企业。亡羊补牢，为时不晚，像晨光文具这样的优秀企业，未来仍然值得跟踪。增长迅猛且稳定，文具行业中的贵州茅台。,,小丽旅游,搜狐财经
753,86227947,603899.XSHG,A,E,603899,晨光文具,XSHG,67053,2021-04-01 00:41:35,2021-04-01 00:41:43,0.659592449665,0.00975354667753,1,0.33954977151,0,-0.00805955529213,2021-04-01 00:41:50,价值解析：浙江美大（002677），未来3年翻倍的机会有多大？,在这样的竞争格局下，以差异化竞争策略崛起的浙江美大保持了非常高的增长势头，并且企业的毛利率水平呈现出了稳健增长的态势。这致使企业根本没有一分钱的借款，所赚来的净利润全部是自家股东享有。,,小丽旅游,搜狐财经
754,86237942,603899.XSHG,A,E,603899,晨光文具,XSHG,67053,2021-04-01 08:13:33,2021-04-01 08:13:44,0.000261781329755,0.999681591988,2,0.999812482652,1,0.659792512655,2021-04-01 08:13:52,晨光文具：3月31日融资净买入214.84万元 上一交易日净偿还1612.92万元,3月31日融资买入1014.05万元，融资偿还799.21万元，融资净买入214.84万元，当前融资余额为1.29亿元。晨光文具3月31日融资融券余额较昨日减少27.84万元至1.38亿元。,同花顺金融研究中心,,同花顺
755,86238909,603899.XSHG,A,E,603899,晨光文具,XSHG,67053,2021-04-01 08:30:54,2021-04-01 08:30:54,0.0295024104416,0.969442784786,2,0.984193990007,1,0.747849935293,2021-04-01 08:31:01,晨光文具(603899)点评报告：年报表现靓丽 传统业务盈利能力持续提升,公司传统业务表现靓丽，维持量利齐升，20Q4收入增长环比提速。期间公司毛利率下滑主要系零售大店业务和上海安硕因疫情导致的亏损，公司核心业务盈利能力稳健，21 年随着疫情影响减弱，公司盈利水平将有望提升。,,,新浪财经
756,86251673,603899.XSHG,A,E,603899,晨光文具,XSHG,67053,2021-04-01 10:26:16,2021-04-01 10:26:18,0.110417090356,0.888745486736,2,0.943954031914,1,0.638482882082,2021-04-01 10:26:30,晨光文具(603899)：Q4高增长 文创巨头稳步前行,2020 年公司实现营收131.4 亿元，同比增长17.9%。实现归母净利润12.6 亿元，同比增长18.4%。公司综合毛利率25.4%，同比下滑0.7ct。,,,新浪财经
757,86268172,603899.XSHG,A,E,603899,晨光文具,XSHG,67053,2021-04-01 14:10:57,2021-04-01 14:10:58,0.993630707264,8.21687808639e-06,1,0.49682357051,1,0.649086797237,2021-04-01 14:11:03,山西证券--轻工制造行业周报：关注1-2月社零数据，轻工消费和住宅市场全面回弹【行业研究】,由于2020年初疫情影响导致社零低基数，2021年1-2月轻工消费品零售额增速同比大幅回升，子行业回暖的幅度与先前受疫情冲击的程度大体一致：家具&gt。,山西证券,,金融界
758,86272778,603899.XSHG,A,E,603899,晨光文具,XSHG,67053,2021-04-01 15:11:50,2021-04-01 15:11:51,0.97418230772,0.00165752146859,1,0.488748675329,1,0.59647372067,2021-04-01 15:11:52,山西证券--轻工制造行业周报：关注1-2月社零数据 轻工消费和住宅市场全面回弹,由于2020年初疫情影响导致社零低基数，2021年1-2月轻工消费品零售额增速同比大幅回升，子行业回暖的幅度与先前受疫情冲击的程度大体一致：家具&gt。,金融界,,同花顺
759,86276794,603899.XSHG,A,E,603899,晨光文具,XSHG,67053,2021-04-01 15:56:36,2021-04-01 15:56:37,0.955315589905,0.000720640760846,1,0.478378435713,1,0.649086797237,2021-04-01 15:56:38,山西证券--轻工制造行业周报：关注1-2月社零数据 轻工消费和住宅市场全面回弹,由于2020年初疫情影响导致社零低基数，2021年1-2月轻工消费品零售额增速同比大幅回升，子行业回暖的幅度与先前受疫情冲击的程度大体一致：家具&gt。,金融界,,新浪财经
760,86283659,603899.XSHG,A,E,603899,晨光文具,XSHG,67053,2021-04-01 17:08:07,2021-04-01 17:08:17,0.963482320309,0.00171655789018,1,0.483457718045,0,0.0527498483658,2021-04-01 17:08:23,深度分析：三一重工——股价大跌后，投资者不可不知的4件事,期间公司归母净利润从2.03亿元提升到154.31亿元，年复合增速达195.27%。灯塔工厂是制造业数字化转型方式之一。国内市场销量达到24562台，同比增长255.5%，挖掘机出口销量3743台，同比增长57.9%，出口逐月恢复超预期。,,双双手机科技,搜狐财经
761,86291623,603899.XSHG,A,E,603899,晨光文具,XSHG,67053,2021-04-01 18:41:16,2021-04-01 18:41:25,0.000525899406057,0.999423742294,2,0.999686691997,1,0.967155546695,2021-04-01 19:36:39,晨光文具2020年总营收131.38亿元，同比增长17.92%,聚焦“大客户”、“大品类”、“大平台”重点开发与突破，全面推动国内重点大型办公终端客户的开发。晨光零售大店在过去一年稳步发展，积极打造精品文创店组货和服务模式，全面发展九木杂物社，试点优化晨光生活馆。,美通社,,腾讯网
762,86291872,603899.XSHG,A,E,603899,晨光文具,XSHG,67053,2021-04-01 18:43:16,2021-04-01 18:43:22,0.000214018655242,0.999721825123,2,0.99982883445,1,0.982988926955,2021-04-01 19:39:01,晨光文具2020年总营收131.38亿元，同比增长17.92%,上海2021年4月1日 /美通社/ -- 3月29日，晨光文具公布了2020年年度报告，数据显示，2020年晨光文具实现营业收入131.38亿元，同比增长17.92%，归属于上市公司股东的净利润为12.55亿元，同比增长18.43%。,美通社,,新浪财经
763,86292888,603899.XSHG,A,E,603899,晨光文具,XSHG,67053,2021-04-01 18:56:56,2021-04-01 18:56:57,0.000506947108079,0.999331116676,2,0.99958459023,1,0.982434412837,2021-04-01 18:57:00,晨光文具2020年总营收131.38亿元 同比增长17.92%,晨光文具公布了2020年年度报告，数据显示，2020年晨光文具实现营业收入131.38亿元，同比增长17.92%，归属于上市公司股东的净利润为12.55亿元，同比增长18.43%。,美通社,,东方财富网
764,86294560,603899.XSHG,A,E,603899,晨光文具,XSHG,67053,2021-04-01 19:18:50,2021-04-01 19:18:52,0.000525899406057,0.999423742294,2,0.999686691997,1,0.967155546695,2021-04-01 19:18:56,晨光文具2020年总营收131.38亿元，同比增长17.92%,上海2021年4月1日 /美通社/ -- 3月29日，晨光文具公布了2020年年度报告，数据显示，2020年晨光文具实现营业收入131.38亿元，同比增长17.92%，归属于上市公司股东的净利润为12.55亿元，同比增长18.43%。,,全球商业资讯,搜狐财经
765,86295339,603899.XSHG,A,E,603899,晨光文具,XSHG,67053,2021-04-01 19:30:27,2021-04-01 19:30:29,0.00561180990189,0.991551399231,2,0.994357304182,1,0.967155546695,2021-04-01 19:30:31,晨光文具2020年总营收131.38亿元，同比增长17.92%,上海2021年4月1日 /美通社/ -- 3月29日，晨光文具公布了2020年年度报告，数据显示，2020年晨光文具实现营业收入131.38亿元，同比增长17.92%，归属于上市公司股东的净利润为12.55亿元，同比增长18.43%。,,,金融界
766,86356456,603899.XSHG,A,E,603899,晨光文具,XSHG,67053,2021-04-02 16:27:12,2021-04-02 16:27:24,0.000521088775713,0.999366223812,2,0.9996267682,1,0.95994678773,2021-04-02 16:27:27,晨光文具：2020年营收超130亿，拥有零售大店超440家,文具行业“自主品牌+内需市场”的领跑者晨光文具公布了其2020年年度报告，数据显示，2020年晨光文具实现营业收入131.38亿元，同比增长17.92%，归属于上市公司股东的净利润为12.55亿元，同比增长18.43%。,览富财经网,,新浪财经
767,86356929,603899.XSHG,A,E,603899,晨光文具,XSHG,67053,2021-04-02 16:32:42,2021-04-02 16:32:44,0.365825176239,0.629318892956,2,0.812231481075,1,0.520061141253,2021-04-02 16:32:47,晨光文具(603899)：20Q4营收同比高增44% 科力普、晨光科技成绩靓丽,晨光文具(603899)：20Q4营收同比高增44% 科力普、晨光科技成绩靓丽,山西证券股份有限公司,杨晶晶,新浪财经
768,86357046,603899.XSHG,A,E,603899,晨光文具,XSHG,67053,2021-04-02 16:34:13,2021-04-02 16:34:17,0.000458411377622,0.999524831772,2,0.999754037461,1,0.957506491244,2021-04-02 16:34:18,晨光文具：2020年营收超130亿，拥有零售大店超440家,文具行业“自主品牌+内需市场”的领跑者晨光文具公布了其2020年年度报告，数据显示，2020年晨光文具实现营业收入131.38亿元，同比增长17.92%，归属于上市公司股东的净利润为12.55亿元，同比增长18.43%。,览富财经网,,腾讯网
769,86388137,603899.XSHG,A,E,603899,晨光文具,XSHG,67053,2021-04-03 14:19:33,2021-04-03 14:19:51,0.996430754662,0.00347621995024,1,0.501691597281,0,-0.016346102953,2021-04-03 14:19:52,大牛证券平台行业龙头股集中披露业绩,2021年一季度已结束，A股市场迎来年报集中披露期。净利润同比下降的个股仅有2只，为福耀玻璃和上港集团。,,电玩网游圈,搜狐财经
770,86394385,603899.XSHG,A,E,603899,晨光文具,XSHG,67053,2021-04-04 04:34:12,2021-04-04 04:34:20,0.140075653791,0.803415477276,2,0.873453304172,1,0.577491679788,2021-04-04 04:34:24,价值分析：晨光文具，行业龙头投资价值有多大？,2020年疫情冲击下，晨光文具净利润12.55亿逆势增长18%，再创新高。零售大店当前晨光一边发展九木杂物社，一边试点优化晨光生活馆，旗舰大店作为公司传统核心业务产品升级和渠道升级的桥头堡，推动公司从文具到文创生活的升级转型。,,清清动漫房,搜狐财经
771,86399909,603899.XSHG,A,E,603899,晨光文具,XSHG,67053,2021-04-04 14:07:43,2021-04-04 14:08:04,0.863194346428,0.00959578249604,1,0.44119295571,0,-0.00805955529213,2021-04-04 14:08:08,技术分析：浙江美大（002677）后市还有多少潜力？,在这样的竞争格局下，以差异化竞争策略崛起的浙江美大保持了非常高的增长势头，并且企业的毛利率水平呈现出了稳健增长的态势。这致使企业根本没有一分钱的借款，所赚来的净利润全部是自家股东享有。,,婷婷端游游戏,搜狐财经
772,86433729,603899.XSHG,A,E,603899,晨光文具,XSHG,67053,2021-04-05 00:00:00,2021-04-06 09:10:17,0.40401044488,0.592265188694,2,0.794270411134,1,0.444873917103,2021-04-06 09:10:19,轻工制造行业周报：纸浆期货企稳 白卡涨价顺利落地,木浆系方面，本周纸浆期货小幅上行，白卡行业格局向好，寡头垄断格局下白卡纸厂议价能力提高，前期涨价函顺利落地。,华福证券有限责任公司,朱飞飞,新浪财经
773,86412565,603899.XSHG,A,E,603899,晨光文具,XSHG,67053,2021-04-05 15:05:20,2021-04-05 15:05:23,0.999684929848,0.000272616482107,1,0.500115081406,0,0.112556238472,2021-04-05 15:05:25,中国股市：A股最为优质的7只消费龙头股！,公司位于四川省宜宾市，主要从事“五粮液”及其系列白酒的生产和销售。公司是国内调味品领域龙头企业，酱油产品市场占有率第一。公司是中国家电综合实力排名第一品牌。,,小李游戏专家,搜狐财经
774,86418669,603899.XSHG,A,E,603899,晨光文具,XSHG,67053,2021-04-05 20:47:36,2021-04-05 20:47:38,0.793012738228,0.00250277994201,1,0.399009149056,1,0.584237569571,2021-04-05 20:47:41,产业互联网周报 | 京东数科终止科创板IPO 嘉立创融资5亿,京东数字科技控股股份有限公司终止科创板IPO。归属于上市公司股东的净利润3.04亿元，同比增长91.57%。工业AI企业“中科迪宏”近日宣布完成新一轮千万美元级融资。,,,亿邦动力网
775,86429322,603899.XSHG,A,E,603899,晨光文具,XSHG,67053,2021-04-06 08:13:06,2021-04-06 08:13:08,0.000235798448557,0.999714076519,2,0.999831975743,1,0.678765758872,2021-04-06 08:13:18,晨光文具：4月2日融资净偿还792.95万元 上一交易日净买入29.83万元,4月2日融资买入639.14万元，融资偿还1432.10万元，融资净偿还792.95万元，当前融资余额为1.21亿元。晨光文具4月2日融资融券余额较昨日减少613.54万元至1.31亿元。,同花顺金融研究中心,,同花顺
776,86440474,603899.XSHG,A,E,603899,晨光文具,XSHG,67053,2021-04-06 10:10:41,2021-04-06 10:10:42,0.95517385006,0.0306425374001,1,0.50822946243,0,-0.0161855518818,2021-04-06 10:10:45,高乐股份早盘跳水5.16% 量比达10.72,2021年04月06日早盘09时48分，高乐股份出现异动，股价大幅下跌5.16%。广博股份，高乐股份，舒华体育较为活跃，换手率分别为8.3%、5.8%及4.1%。,自选股智能写手,,腾讯网
777,86444002,603899.XSHG,A,E,603899,晨光文具,XSHG,67053,2021-04-06 10:49:07,2021-04-06 10:49:08,0.972260951996,0.0216089822352,1,0.507739458233,0,-0.00858181118965,2021-04-06 10:49:10,高乐股份股价拉升6.35% 股价创3月新高,2021年04月06日早盘10时26分，高乐股份出现异动，股价大幅拉升6.35%，创3月新高。广博股份，高乐股份，舒华体育较为活跃，换手率分别为11.2%、9.5%及6.1%。,自选股智能写手,,腾讯网
778,86445679,603899.XSHG,A,E,603899,晨光文具,XSHG,67053,2021-04-06 11:08:57,2021-04-06 11:08:58,0.910070240498,0.0456383004785,1,0.500673420727,0,-0.0114676773548,2021-04-06 11:09:01,德艺文创盘中异动 早盘拉升5.01%,2021年04月06日早盘10时10分，德艺文创出现异动，股价大幅拉升5.01%。过去一年内该股有1次涨停，涨停后第二交易日涨1次，跌0次，涨占比100%。,自选股智能写手,,腾讯网
779,86453020,603899.XSHG,A,E,603899,晨光文具,XSHG,67053,2021-04-06 13:15:53,2021-04-06 13:15:55,0.99110865593,0.00436514057219,1,0.499919468537,0,-0.00786666870117,2021-04-06 13:16:04,氢能源概念爆发！厚普股份等多股批量涨停 碳中和龙头21连板 疯狂炒作何时休,氢能源按生产来源划分，可以分为“灰氢”“蓝氢”和“绿氢”三类。上市以来一直涨停的顺控发展已21连板，从上市第七日涨停打开后回封涨停计算，顺控发展连续15个交易日涨停。,中国证券报,,同花顺
780,86453379,603899.XSHG,A,E,603899,晨光文具,XSHG,67053,2021-04-06 13:20:09,2021-04-06 13:20:10,0.981957435608,0.00269583240151,1,0.493674550205,0,0.0358245372772,2021-04-06 13:20:21,氢能源概念爆发！厚普股份等多股批量涨停，碳中和龙头21连板，疯狂炒作何时休,氢能源按生产来源划分，可以分为“灰氢”“蓝氢”和“绿氢”三类。上市以来一直涨停的顺控发展已21连板，从上市第七日涨停打开后回封涨停计算，顺控发展连续15个交易日涨停。,,,金融界
781,86453399,603899.XSHG,A,E,603899,晨光文具,XSHG,67053,2021-04-06 13:20:34,2021-04-06 13:20:37,0.888701021671,0.0102197248489,1,0.454570235685,0,0.0123086750507,2021-04-06 13:20:44,氢能源概念爆发:厚普股份等多股批量涨停 碳中和龙头21连板,氢能源按生产来源划分，可以分为“灰氢”“蓝氢”和“绿氢”三类。上市以来一直涨停的顺控发展已21连板，从上市第七日涨停打开后回封涨停计算，顺控发展连续15个交易日涨停。,中国证券报,,新浪财经
782,86453513,603899.XSHG,A,E,603899,晨光文具,XSHG,67053,2021-04-06 13:23:54,2021-04-06 13:23:55,0.990532517433,0.0056984545663,1,0.500964713283,0,-0.0108945906162,2021-04-06 13:24:01,氢能源概念爆发！厚普股份等多股批量涨停 碳中和龙头21连板 疯狂炒作何时休,氢能源按生产来源划分，可以分为“灰氢”“蓝氢”和“绿氢”三类。上市以来一直涨停的顺控发展已21连板，从上市第七日涨停打开后回封涨停计算，顺控发展连续15个交易日涨停。,中国证券报,,东方财富网
783,86454960,603899.XSHG,A,E,603899,晨光文具,XSHG,67053,2021-04-06 13:47:32,2021-04-06 13:47:35,0.998485982418,0.00114844646305,1,0.500391437672,1,0.754498943686,2021-04-06 13:47:42,轻工行业双周报：文化纸小幅提价 家居延续景气,近期浆价高位盘整，针叶期货价格维持7106 元/吨，现货针叶浆价格为7050 元/吨，现货阔叶浆价格为5541 元/吨，较今年来的高点小幅回落。,西南证券股份有限公司,蔡欣,新浪财经
784,86455334,603899.XSHG,A,E,603899,晨光文具,XSHG,67053,2021-04-06 13:55:23,2021-04-06 13:55:28,0.996572852135,0.00073585123755,1,0.499022277305,0,-0.0109086751938,2021-04-06 13:55:33,氢能源概念爆发！厚普股份等多股批量涨停，碳中和龙头21连板，疯狂炒作何时休,氢能源按生产来源划分，可以分为“灰氢”“蓝氢”和“绿氢”三类。上市以来一直涨停的顺控发展已21连板，从上市第七日涨停打开后回封涨停计算，顺控发展连续15个交易日涨停。,中国证券报,,腾讯网
785,86456438,603899.XSHG,A,E,603899,晨光文具,XSHG,67053,2021-04-06 14:12:03,2021-04-06 14:12:04,0.99994623661,1.41372838698e-05,1,0.499987255589,0,0.147679409385,2021-04-06 14:12:20,轻工制造行业周报：继续推荐大家居产业链 关注一季报业绩超预期标的,地产竣工回暖、龙头市占率提升、终端订单良好背景下，家居企业将持续迎接β+α双击。晨光文具发布年报，Q4 实现营业收入46.00 亿元，实现归母净利润3.43 亿元，推荐传统回升、科力普放量、 Q4 业绩超预期的晨光文具。,德邦证券股份有限公司,花小伟/毕先磊,新浪财经
