,newsID,secID,equType,assetClass,ticker,secShortName,exchangeCD,partyID,newsPublishTime,newsInsertTime,degreeProp1St,degreeProp2St,relatedCompanyDegree,relatedCompanyScore,sentiment,sentimentScore,updateTime,newsTitle,newsSummary,newsOriginSource,newsAuthor,newsPublishSite
494,86024396,603233.XSHG,A,E,603233,大参林,XSHG,12452,2021-03-29 14:18:59,2021-03-29 14:19:05,0.999942779541,2.21816389967e-05,1,0.49999357141,1,0.599078126465,2021-03-29 14:19:12,医药生物行业报告：业绩预期的修正与再修正,中国新冠疫苗接种加速推进，截至2021 年3 月25 日，各地累计报告接种新冠病毒疫苗9134.6 万剂次。随着市场整体情绪企稳，医药细分龙头公司大幅反弹，上周医药生物板块上涨3.25%，年初至今板块下跌4.5%。,天风证券股份有限公司,杨松,新浪财经
495,89151733,603233.XSHG,A,E,603233,大参林,XSHG,12452,2021-03-29 21:30:53,2021-05-28 09:07:43,0.666704893112,0.0644684582949,1,0.397820904851,0,0.0400109693408,2021-05-28 09:07:46,互联网战争机器美团财报发布，未来焦点集中在社区团购,他投入了一场场互联网的战争，就是一台永不停歇的战争机器！新业务实现营业收入 92 亿元，同比增长 52%，环比增长 12%，主要就是社区团购，在公司里增速最快，就像一个从外太空飞来地球的奥特曼一样，比较惊艳。,,福男牛,东方财富号
496,86071901,603233.XSHG,A,E,603233,大参林,XSHG,12452,2021-03-30 07:50:27,2021-03-30 07:50:46,0.0685238316655,0.629709780216,2,0.663971696049,0,-0.0185252159834,2021-03-30 07:51:05,大参林：融资净偿还741.21万元，融资余额1.37亿元（03-29）,2021年3月29日大参林融资净偿还741.21万元，融资余额1.37亿元,东方财富Choice数据,财智星,东方财富网
497,86089539,603233.XSHG,A,E,603233,大参林,XSHG,12452,2021-03-30 10:41:03,2021-03-30 10:41:05,0.998724043369,0.00123329879716,1,0.500595320482,1,0.611110657454,2021-03-30 10:41:09,区域连锁“觉醒”，要用加盟模式对抗外来“势力”？,除了老百姓、大参林、益丰等上市连锁不断加码加盟模式外，高济医疗开始发力，现在又有地区龙头正式启动加盟模式。取消开办药品经营企业的筹建审批，由原来的“先筹建”“后验收”的两个审批流程合并为“新开办”一个流程，实现“一步准营”。,21世纪药店,,米内
498,86091939,603233.XSHG,A,E,603233,大参林,XSHG,12452,2021-03-30 11:04:04,2021-03-30 11:04:06,0.999908685684,6.10751085333e-05,1,0.500015417951,1,0.820562782139,2021-03-30 11:04:09,中医药振兴再获助推龙头医药零售连锁迎来机遇,机构称龙头连锁药店有望凭借自有中药业务基础及中医馆布局优势实现快速推进短期有望通过中药销售及付费诊疗增厚业绩中药中医业务加速布局的医药零售连锁龙头益丰药房大参林老百姓一心堂将受益,第一财经,,第一财经
499,86103816,603233.XSHG,A,E,603233,大参林,XSHG,12452,2021-03-30 14:15:03,2021-03-30 14:15:04,0.999981880188,1.73077535237e-06,1,0.499992670869,1,0.734681901336,2021-03-30 14:15:12,十四五规划支持中医药特色创新发展中医药概念股受益走强,在十四五时期将从多个层面来谋划和开展工作支持中医药的振兴发展实施中医药特色人才培养工程岐黄工程,,,金融界
500,86123155,603233.XSHG,A,E,603233,大参林,XSHG,12452,2021-03-30 18:16:32,2021-03-30 18:16:38,0.999981880188,1.73077535237e-06,1,0.499992670869,1,0.734681901336,2021-03-30 18:27:53,「十四五」规划支持中医药特色创新发展 中医药概念股受益走强,在「十四五」时期将从多个层面来谋划和开展工作，支持中医药的振兴发展。中医药管理局实施了基层中医药服务能力提升工程“十三五”行动计划，推动3万多个社区卫生服务中心和乡镇卫生院设置中医综合服务区，并实施基层中医馆健康信息平台建设项目。,财华社,,东方财富网
501,86187426,603233.XSHG,A,E,603233,大参林,XSHG,12452,2021-03-31 14:09:53,2021-03-31 14:10:18,0.998817503452,0.00101216963958,1,0.500420921366,1,0.734095099568,2021-03-31 17:27:02,中医药重磅政策要来了上市连锁全线飘红,童涵春堂将养生融于年轻人热衷的奶茶推出了中西结合的养生中药系列奶茶让年轻人在享受美味的同时减少身体负担童涵春堂则通过茶饮与年轻用户产生高频链接将低频中药概念变成了高频的养生消费实现了品牌延续消费不断层,21世纪药店,,米内
502,86191091,603233.XSHG,A,E,603233,大参林,XSHG,12452,2021-03-31 14:58:58,2021-03-31 14:59:00,0.999926686287,4.0523314965e-05,1,0.500003866458,0,0.161979208887,2021-03-31 17:27:53,2021年医药股投资，业内看好这四大领域,除了申万医药指数上涨外，根据东方财富研究中心数据显示，近期港股医药股在持续走强。,制药网,,中国制药网
503,86209992,603233.XSHG,A,E,603233,大参林,XSHG,12452,2021-03-31 18:43:41,2021-03-31 18:43:42,0.999902129173,5.17417720403e-05,1,0.500002806359,0,0.108167150617,2021-03-31 18:43:45,生物医药2021一季度业绩前瞻：行业整体表现优异 核心板块快速增长,投资要点2021Q1 医药行业有望实现高增速：2020 年一季度新冠疫情暴发，医药行业受到不同程度的影响。,平安证券股份有限公司,叶寅/倪亦道/韩盟盟/李颖睿,新浪财经
504,86236524,603233.XSHG,A,E,603233,大参林,XSHG,12452,2021-04-01 07:58:25,2021-04-01 07:58:49,0.0700313597918,0.645639717579,2,0.680655397475,1,0.737892320752,2021-04-01 07:58:55,大参林：融资净买入188.92万元，融资余额1.38亿元（03-31）,2021年3月31日大参林融资净买入188.92万元，融资余额1.38亿元,东方财富Choice数据,财智星,东方财富网
505,86238769,603233.XSHG,A,E,603233,大参林,XSHG,12452,2021-04-01 08:28:29,2021-04-01 08:28:31,0.949521541595,0.00151687092148,1,0.476277641719,0,0.108167150617,2021-04-01 08:28:34,平安证券--生物医药行业动态跟踪报告：2021一季度业绩前瞻，行业整体表现优异，核心板块快速增长【行业研究】,2021Q1医药行业有望实现高增速：2020年一季度新冠疫情暴发，医药行业受到不同程度的影响。随着疫情得到有效控制，疫苗接种工作的有序展开，进入 2021年，我国医药企业基本已恢复正常生产经营，医药行业 2021年整体有望实现快速增长。,平安证券,,金融界
506,86239941,603233.XSHG,A,E,603233,大参林,XSHG,12452,2021-04-01 08:40:46,2021-04-01 08:40:48,0.938569128513,0.0195221360773,1,0.488806700334,0,0.102030929923,2021-04-01 08:42:16,平安证券--生物医药行业动态跟踪报告：2021一季度业绩前瞻 行业整体表现优异 核心板块快速增长,2021Q1医药行业有望实现高增速：2020年一季度新冠疫情暴发，医药行业受到不同程度的影响。随着疫情得到有效控制，疫苗接种工作的有序展开，进入 2021年，我国医药企业基本已恢复正常生产经营，医药行业 2021年整体有望实现快速增长。,金融界,,同花顺
507,86265187,603233.XSHG,A,E,603233,大参林,XSHG,12452,2021-04-01 13:24:00,2021-04-01 13:24:01,0.248878270388,0.749894022942,2,0.874333158135,1,0.580159658194,2021-04-01 13:24:03,提升中药占比增强连锁药店竞争力,2020年半年时间的运作中药品类销售占比提升15随着提升中药品类在药店销售的占比正在成为越来越多连锁药店的共识来自业内的专家排名全国连锁药店百强第18位的湖南怀仁大药房董事长林承雄对于中药品类占比更是给予了厚望,中智药业港股,,同花顺
508,86280289,603233.XSHG,A,E,603233,大参林,XSHG,12452,2021-04-01 16:34:19,2021-04-01 16:34:38,0.00046136698802,0.9994789958,2,0.999709679294,0,0.0446640752256,2021-04-01 16:38:17,大参林为子公司申请银行综合授信提供46亿元担保,大参林4月1日晚间发布公告称公司为河南大参林物流广西大参林南通江海大药房茂名大参林江西大参林梧州市大参林佛山顺德大参林提供46亿元担保,,每日经济新闻,搜狐财经
509,86287653,603233.XSHG,A,E,603233,大参林,XSHG,12452,2021-04-01 17:52:55,2021-04-01 17:52:56,0.838953256607,0.138483315706,1,0.55795994401,0,0.0682065993547,2021-04-01 17:53:05,京东健康市值缩水2100亿 互联网医疗面临严监管,京东健康发布上市以来的首份财报，2020年全年营收193.8亿元，同比增长78.8%。互联网医疗面临更严格的监管，在行业的调整期，合规最为重要。,,英才杂志,搜狐财经
510,86310028,603233.XSHG,A,E,603233,大参林,XSHG,12452,2021-04-02 02:41:25,2021-04-02 02:41:33,2.69238648798e-06,0.999997258186,2,0.99999860438,0,0.00192593950778,2021-04-02 02:45:00,大参林医药集团股份有限公司公告（系列）,大参林医药集团股份有限公司第三届董事会第十六次会议通知于2021年3月29日以邮件形式发出，于2021年4月1日以通讯方式召开，本次会议应到董事7人，实到董事7人。,,,证券时报网
511,86310364,603233.XSHG,A,E,603233,大参林,XSHG,12452,2021-04-02 02:41:27,2021-04-02 02:41:50,0.00265259086154,0.958924472332,2,0.960250767763,0,0.0181072309613,2021-04-02 02:57:43,大参林医药集团股份有限公司关于大参转债转股价格调整的提示性公告,大参林医药集团股份有限公司经中国证券监督管理委员会证监许可20201981号文核准于2020年10月22日公开发行了14050000张可转换公司债券每张面值100元发行总额为人民币14050000万元,,,证券时报网
512,86310985,603233.XSHG,A,E,603233,大参林,XSHG,12452,2021-04-02 03:17:12,2021-04-02 03:17:14,5.83619339523e-07,0.999999403954,2,0.999999695763,0,0.00277927014977,2021-04-02 03:17:21,大参林医药集团股份有限公司 第三届董事会第十六次会议决议公告,大参林医药集团股份有限公司第三届董事会第十六次会议通知于2021年3月29日以邮件形式发出，于2021年4月1日以通讯方式召开，本次会议应到董事7人，实到董事7人。,证券日报,,新浪财经
513,86326719,603233.XSHG,A,E,603233,大参林,XSHG,12452,2021-04-02 09:35:33,2021-04-02 09:35:34,0.00201173429377,0.997783482075,2,0.998789349222,-1,-0.73479898721,2021-04-02 09:35:35,上交所对大参林医药集团股份有限公司时任董事李杰予以监管关注,上交所对大参林医药集团股份有限公司时任董事李杰予以监管关注经查明李杰自2019年11月21日至今担任大参林医药集团股份有限公司董事,,每日经济新闻,搜狐财经
514,86338436,603233.XSHG,A,E,603233,大参林,XSHG,12452,2021-04-02 11:29:54,2021-04-02 11:30:05,0.088344424963,0.911519348621,2,0.955691561103,1,0.896236184239,2021-04-02 11:30:14,华南连锁药店龙头大参林,归母净利润由2.66亿元增长至7.03亿元，复合增长率21.45%，19年同比增长32.17%，2020Q3实现归母净利润同比增长55.90%至8.67亿元。,,马蜂窝旅游攻略,搜狐财经
515,86370231,603233.XSHG,A,E,603233,大参林,XSHG,12452,2021-04-02 19:54:51,2021-04-02 19:54:55,0.999980092049,6.28378529655e-06,1,0.49999632981,1,0.739594602585,2021-04-02 19:54:59,医药行业周报：一季报行情开启 建议关注高增长的医药板块,医药板块继续延续震荡上行趋势，中信医药指数涨幅约为3.28%，一季报行情已成为当前最重要的主线。随着后续进入年报和一季报的密集披露期，业绩将成为医药板块后续行情最大的催化剂。,兴业证券股份有限公司,孙媛媛/徐佳熹/王楠,新浪财经
516,86382232,603233.XSHG,A,E,603233,大参林,XSHG,12452,2021-04-03 07:59:54,2021-04-03 07:59:55,0.0349048487842,0.712692737579,2,0.730145161971,1,0.859620560706,2021-04-03 08:00:04,大参林：连续3日融资净买入累计837.21万元（04-02）,2021年4月2日大参林连续3日融资净买入累计837.21万元,东方财富Choice数据,财智星,东方财富网
517,86469168,603233.XSHG,A,E,603233,大参林,XSHG,12452,2021-04-06 17:10:58,2021-04-06 17:11:00,0.999938845634,2.39721084654e-05,1,0.499993394926,1,0.636865481734,2021-04-06 17:11:04,医药生物行业报告骨科耗材集采可能带来投资机会,国家组织高值医用耗材联合采购办公室发布关于开展部分骨科类高值医用耗材产品信息采集工作的通知标志着耗材第二轮全国带量采购进入实操阶段首批耗材为人工髋关节和人工膝关节,天风证券股份有限公司,杨松,新浪财经
518,86470375,603233.XSHG,A,E,603233,大参林,XSHG,12452,2021-04-06 17:26:52,2021-04-06 17:26:52,0.978692471981,0.0111339306459,1,0.500480166636,0,0.16506104746,2021-04-06 17:26:55,首创证券--医药生物行业简评报告：从性价比和一季报业绩角度选股，重点推荐部分低估优质标的【行业研究】,从性价比和一季报业绩角度选股，重点推荐部分低估优质标的。本周生物医药上涨2.81%，周涨幅排28个SW一级行业指数第六位。前期跟随医药板块大幅回调，而在近两周估值修复中尚未明显回暖的板块和标的，估值已经处于合理区间，建议在后市重点关注。,首创证券,,金融界
519,86477360,603233.XSHG,A,E,603233,大参林,XSHG,12452,2021-04-06 19:05:47,2021-04-06 19:05:48,0.992777585983,0.000550573691726,1,0.496939366683,0,0.16506104746,2021-04-06 19:05:53,首创证券--医药生物行业简评报告：从性价比和一季报业绩角度选股 重点推荐部分低估优质标的,从性价比和一季报业绩角度选股，重点推荐部分低估优质标的。本周生物医药上涨2.81%，周涨幅排28个SW一级行业指数第六位。前期跟随医药板块大幅回调，而在近两周估值修复中尚未明显回暖的板块和标的，估值已经处于合理区间，建议在后市重点关注。,金融界,,新浪财经
520,86482674,603233.XSHG,A,E,603233,大参林,XSHG,12452,2021-04-06 20:45:11,2021-04-06 20:45:12,0.999920368195,9.44855946727e-06,1,0.499969632657,1,0.657590542734,2021-04-06 20:45:18,医药生物行业跨市场周报：持续把握财报季医药行情 长处方新政利好药店,上周A 股医药生物指数上涨2.81%，跑赢沪深300 指数0.36pp，跑赢创业板综指0.70pp，排名6/28，表现相对较好，主要是财报季临近，医药板块的业绩确定性优势凸显。,,,新浪财经
521,86496892,603233.XSHG,A,E,603233,大参林,XSHG,12452,2021-04-07 07:48:53,2021-04-07 07:49:31,0.0685238316655,0.629709780216,2,0.663971696049,0,-0.019499951601,2021-04-07 07:49:44,大参林：融资净偿还736.17万元，融资余额1.37亿元（04-06）,2021年4月6日大参林融资净偿还736.17万元，融资余额1.37亿元,东方财富Choice数据,财智星,东方财富网
522,86524357,603233.XSHG,A,E,603233,大参林,XSHG,12452,2021-04-07 13:59:26,2021-04-07 13:59:27,0.985458135605,0.0123437447473,1,0.50507281255,1,0.726533713937,2021-04-07 13:59:29,首创证券--医药商业行业简评报告：慢病长处方重磅新规发布，利好零售药店行业【行业研究】,为规范长期处方管理，推进分级诊疗，保障医疗质量和安全，保障慢性病患者的长期用药需求，国家卫生健康委组织起草了《长期处方管理规范》，明确规定，医师开具长期处方后，患者可以自主选择在医疗机构或者社会零售药店进行调剂取药。,首创证券,,金融界
523,86524884,603233.XSHG,A,E,603233,大参林,XSHG,12452,2021-04-07 14:09:52,2021-04-07 14:09:53,0.965525150299,0.0308932960033,1,0.513655871153,1,0.732483707368,2021-04-07 14:09:57,首创证券医药商业行业简评报告慢病长处方重磅新规发布利好零售药店行业,为规范长期处方管理推进分级诊疗保障医疗质量和安全保障慢性病患者的长期用药需求国家卫生健康委组织起草了长期处方管理规范明确规定医师开具长期处方后患者可以自主选择在医疗机构或者社会零售药店进行调剂取药,金融界,,同花顺
524,86577256,603233.XSHG,A,E,603233,大参林,XSHG,12452,2021-04-08 09:48:31,2021-04-08 09:48:32,0.999006450176,0.000917910772841,1,0.500421135861,1,0.818878060579,2021-04-08 09:48:35,“长处方”管理新规发布 线下药店有望承接持续高业绩,】近日，国家卫生健康委组织起草了《长期处方管理规范》，旨在规范长期处方管理，推进分级诊疗，保障医疗质量和安全，保障慢性病患者的长期用药需求。随着这一新规的发布，业内普遍认为利好药店行业，其中线下药店受益于处方外流有望承接持续高业绩。,制药网,,中国制药网
525,86584275,603233.XSHG,A,E,603233,大参林,XSHG,12452,2021-04-08 10:59:39,2021-04-08 10:59:40,0.998619437218,0.00100166443735,1,0.500311383046,1,0.696747364849,2021-04-08 10:59:43,机会挖掘两部委支持海南开展互联网处方药销售龙头连锁有望集中受益,国家发展改革委商务部关于支持海南自由贸易港建设放宽市场准入若干特别措施的意见支持开展互联网处方药销售,证券时报网,,证券时报网
526,86584437,603233.XSHG,A,E,603233,大参林,XSHG,12452,2021-04-08 11:01:40,2021-04-08 11:01:41,0.999502897263,0.000247969786869,1,0.499999418418,1,0.703693237901,2021-04-08 11:01:42,两部委支持海南开展互联网处方药销售龙头连锁有望集中受益,国家发展改革委商务部关于支持海南自由贸易港建设放宽市场准入若干特别措施的意见支持开展互联网处方药销售,证券时报网,,同花顺
527,86591173,603233.XSHG,A,E,603233,大参林,XSHG,12452,2021-04-08 12:41:57,2021-04-08 12:42:00,0.780139327049,0.0607900395989,1,0.450859703124,0,0.104399296641,2021-04-08 12:42:04,2021年中国连锁药店领先企业对比一心堂VS益丰大药房,一心堂和益丰大药房两家公司在20152020年的营业收入都呈现正增长一心堂在20152019年的营业收入都远超益丰大药房但益丰大药房在2020年前三季度略微领先一心堂从资产结构来看一心堂的资产负债率在2016年达到了近年来最高值5846随后一直呈现下跌趋势到2020年前三季度的4152,前瞻产业研究院,,腾讯网
528,86608157,603233.XSHG,A,E,603233,大参林,XSHG,12452,2021-04-08 17:12:09,2021-04-08 17:12:11,0.117603123188,0.843664824963,2,0.902466386557,1,0.561097704172,2021-04-08 17:12:13,大参林、益丰药房、老百姓、一心堂 谁是国内连锁药房领头羊？,对比一心堂，2020年归母净利润为7.90亿元，同比增长30.81%，净利润增速超过预期。从利润率的角度来看，毛利率和净利率最低的是老百姓，分别为32.29%和5.92%，看来对老百姓而言，解决资金压力和提升利润率水平都极为重要。,新浪财经-自媒体综合,,新浪财经
529,86639147,603233.XSHG,A,E,603233,大参林,XSHG,12452,2021-04-09 07:55:03,2021-04-09 07:55:05,0.0700313597918,0.645639717579,2,0.680655397475,1,0.755994924903,2021-04-09 07:55:08,大参林：融资净买入212.06万元，融资余额1.41亿元（04-08）,2021年4月8日大参林融资净买入212.06万元，融资余额1.41亿元,东方财富Choice数据,财智星,东方财富网
530,86658937,603233.XSHG,A,E,603233,大参林,XSHG,12452,2021-04-09 11:13:24,2021-04-09 11:13:25,0.760367453098,0.225499883294,1,0.605683609843,0,-0.030470252037,2021-04-09 11:13:27,华东医药盘中异动 大幅跳水5.1%,2021年04月09日早盘10时49分，华东医药出现异动，股价大幅下跌5.1%。药易购，立方制药，华东医药较为活跃，换手率分别为10.8%、8.9%及2.0%。,自选股智能写手,,腾讯网
531,86660443,603233.XSHG,A,E,603233,大参林,XSHG,12452,2021-04-09 11:32:53,2021-04-09 11:32:56,0.113941058517,0.869117021561,2,0.926087550819,1,0.561869901717,2021-04-09 11:33:01,大参林、益丰药房、老百姓、一心堂，谁是国内连锁药房领头羊？,A股上市的连锁药店前四强有4家，包括大参林、益丰药房、老百姓和一心堂。从利润率的角度来看，毛利率和净利率最低的是老百姓，分别为32.29%和5.92%，看来对老百姓而言，解决资金压力和提升利润率水平都极为重要。,蓝鲸财经,,腾讯网
532,86685570,603233.XSHG,A,E,603233,大参林,XSHG,12452,2021-04-09 17:54:37,2021-04-09 17:54:39,0.999840021133,1.62068918144e-05,1,0.499936217459,1,0.619095420837,2021-04-09 17:54:40,互联网医疗专题报告五大赛道群雄逐鹿谁将脱颖而出,疫情期间国家卫健委的委属委管医院互联网诊疗同比增加17倍阿里和腾讯均有布局如支付宝的蚂蚁保和微信的微保醉翁之意不在酒通过医疗健康赋能保险服务打造医到险的闭环才是中国平安的野心所在,时代财经,,同花顺
533,86687826,603233.XSHG,A,E,603233,大参林,XSHG,12452,2021-04-09 18:30:30,2021-04-09 18:30:34,0.584227859974,0.364195019007,1,0.656308948994,1,0.538859865069,2021-04-09 18:30:41,连锁药房优质赛道，盈利能力突飞猛进的益丰药房，还能“两年三倍”？,占营收大头的“中西成药”同比增速51.31%，超过了公司平均增速。根据国务院相关部委的文件显示，带量代购已经成为不可扭转的趋势，尤其“两票制”使得小供应商大量退出市场，导致单体药店和小连锁药店议价能力不足，在药品采购上处于劣势。,,粒场财经,搜狐财经
534,86709253,603233.XSHG,A,E,603233,大参林,XSHG,12452,2021-04-10 08:03:07,2021-04-10 08:03:09,0.0349048487842,0.712692737579,2,0.730145161971,1,0.859620560706,2021-04-10 08:03:11,大参林：连续3日融资净买入累计1936.28万元（04-09）,2021年4月9日大参林连续3日融资净买入累计1936.28万元,东方财富Choice数据,财智星,东方财富网
535,86740452,603233.XSHG,A,E,603233,大参林,XSHG,12452,2021-04-12 00:29:26,2021-04-12 00:29:28,0.926238954067,0.0345527939498,1,0.497672270983,0,0.0760797947645,2021-04-12 00:29:29,价值解析：云南白药，未来股价上涨空间巨大！,鉴于下沉市场展现“新蓝海”属性，公司早已深度布局，四川公司开始贡献增量利润，预计公司2021-2023年归母净利润为9.95/11.96/14.38亿元。,,游戏合体,搜狐财经
536,86762642,603233.XSHG,A,E,603233,大参林,XSHG,12452,2021-04-12 10:49:01,2021-04-12 10:49:03,0.999859333038,7.76266533649e-05,1,0.500007293173,1,0.61483553201,2021-04-12 10:49:06,医药生物行业医药企业国际化的一些思考,第二个阶段是2008年美国金融危机之后相当部分在海外医药行业工作多年的华人回到中国或者自己创业或者加入到传统制药企业,天风证券股份有限公司,杨松/张帅,新浪财经
537,86773730,603233.XSHG,A,E,603233,大参林,XSHG,12452,2021-04-12 13:41:59,2021-04-12 13:42:03,0.0020500717219,0.997851133347,2,0.998876169208,1,0.741289076209,2021-04-12 13:42:05,2021年中国连锁药店行业龙头企业对比老百姓VS大参林,老百姓和大参林两家公司在20152020年的营业收入都呈现正增长从毛利率来看大参林在20152020年前三季度都远超老百姓这进一步说明了大参林的获利能力比老百姓强,前瞻网,,腾讯网
538,86841439,603233.XSHG,A,E,603233,大参林,XSHG,12452,2021-04-13 11:14:32,2021-04-13 11:14:37,0.978807806969,0.0206234958023,1,0.510027399287,0,0.127254253626,2021-04-13 11:14:40,价值解读——青岛啤酒：能否像茅台那样成为“啤茅”？,一旦启动，上升通道将打开，或将成为下一只“长源电力”！国内啤酒市场群雄鏖战的上半场，无论从并购扩张，还是之后的渠道整合来看，华润啤酒都暂时领先于青岛啤酒。,,趣体育视频站,搜狐财经
539,86884452,603233.XSHG,A,E,603233,大参林,XSHG,12452,2021-04-13 22:06:40,2021-04-13 22:06:42,0.999863624573,4.58683316538e-05,1,0.499977680618,0,0.185182710364,2021-04-13 22:06:43,正式揭牌 四大战略定位！粤港澳大湾区医药健康综合试验区就在荔湾,试验区将围绕四大战略定位，加快医药健康全产业链高质量发展，重点推动国家呼吸医学中心投入运营，配合筹建呼吸领域国家实验室。,广州荔湾发布,,同花顺
540,86911863,603233.XSHG,A,E,603233,大参林,XSHG,12452,2021-04-14 10:36:09,2021-04-14 10:36:10,0.69473528862,0.162910297513,1,0.510277941823,0,0.109064042568,2021-04-14 10:36:11,健之佳拟收购玉溪江川区星云大药房连锁100股权,上市连锁药店健之佳发布公告全资子公司健之佳连锁健康药房拟以4425万元收购玉溪江川区星云大药房连锁经营有限公司100的股权以获得星云大药房28家药店资产及其经营权益,新京报,,同花顺
541,86936043,603233.XSHG,A,E,603233,大参林,XSHG,12452,2021-04-14 17:03:35,2021-04-14 17:03:38,0.99998664856,4.01609895562e-06,1,0.499997340379,0,0.0802626729012,2021-04-14 17:03:39,如何借“养老+” 布局万亿级银发市场？,随着“药占比”、“药品零加成”等政策不断推进，处方外流的持续发展，相信在很长的时间内，药店行业仍将继续加快并购速度，争夺市场份额，而线下药店因受线上零售的冲击，开始加紧开拓线上业务及多元化的发展模式，行业竞争将进一步加剧。,,,亿邦动力网
542,86969545,603233.XSHG,A,E,603233,大参林,XSHG,12452,2021-04-15 07:53:04,2021-04-15 07:53:15,0.0356927402318,0.685884296894,2,0.70373066701,0,-0.0172173023224,2021-04-15 07:53:19,大参林：连续3日融资净偿还累计1707.83万元（04-14）,2021年4月14日大参林连续3日融资净偿还累计1707.83万元,东方财富Choice数据,财智星,东方财富网
