,newsID,secID,equType,assetClass,ticker,secShortName,exchangeCD,partyID,newsPublishTime,newsInsertTime,degreeProp1St,degreeProp2St,relatedCompanyDegree,relatedCompanyScore,sentiment,sentimentScore,updateTime,newsTitle,newsSummary,newsOriginSource,newsAuthor,newsPublishSite
991,90410314,603233.XSHG,A,E,603233,大参林,XSHG,12452,2021-06-23 01:38:48,2021-06-23 01:38:49,0.999985337257,7.96618951426e-06,1,0.500000634818,0,0.0412385851145,2021-06-23 01:38:50,医检药险模式难成叮当快药独有护城河,叮当快药相关人士对证券日报记者回应称此轮融资是要加快推进医药险的健康到家战略叮当快药在检领域其实有过实践行动叮当快药在医上的动作并不多,证券日报,,证券日报
992,90411485,603233.XSHG,A,E,603233,大参林,XSHG,12452,2021-06-23 02:30:38,2021-06-23 02:30:40,0.883985042572,0.0832482352853,1,0.525240756571,0,0.126722016931,2021-06-23 02:30:41,老百姓大药房连锁股份有限公司 关于上海证券交易所对公司2020年年度报告信息披露监管工作函的回复公告(下转D46版),2020年门店情况明细表 ②净利润和扣非归母净利润等业绩指标增速较低，主要原因：第一，2019年新开门店数较少，影响2020年利润增长。,证券日报,,新浪财经
993,90416249,603233.XSHG,A,E,603233,大参林,XSHG,12452,2021-06-23 07:47:56,2021-06-23 07:47:59,0.00726577220485,0.935716629028,2,0.939349515131,0,0.00277737677097,2021-06-23 07:48:04,大参林：融资净偿还230.22万元，融资余额1.75亿元（06-22）,大参林融资融券信息显示，2021年6月22日融资净偿还230.22万元。融券方面，融券卖出0股，融券偿还600股，融券余量6399股，融券余额32.72万元。,东方财富Choice数据,,东方财富网
994,90428947,603233.XSHG,A,E,603233,大参林,XSHG,12452,2021-06-23 10:07:58,2021-06-23 10:07:59,0.999985337257,7.96618951426e-06,1,0.500000634818,0,0.0412385851145,2021-06-23 10:08:00,分析师：“医+检+药+险”模式 难成叮当快药独有护城河,叮当快药相关人士对《证券日报》记者回应称，此轮融资是要加快推进“医+药+险”的健康到家战略。叮当快药在“检”领域其实有过实践行动。叮当快药在“医”上的动作并不多。,证券日报,,中国财经网
995,90431771,603233.XSHG,A,E,603233,大参林,XSHG,12452,2021-06-23 10:40:25,2021-06-23 10:40:27,0.999928712845,4.44943652838e-05,1,0.500008850788,1,0.721929447353,2021-06-23 10:40:28,首份财报：不太稳定的水滴？,赴美上市公司水滴公布了2021年Q1财报，从数据来看公司的营收和亏损情况都在扩大。作为公益色彩浓厚的互联网保险经纪平台，水滴在扩张的同时在斥巨资进行市场投放，让企业经营状态不太平稳。,,,亿邦动力网
996,97582502,603233.XSHG,A,E,603233,大参林,XSHG,12452,2021-06-23 13:25:00,2021-10-18 17:06:04,0.999694705009,0.00025767259649,1,0.500105025101,1,0.721929447353,2021-10-18 17:06:07,首份财报不太稳定的水滴,赴美上市公司水滴公布了2021年Q1财报从数据来看公司的营收和亏损情况都在扩大作为公益色彩浓厚的互联网保险经纪平台水滴在扩张的同时在斥巨资进行市场投放让企业经营状态不太平稳,驱动号,金融外参,驱动中国
997,90462212,603233.XSHG,A,E,603233,大参林,XSHG,12452,2021-06-23 18:12:19,2021-06-23 18:12:20,0.660913109779,0.328100919724,1,0.658557474613,0,0.0117009818554,2021-06-23 18:12:23,大宗交易：大参林成交7179.12万元，折价9.76%（06-23）,大参林发生了1笔大宗交易，总成交156万股，成交金额7179.12万元，成交价46.02元。大宗交易成交金额占当日成交金额49.64%，折价9.76%。,东方财富Choice数据,,东方财富网
998,90479922,603233.XSHG,A,E,603233,大参林,XSHG,12452,2021-06-24 00:23:40,2021-06-24 00:24:45,0.576836526394,0.388110369444,1,0.676528632641,0,-0.0551946729422,2021-06-24 00:24:46,大参林出现1笔大宗交易 折价率为9.76%,成交价格为46.02元，成交金额为7179.12万元。买方为中信建投证券股份有限公司广州云城南三路证券营业部，卖方为中信建投证券股份有限公司厦门观日路证券营业部。,财联社星矿,,财联社
999,90481475,603233.XSHG,A,E,603233,大参林,XSHG,12452,2021-06-24 02:26:05,2021-06-24 02:26:09,0.526310384274,0.185821011662,1,0.448976203799,0,0.048843601346,2021-06-24 02:26:12,长春百克生物科技股份公司首次公开发行股票科创板上市公告书,长春百克生物科技股份公司股票将于2021年6月25日在上海证券交易所科创板上市。,,,证券时报网
1000,90492285,603233.XSHG,A,E,603233,大参林,XSHG,12452,2021-06-24 08:57:13,2021-06-24 08:57:24,0.999945044518,7.67195888329e-06,1,0.499980194218,0,0.0476470470428,2021-06-24 08:57:28,不赚钱的叮当快药赴港IPO能否成为资本宠儿,其业务分为两大部分一是O2O送药上门服务二是线下的实体药店叮当智慧药房在资本偏爱赛道长坡厚雪之下后期叮当快药到底能滚多大的雪球则要看其能否讲出值得期待的高增长故事,,IPO捕手,钛媒体
1001,90498690,603233.XSHG,A,E,603233,大参林,XSHG,12452,2021-06-24 10:01:20,2021-06-24 10:01:25,0.99996984005,1.34423453346e-05,1,0.49999836237,0,0.0476470470428,2021-06-24 10:01:28,叮当快药赴港IPO，可以获得资本青睐吗？,其业务分为两大部分，一是O2O送药上门服务，二是线下的实体药店叮当智慧药房。在资本偏爱，赛道“长坡厚雪”之下，后期叮当快药到底能滚多大的雪球，则要看其能否讲出值得期待的高增长故事。,IPO捕手,,OFweek
1002,90500079,603233.XSHG,A,E,603233,大参林,XSHG,12452,2021-06-24 10:16:08,2021-06-24 10:16:10,0.999953746796,1.56259375217e-05,1,0.499992499335,0,0.0383445888758,2021-06-24 10:16:13,“互联网+医疗健康”赛道趋热 医药O2O龙头叮当快药赴港申请IPO,随着政策不断放开，“互联网+医疗健康”赛道越来越宽。继6月8日，叮当快药宣布完成2.2亿美元融资后，6月22日，“叮当快药”所属公司叮当健康科技集团有限公司向港交所递交上市申请，中金与招银国际为联席保荐人。,21世纪经济报道,,东方财富网
1003,90517685,603233.XSHG,A,E,603233,大参林,XSHG,12452,2021-06-24 15:16:04,2021-06-24 15:16:05,0.999987959862,8.13194037619e-06,1,0.500002111871,0,0.018192511797,2021-06-24 15:16:08,叮当快药赴港IPO，持续亏损巨头夹击，上市会是解药吗？,药物上门配送平台“叮当快药”所属公司叮当健康科技集团有限公司向港交所递交上市申请，中金与招银国际为联席保荐人。泰康保险是叮当快药在2020年的B+轮融资中引入的外部机构，除了资本投入，双方希望在“医药险”模式下开展更深层次合作。,,中访网财经,东方财富号
1004,90530587,603233.XSHG,A,E,603233,大参林,XSHG,12452,2021-06-24 18:10:30,2021-06-24 18:10:31,0.48833245039,0.491561323404,2,0.735727548599,0,0.0117009818554,2021-06-24 18:10:38,大宗交易：大参林成交7160.4万元，折价10.25%（06-24）,大参林发生了1笔大宗交易，总成交156万股，成交金额7160.4万元，成交价45.90元。大宗交易成交金额占当日成交金额29.50%，折价10.25%。,东方财富Choice数据,,东方财富网
1005,90542476,603233.XSHG,A,E,603233,大参林,XSHG,12452,2021-06-24 21:40:20,2021-06-24 21:40:21,0.00598755152896,0.978339970112,2,0.981333745876,0,-0.0287713959813,2021-06-24 21:40:26,大参林大宗交易成交7160.40万元,大参林6月24日大宗交易平台出现一笔成交，成交量156.00万股，成交金额7160.40万元，大宗交易成交价为45.90元，相对今日收盘价折价10.25%。进一步统计，近3个月内该股累计发生2笔大宗交易，合计成交金额为1.43亿元。,数据宝,,新浪财经
1006,90543432,603233.XSHG,A,E,603233,大参林,XSHG,12452,2021-06-24 22:03:20,2021-06-24 22:03:25,0.997913300991,0.000802147842478,1,0.499758798338,0,0.126591277122,2021-06-24 22:03:30,起大早赶晚集叮当快药上市止血,上市募资最起码能暂缓眼前的流血并能为其未来与巨头的过招留有余地不至于掉队叮当快药启动百城千店战略计划在3年内在300个城市开设2000家线下药店2021年第一季度续亏767亿元同比亏损扩大约2224倍,,李打铁,虎嗅
1007,90547736,603233.XSHG,A,E,603233,大参林,XSHG,12452,2021-06-25 00:21:22,2021-06-25 00:22:50,0.576836526394,0.388110369444,1,0.676528632641,0,-0.0551946729422,2021-06-25 00:22:55,大参林出现1笔大宗交易 折价率为10.25%,成交价格为45.9元，成交金额为7160.4万元。买方为中信建投证券股份有限公司广州云城南三路证券营业部，卖方为中信建投证券股份有限公司厦门观日路证券营业部。,财联社星矿,,财联社
1008,90571162,603233.XSHG,A,E,603233,大参林,XSHG,12452,2021-06-25 11:01:22,2021-06-25 11:02:07,0.639262735844,0.162467613816,1,0.482098981738,0,-0.0629876554012,2021-06-25 11:02:15,590元一粒，片仔癀为啥恁金贵？ 专家：与其组方和成分相同的一味中...,最近两天，毫无疑问，“片仔癀”是一个炙手可热的名字。当时片仔癀切片分服，每次一片即可退癀，因此，民间俗称“片仔癀”。,大河网,,财联社
1009,90580390,603233.XSHG,A,E,603233,大参林,XSHG,12452,2021-06-25 13:30:12,2021-06-25 13:30:22,0.637961685658,0.299933373928,1,0.618914216757,0,-0.0245496571064,2021-06-25 13:30:29,590元一粒还买不到背后片仔癀公司市值暴增近千亿,去年销售费用增长研发费用下降炒作药中茅台有风险年报显示2020年片仔癀实现归属于上市公司股东的净利润1672亿元同比增长2162,羊城晚报,,新浪财经
1010,90588085,603233.XSHG,A,E,603233,大参林,XSHG,12452,2021-06-25 15:29:35,2021-06-25 15:29:50,0.985568702221,0.00884814653546,1,0.501632497646,0,0.146553185582,2021-06-25 15:29:57,百克生物上市首日涨226IPO募15亿两券商赚09亿,今日长春百克生物科技股份公司在上交所科创板上市长春新区国资委通过新区发展集团龙翔投资和高新超达间接持有长春高新1880的股权为百克生物实际控制人,中国经济网,,新浪财经
1011,90591497,603233.XSHG,A,E,603233,大参林,XSHG,12452,2021-06-25 16:13:49,2021-06-25 16:13:51,0.000438070012024,0.999256908894,2,0.9994759439,-1,-0.729846590757,2021-06-25 16:13:57,大参林603233SH董事李杰收到广东证监局警示函,大参林603233SH董事李杰收到广东证监局警示函,,皮腾飞,智通财经网
1012,90595385,603233.XSHG,A,E,603233,大参林,XSHG,12452,2021-06-25 17:00:56,2021-06-25 17:00:57,1.26064514916e-05,0.999987244606,2,0.999993547832,-1,-0.929869958758,2021-06-25 17:01:03,因违规买卖公司股票大参林董事李杰收证监局警示函,大参林发布公告称公司董事李杰因违规交易公司股票被广东省证监局警示2020年3月至4月李杰多次通过集中竞价方式违规买卖大参林股票,和讯股票,,和讯网
1013,90619643,603233.XSHG,A,E,603233,大参林,XSHG,12452,2021-06-26 01:41:06,2021-06-26 01:43:18,0.000573205470573,0.993617892265,2,0.993904495001,-1,-0.695304379612,2021-06-26 01:43:27,大参林医药集团股份有限公司关于董事收到广东证监局警示函的公告,经查你于2019年11月起至今任大参林医药集团股份有限公司董事公司及相关责任主体高度重视警示函提到的问题将严格按照广东证监局的要求认真吸取教训杜绝类似情况的再次发生,,,证券时报网
1014,90679074,603233.XSHG,A,E,603233,大参林,XSHG,12452,2021-06-27 00:00:00,2021-06-28 13:15:57,0.999907970428,7.20710886526e-05,1,0.500026056303,1,0.540582954884,2021-06-28 13:16:00,医药生物行业研究周报：从发展路径看医疗服务投资机会,受CXO、医疗服务、医美等板块上涨带动，上周医药生物板块上涨3.19%，年初至今板块上涨7.91%。,天风证券股份有限公司,杨松,新浪财经
1015,90675595,603233.XSHG,A,E,603233,大参林,XSHG,12452,2021-06-28 11:52:47,2021-06-28 11:52:52,0.829228997231,0.00189778080676,1,0.416512279422,0,0.0442229688168,2021-06-28 11:52:55,叮当快药IPO：三年多累亏4.3亿，阿里美团京东巨头环伺，即时送药是好赛道吗？,有些小程序在醒目位置标注了“极速送达”、“30分钟”等字眼，表明存在即时零售的业务。,,搜狐财经,搜狐财经
1016,90676392,603233.XSHG,A,E,603233,大参林,XSHG,12452,2021-06-28 12:06:07,2021-06-28 12:06:12,0.737509608269,0.00231163809076,1,0.371066442225,0,0.0442902266979,2021-06-28 12:06:12,叮当快药IPO：三年多累亏4.3亿 阿里美团京东巨头环伺 即时送药是好赛道吗,搜狐财经查询发现，京东健康正是招股书中提到的公司A，其2020年销售医药和健康产品的收入为168亿元。有些小程序在醒目位置标注了“极速送达”、“30分钟”等字眼，表明存在即时零售的业务。上市融资成为了叮当扭转现有局面的一种尝试。,搜狐网,,同花顺
1017,90712561,603233.XSHG,A,E,603233,大参林,XSHG,12452,2021-06-28 20:00:47,2021-06-28 20:00:52,0.999734342098,2.35594052356e-05,1,0.499890730454,0,0.0443545877934,2021-06-28 20:00:53,叮当快药正面刚左手科技巨头右手连锁药店,从医药即时配送起家叮当快药与众多互联网企业蜻蜓点水般的线上轻盈模式不同其还开起了线下药店从饿了么渐渐变为类似盒马鲜生模式相比连锁药店在选址运营和送货速度上有优势与外卖平台相比有价格优势与医药电商相比有毛利率优势,商业数据派,,新浪财经
1018,90725317,603233.XSHG,A,E,603233,大参林,XSHG,12452,2021-06-29 02:02:49,2021-06-29 02:06:56,0.999486446381,0.000431906577433,1,0.500175129768,0,0.135305455327,2021-06-29 02:07:17,CCFA&浙商研究所：生活服务业时代变革，连锁赋能蓄势待发（附下载）,大参林2020年归母净利润同比实现51%的高增长，并且其ROE维持在20%左右，位于行业可比之首，盈利能力佳。,,,199IT
1019,90732659,603233.XSHG,A,E,603233,大参林,XSHG,12452,2021-06-29 07:43:20,2021-06-29 07:43:29,0.0118561228737,0.89432734251,2,0.900255403947,0,0.00299265682697,2021-06-29 07:43:32,大参林：融资净偿还1102.24万元，融资余额1.8亿元（06-28）,大参林融资融券信息显示，2021年6月28日融资净偿还1102.24万元。融资方面，当日融资买入793.05万元，融资偿还1895.29万元，融资净偿还1102.24万元。,东方财富Choice数据,,东方财富网
1020,90746522,603233.XSHG,A,E,603233,大参林,XSHG,12452,2021-06-29 10:26:08,2021-06-29 10:26:10,0.603302180767,0.00102274434175,1,0.302673834725,0,0.0443545877934,2021-06-29 10:26:13,叮当快药“正面刚”：左手京东阿里 右手连锁药店,从医药即时配送起家，叮当快药与众多互联网企业“蜻蜓点水”般的线上轻盈模式不同，其还开起了线下药店，从“饿了么”渐渐变为类似“盒马鲜生”模式。,,,亿邦动力网
1021,90776251,603233.XSHG,A,E,603233,大参林,XSHG,12452,2021-06-29 17:36:41,2021-06-29 17:36:42,0.968873083591,0.00701334420592,1,0.491449886002,1,0.947810673341,2021-06-29 17:36:43,老百姓大药房174亿元定增获批头部连锁集中趋势加快,老百姓大药房连锁股份有限公司公告公司非公开发行A股股票申请已获中国证监会发行审核委员会审核通过按照此前定增预案未来老百姓大药房门店将扩增至8948家截至2021年第一季度老百姓大药房门店总数已达到7268家,中国经济网,,腾讯网
1022,90777371,603233.XSHG,A,E,603233,大参林,XSHG,12452,2021-06-29 17:50:14,2021-06-29 17:50:17,0.997409284115,1.23908221212e-05,1,0.49871703288,0,0.109312498569,2021-06-29 17:50:18,叮当快药，生不逢时,当时，网售处方药等政策的走向并不明朗，监管部门似乎倾向于“网售”+“线下店送”模式。如今，在“双通道”模式下，打通医保支付的DTP药房是各家必争的市场，叮当快药在2020年12月份正式启动“DTP到家”业务。,,健识局,36氪
1023,90802958,603233.XSHG,A,E,603233,大参林,XSHG,12452,2021-06-30 06:24:31,2021-06-30 06:24:32,0.975815296173,0.00336167961359,1,0.4912693277,1,0.549196061492,2021-06-30 06:24:34,苏宁易购居中国连锁百强之首 线下门店逆势增长,“2020年中国连锁百强”近日发布，苏宁易购、国美和红星美凯龙登顶前三。中国连锁经营协会发布了该榜单，调查结果显示，2020年连锁百强销售规模2.4万亿元，比上一年下降了7.2%，其中52家百强企业销售同比下降，降幅15.4%。,参考消息,,腾讯网
1024,90827119,603233.XSHG,A,E,603233,大参林,XSHG,12452,2021-06-30 11:37:46,2021-06-30 11:37:48,0.999972581863,1.01572641142e-06,1,0.499987306658,1,0.816484981775,2021-06-30 11:37:49,中药板块爆发国家卫健委提出加强综合医院中医药工作行业迎发展机遇丨牛熊眼,国家卫健委国家中医药局中央军委后勤保障部卫生局联合印发进一步加强综合医院中医药工作推动中西医协同发展的意见卫生健康行政部门要将中西医结合工作纳入医院评审和公立医院绩效考核推动综合医院中医药发展,第一财经,,第一财经
1025,90827575,603233.XSHG,A,E,603233,大参林,XSHG,12452,2021-06-30 11:44:32,2021-06-30 11:44:36,0.999271690845,0.00060210423544,1,0.500237949658,1,0.816484981775,2021-06-30 11:44:37,中药板块爆发:国家卫健委提出加强综合医院中医药工作 行业迎发展机遇,国家卫健委、国家中医药局、中央军委后勤保障部卫生局联合印发进一步加强综合医院中医药工作推动中西医协同发展的意见。卫生健康行政部门要将中西医结合工作纳入医院评审和公立医院绩效考核，推动综合医院中医药发展。,一财网,,新浪财经
1026,90830261,603233.XSHG,A,E,603233,大参林,XSHG,12452,2021-06-30 12:46:46,2021-06-30 12:46:48,0.999962449074,2.04724096875e-06,1,0.499983271778,1,0.816484981775,2021-06-30 12:46:49,中药板块爆发 国家卫健委提出加强综合医院中医药工作 行业迎发展机遇丨牛熊眼,国家卫健委、国家中医药局、中央军委后勤保障部卫生局联合印发进一步加强综合医院中医药工作推动中西医协同发展的意见。卫生健康行政部门要将中西医结合工作纳入医院评审和公立医院绩效考核，推动综合医院中医药发展。,第一财经,,东方财富网
1027,90836086,603233.XSHG,A,E,603233,大参林,XSHG,12452,2021-06-30 14:26:23,2021-06-30 14:26:30,0.999858617783,7.73050123826e-05,1,0.500006613904,1,0.615714225173,2021-06-30 14:26:32,中药板块爆发，国家卫健委提出加强综合医院中医药工作，行业迎发展机遇,国家卫健委、国家中医药局、中央军委后勤保障部卫生局联合印发进一步加强综合医院中医药工作推动中西医协同发展的意见。卫生健康行政部门要将中西医结合工作纳入医院评审和公立医院绩效考核，推动综合医院中医药发展。,第一财经,,和讯网
1028,90866034,603233.XSHG,A,E,603233,大参林,XSHG,12452,2021-06-30 19:40:01,2021-06-30 19:40:02,0.98800432682,0.0115073770285,1,0.505509540439,1,0.637689690789,2021-06-30 19:40:04,半年报前瞻药店连锁同期基数高竞争加剧上半年增速放缓下半年有望好转,当下药店连锁之间的竞争可谓短兵相接但今年一季度国内零售药店开店速度不减新增7000家,财联社记者,,财联社
1029,90869322,603233.XSHG,A,E,603233,大参林,XSHG,12452,2021-06-30 20:33:12,2021-06-30 20:33:15,0.979902267456,0.0197788216174,1,0.509729955345,0,0.100320708752,2021-06-30 20:33:18,主治、副主任、主任医师，抢医生大战背后，互联网医院哪家强？,‘这些药店建设的互联网医院，可助力药店从“销售”向“服务”延伸，能够依托互联网医院提供慢病管理、健康管理等专业服务。,财经自媒体,,新浪财经
1030,90874481,603233.XSHG,A,E,603233,大参林,XSHG,12452,2021-06-30 22:06:50,2021-06-30 22:06:58,0.993678033352,0.0051374649629,1,0.501976481639,1,0.637689690789,2021-06-30 22:07:00,药店连锁：同期基数高+竞争加剧 上半年增速放缓下半年有望好转？,当下，药店连锁之间的竞争可谓“短兵相接”，但今年一季度国内零售药店开店速度不减，新增7000家。结合此前一季报看，相对于去年同期和全年营收增速，各大头部药店都出现营收增速“降档”，但毛利率则略有提升。,财联社,,新浪财经
1031,90928613,603233.XSHG,A,E,603233,大参林,XSHG,12452,2021-07-01 17:11:55,2021-07-01 17:11:57,0.0131466351449,0.985641896725,2,0.992215214297,-1,-0.572313868999,2021-07-01 17:11:59,大参林董事持股不足6个月卖出又买入被出具警示函,李杰通过交易所集中竞价交易的方式买入大参林股票2400股成交均价6351元股成交金额15248802元李杰再次通过交易所集中竞价交易的方式买入大参林股票4800股成交均价6363元股成交金额30555228元,新浪财经,,新浪财经
1032,90930889,603233.XSHG,A,E,603233,大参林,XSHG,12452,2021-07-01 17:39:28,2021-07-01 17:39:30,0.00121419760399,0.998618960381,2,0.999226059183,0,0.133624021709,2021-07-01 17:39:31,大参林：“大参转债”截至第二季度累计转股889股,大参林7月1日晚间发布公告称，2021年4月28日至6月30日，累计有约6.20万元“参林转债”转换为公司股份，占可转债发行总量的0.0045%。,每日经济新闻,,腾讯网
1033,90952464,603233.XSHG,A,E,603233,大参林,XSHG,12452,2021-07-02 02:45:55,2021-07-02 02:45:57,0.00946883577853,0.989641487598,2,0.994375905488,0,-0.0346005022526,2021-07-02 02:45:58,大参林医药集团股份有限公司可转债转股结果暨股份变动公告,截至2021年6月30日累计有62000元大参转债转换为公司股份占可转债发行总量的00045累计转股数量889股占可转债转股前公司已发行股份总额00001,证券日报,,新浪财经
1034,90959560,603233.XSHG,A,E,603233,大参林,XSHG,12452,2021-07-02 07:47:21,2021-07-02 07:47:29,0.0118561228737,0.89432734251,2,0.900255403947,0,0.00429391860962,2021-07-02 07:47:36,大参林：融资净偿还358.37万元，融资余额2亿元（07-01）,大参林融资融券信息显示，2021年7月1日融资净偿还358.37万元。融券方面，融券卖出500股，融券偿还0股，融券余量2.16万股，融券余额111.24万元。,东方财富Choice数据,,东方财富网
1035,90986040,603233.XSHG,A,E,603233,大参林,XSHG,12452,2021-07-02 13:32:02,2021-07-02 13:32:04,0.999952077866,2.52517093031e-05,1,0.500001290642,0,0.15196916759,2021-07-02 13:32:05,叮当健康递交赴港上市申请,叮当快药母公司叮当健康科技集团有限公司向港交所递交了上市申请希望借助资本市场进一步推进实施医药险的健康到家战略通过不断的产品迭代与技术创新提供依托互联网的多场景一站式的问诊购药慢病管理心理咨询等医疗医药服务,中证网,,同花顺
1036,91005466,603233.XSHG,A,E,603233,大参林,XSHG,12452,2021-07-02 17:35:27,2021-07-02 17:36:58,0.999456226826,0.000283056782791,1,0.500011170196,0,0.122887068987,2021-07-02 17:36:59,上市连锁药店收购动作频频零售药店龙头集中趋势加快,健之佳发布公告全资子公司广西健之佳拟以4183万元收购平果誉佳医药连锁有限公司100股权包括24家连锁药店的资产及经营权益旨在开拓空白县级市场疫情压缩中小连锁的生存空间零售药店龙头集中的趋势或将加快,市场第一线,,新京报
1037,91008432,603233.XSHG,A,E,603233,大参林,XSHG,12452,2021-07-02 18:11:39,2021-07-02 18:11:43,0.68256098032,0.0388443619013,1,0.380124852061,0,0.0127958476543,2021-07-02 18:11:44,大宗交易：大参林成交1.17亿元，折价8.37%（07-02）,大参林发生了2笔大宗交易，总成交251.1万股，成交金额1.17亿元，成交均价46.44元。大宗交易成交金额占当日成交金额72.98%，折价8.37%。,东方财富Choice数据,,东方财富网
1038,91013456,603233.XSHG,A,E,603233,大参林,XSHG,12452,2021-07-02 19:09:16,2021-07-02 19:09:20,0.999447762966,0.000296378566418,1,0.500020260049,0,0.133857493103,2021-07-02 19:09:21,生活服务业连锁研究--《生活服务业时代变革 连锁赋能蓄势待发》,中国连锁经营协会联合浙商研究所中小盘组共同进行生活服务连锁的研究，最终完成了《生活时代变革，连锁赋能蓄势待发》报告。大参林2020年归母净利润同比实现51%的高增长，并且其ROE维持在20%左右，位于行业可比之首，盈利能力佳。,福建省东南商务管理研究院,,同花顺
1039,91019693,603233.XSHG,A,E,603233,大参林,XSHG,12452,2021-07-02 20:58:03,2021-07-02 20:58:05,0.996568202972,0.0030691542197,1,0.501353255706,1,0.476892662048,2021-07-02 20:58:06,买买买！零售药店企业真能靠收购提振“双下滑”市场？,尽管有处方药网售解禁、零售药店纳入医保谈判药品供应保障体系等利好政策加持，但依然难改零售药店市场增长乏力态势。,21世纪经济报道,,新浪财经
1040,91020916,603233.XSHG,A,E,603233,大参林,XSHG,12452,2021-07-02 21:19:52,2021-07-02 21:19:57,0.996568202972,0.0030691542197,1,0.501353255706,1,0.476892662048,2021-07-02 21:19:59,买买买！零售药店企业真能靠收购提振“双下滑”市场?,尽管有处方药网售解禁、零售药店纳入医保谈判药品供应保障体系等利好政策加持，但依然难改零售药店市场增长乏力态势。,21世纪经济报道,,东方财富网
