,newsID,secID,equType,assetClass,ticker,secShortName,exchangeCD,partyID,newsPublishTime,newsInsertTime,degreeProp1St,degreeProp2St,relatedCompanyDegree,relatedCompanyScore,sentiment,sentimentScore,updateTime,newsTitle,newsSummary,newsOriginSource,newsAuthor,newsPublishSite
1482,96563005,603233.XSHG,A,E,603233,大参林,XSHG,12452,2021-09-28 11:49:55,2021-09-28 11:49:58,0.999138474464,0.000768207013607,1,0.500337444246,1,0.561438001692,2021-09-28 11:50:00,重磅西普发布 |“2020-2021年药品零售行业发展指数、药品零售企业综合竞争力指数TOP100企业”发布，国大、老百姓、益丰位列三甲,中康科技于西普会上权威发布了“2020-2021年药品零售行业发展指数”及“2020-2021年药品零售企业综合竞争力指数TOP100企业”。,财经网,,财经网
1483,96564982,603233.XSHG,A,E,603233,大参林,XSHG,12452,2021-09-28 12:20:51,2021-09-28 12:20:53,0.891345262527,0.0101923244074,1,0.455864955671,1,0.54425341785,2021-09-28 12:20:55,“2020-2021年药品零售行业发展指数、药品零售企业综合竞争力指数TOP100企业”发布，国大、老百姓、益丰位列三甲,中康科技于西普会上权威发布了“2020-2021年药品零售行业发展指数”及“2020-2021年药品零售企业综合竞争力指数TOP100企业”。,财经网,,同花顺
1484,96621481,603233.XSHG,A,E,603233,大参林,XSHG,12452,2021-09-29 07:55:56,2021-09-29 07:56:42,0.0135072637349,0.986195445061,2,0.992949076928,-1,-0.957063049078,2021-09-29 07:56:46,大参林09月28日被沪股通减持8.01万股,大参林被沪股通减持8.01万股，最新持股量为1976.51万股，占公司A股总股本的2.50%。,东方财富Choice数据,,东方财富网
1485,96711617,603233.XSHG,A,E,603233,大参林,XSHG,12452,2021-09-30 08:15:56,2021-09-30 08:15:58,0.884814620018,0.0239859782159,1,0.466393288225,1,0.614825256169,2021-09-30 08:16:00,注册制新股纵览可孚医疗国内领先的综合性家用医疗器械企业,AHP得分可孚医疗200分总分的375分位国内领先的综合性家用医疗器械企业公司已成为国内领先的大型综合性家用医疗器械企业可孚品牌建立起了较高的品牌认知度和良好的市场口碑,上海申银万国证券研究所有限公司,林瑾/彭文玉/胡巧云,新浪财经
1486,96749445,603233.XSHG,A,E,603233,大参林,XSHG,12452,2021-09-30 15:24:51,2021-09-30 15:24:52,0.978378117085,0.0215479470789,1,0.510737005621,1,0.487119948864,2021-09-30 15:24:53,医药生物行业点评报告十四五全民医疗保障规划发布进一步推进医疗保障高质量发展,政策进一步推进医疗保障高质量发展维持看好评级9月29日国务院办公厅发布印发十四五全民医疗保障规划的通知进一步推进医疗保障高质量发展民营医疗有望受益,开源证券股份有限公司,蔡明子,新浪财经
1487,96792482,603233.XSHG,A,E,603233,大参林,XSHG,12452,2021-10-01 07:49:00,2021-10-01 07:49:02,0.0182848926634,0.98071205616,2,0.989854502492,1,0.924100635946,2021-10-01 07:49:05,大参林09月30日获沪股通增持18.43万股,大参林获沪股通增持18.43万股，最新持股量为1994.06万股，占公司A股总股本的2.52%。,东方财富Choice数据,,东方财富网
1488,96794575,603233.XSHG,A,E,603233,大参林,XSHG,12452,2021-10-01 08:07:55,2021-10-01 08:08:14,0.00850423052907,0.822560191154,2,0.826812306419,0,0.011242210865,2021-10-01 08:08:19,大参林：连续3日融资净偿还累计1299.36万元（09-30）,大参林融资融券信息显示，2021年9月30日融资净偿还520.85万元。融资方面，当日融资买入986.72万元，融资偿还1507.57万元，融资净偿还520.85万元，连续3日净偿还累计1299.36万元。,东方财富Choice数据,,东方财富网
1489,96941528,603233.XSHG,A,E,603233,大参林,XSHG,12452,2021-10-08 08:40:58,2021-10-08 08:41:00,0.978378117085,0.0215479470789,1,0.510737005621,1,0.598262494802,2021-10-08 08:41:04,《“十四五”全民医疗保障规划》发布，进一步推进医疗保障高质量发展,国务院办公厅发布印发《“十四五”全民医疗保障规划》的通知，进一步推进医疗保障高质量发展，民营医疗有望受益。,金融界网,,证券之星
1490,97000663,603233.XSHG,A,E,603233,大参林,XSHG,12452,2021-10-08 18:49:47,2021-10-08 18:49:48,0.00701466575265,0.992003083229,2,0.995510416105,1,0.477266550064,2021-10-08 18:49:50,大参林大参转债截至第三季度累计转股1064股,大参林10月8日晚间发布公告称2021年4月28日至9月30日累计有约85万元参林转债转换为公司股份占可转债发行总量的00061,每日经济新闻,,东方财富网
1491,97023983,603233.XSHG,A,E,603233,大参林,XSHG,12452,2021-10-09 08:10:19,2021-10-09 08:10:30,0.00850423052907,0.822560191154,2,0.826812306419,0,0.0114969432354,2021-10-09 08:10:40,大参林：连续4日融资净偿还累计1428.11万元（10-08）,大参林融资融券信息显示，2021年10月8日融资净偿还128.75万元。融资方面，当日融资买入374.14万元，融资偿还502.9万元，融资净偿还128.75万元，连续4日净偿还累计1428.11万元。,东方财富Choice数据,,东方财富网
1492,97029391,603233.XSHG,A,E,603233,大参林,XSHG,12452,2021-10-09 10:03:17,2021-10-09 10:04:00,0.807098150253,0.0570042394102,1,0.460553314537,1,0.635919652879,2021-10-09 10:04:03,葫芦娃专注儿童药为中国娃量身定制健康服务方案,随着国内全面三胎政策的实施新生儿数量持续增加儿童用药消费需求旺盛儿童药行业将获爆发式增长葫芦娃长期聚焦于儿童健康产业在儿童呼吸系统疾病治疗领域取得领先成就获得市场广泛关注葫芦娃着力打造中国儿童健康守护者品牌形象,览富财经网,,览富财经网
1493,97030805,603233.XSHG,A,E,603233,大参林,XSHG,12452,2021-10-09 10:40:07,2021-10-09 10:40:07,0.994189023972,0.00579569442198,1,0.502890206408,1,0.775601907074,2021-10-09 10:56:16,零售药店行业深度报告：龙头引领行业创新 新一轮扩张浪潮已至,利润增长依然向好，零售药房长期稳健增长可期利润增长依然向好：2021H1 各大药房收入增速相较2020H1 有所放缓，主要是疫情产品销售基数高、疫情下门店关闭、多地感冒药等销售严控等非经营性因素影响。,开源证券股份有限公司,蔡明子,新浪财经
1494,97081120,603233.XSHG,A,E,603233,大参林,XSHG,12452,2021-10-11 09:02:22,2021-10-11 09:02:23,0.862202167511,0.137317717075,1,0.568418800831,1,0.777553395927,2021-10-11 09:02:24,零售药店龙头引领行业创新新一轮扩张浪潮已至,利润端新租赁准则对各大药店归母净利润造成一定影响此外部分药房利润增长受到股权激励费用等非经营性因素的影响预计剔除影响的收入利润增速仍保持稳健增长由此各大药房2021H1利润增长情况依然向好,,,金融界
1495,97092150,603233.XSHG,A,E,603233,大参林,XSHG,12452,2021-10-11 10:10:39,2021-10-11 10:10:41,0.999871015549,3.43597321262e-06,1,0.499938943748,1,0.779988399148,2021-10-11 10:10:43,医药行业2021年三季度业绩前瞻CXO生物制品创新器械有望持续高增长,CXO生物制品创新器械有望持续高增长,,,新浪财经
1496,97113042,603233.XSHG,A,E,603233,大参林,XSHG,12452,2021-10-11 14:54:14,2021-10-11 14:54:16,0.999449193478,2.69854717772e-05,1,0.499751582211,1,0.744279313087,2021-10-11 14:54:18,南财脱水研报丨医药生物板块三季报业绩前瞻 关注业绩靓丽个股,公募基金医药持仓上升，加配核心赛道。随着海内外进入后疫情时代，医药板块基本面受此影响持续发生边际变化，医药板块业绩仍持续分化。医药生物板块即将迎来三季报业绩期，预计医药板块布局渐入佳境。,21世纪经济报道,,东方财富网
1497,97158242,603233.XSHG,A,E,603233,大参林,XSHG,12452,2021-10-12 07:46:22,2021-10-12 07:46:24,0.0135072637349,0.986195445061,2,0.992949076928,-1,-0.927482762933,2021-10-12 07:46:25,大参林10月11日被沪股通减持10.77万股,大参林被沪股通减持10.77万股，最新持股量为2007.56万股，占公司A股总股本的2.54%。,东方财富Choice数据,,东方财富网
1498,97160539,603233.XSHG,A,E,603233,大参林,XSHG,12452,2021-10-12 08:07:49,2021-10-12 08:07:56,0.00850423052907,0.822560191154,2,0.826812306419,0,0.0031828224659,2021-10-12 08:07:58,大参林：连续5日融资净偿还累计1450.11万元（10-11）,大参林融资融券信息显示，2021年10月11日融资净偿还22万元。融资方面，当日融资买入799.33万元，融资偿还821.33万元，融资净偿还22万元，连续5日净偿还累计1450.11万元。,东方财富Choice数据,,东方财富网
1499,97192552,603233.XSHG,A,E,603233,大参林,XSHG,12452,2021-10-12 13:44:47,2021-10-12 13:44:49,0.999901652336,7.61570890973e-06,1,0.499958441877,1,0.780704261549,2021-10-12 13:44:50,药品流通板块逆势走强 龙头股20cm涨停 机构预计零售药店下半年业绩将爆发,医药商业、医药电商等药品流通板块逆势走强，个股中漱玉平民20cm涨停，药易购涨超8%，一心堂涨超5%，大参林、九州通、健之佳、老百姓、百洋医药等个股纷纷跟涨。,同花顺综合,,同花顺
1500,97194087,603233.XSHG,A,E,603233,大参林,XSHG,12452,2021-10-12 14:05:06,2021-10-12 14:05:07,0.0683380961418,0.931254982948,2,0.965424031019,0,0.172383241355,2021-10-12 14:05:11,均衡困境下开药店还能盈利吗,大参林持续释放加盟即直营的信号内同管理外同形象全方位继承大参林优秀品牌基因帮助药店人克服均衡困境让更多单体药店中小连锁保生存稳增长提利润,大京网,,和讯网
1501,97197026,603233.XSHG,A,E,603233,大参林,XSHG,12452,2021-10-12 14:45:44,2021-10-12 14:45:45,0.768317222595,0.226641729474,1,0.610800340772,1,0.921590600535,2021-10-12 14:45:47,可孚医疗：公司已成功进驻老百姓、益丰、千金、国药控股、大参林、海王星辰等主流大中型连锁药房,线上销售方面，直发模式和平台入仓渠道稳定，主要客户是阿里健康大药房、药健康大药房旗舰店、京东等电商平台/店铺，报告期内，公司与线上客户合作良好，合作年限较长，存量客户收入占比接近100%。,同花顺金融研究中心,,同花顺
1502,97207490,603233.XSHG,A,E,603233,大参林,XSHG,12452,2021-10-12 16:48:04,2021-10-12 16:48:05,0.978620052338,0.0153805920854,1,0.504690618254,0,0.10100825429,2021-10-12 16:48:07,可孚医疗：公司线上销售已完成主要包括天猫、阿里健康大药房、京东、唯品会、拼多多、苏宁易购在内的第三方电商平台布局,可孚医疗：公司线上销售已完成主要包括天猫、阿里健康大药房、京东、唯品会、拼多多、苏宁易购在内的第三方电商平台布局,同花顺金融研究中心,,同花顺
1503,97209592,603233.XSHG,A,E,603233,大参林,XSHG,12452,2021-10-12 17:06:21,2021-10-12 17:06:22,0.276830822229,0.700652420521,2,0.839067831635,0,0.114269922674,2021-10-12 17:06:23,大参林于珠海成立医药公司，经营范围含食品销售,大参林新增一则对外投资，投资企业为珠海市香洲宸宁医药有限公司，投资比例为100%。珠海市香洲宸宁医药有限公司成立于2021年9月29日，法定代表人为曾文佳，注册资本为100万元，经营范围包括药品零售。,乐居财经,,乐居
1504,97241889,603233.XSHG,A,E,603233,大参林,XSHG,12452,2021-10-13 07:59:50,2021-10-13 07:59:53,0.0135072637349,0.986195445061,2,0.992949076928,-1,-0.927482762933,2021-10-13 07:59:55,大参林10月12日被沪股通减持93.16万股,大参林被沪股通减持93.16万股，最新持股量为1914.4万股，占公司A股总股本的2.42%。,东方财富Choice数据,,东方财富网
1505,97243557,603233.XSHG,A,E,603233,大参林,XSHG,12452,2021-10-13 08:08:36,2021-10-13 08:08:37,0.0111208306625,0.92938542366,2,0.934945838992,1,0.733129370213,2021-10-13 08:08:40,大参林：融资净买入640.19万元，融资余额1.59亿元（10-12）,大参林融资融券信息显示，2021年10月12日融资净买入640.19万元。融资方面，当日融资买入2105.77万元，融资偿还1465.58万元，融资净买入640.19万元。,东方财富Choice数据,,东方财富网
1506,97251961,603233.XSHG,A,E,603233,大参林,XSHG,12452,2021-10-13 09:18:43,2021-10-13 09:18:48,0.0884594321251,0.908375680447,2,0.952605396509,0,0.127470672131,2021-10-13 09:18:51,鹭燕医药董秘回复：公司业务以医药批发为主，2020年医药批发业务占销售收入总额的比例为93.84%；大参林、老百姓、益丰药房等同行业务以零售为主。,鹭燕医药10月13日在投资者关系平台上答复了投资者关心的问题。公司业务以医药批发为主，2020年医药批发业务占销售收入总额的比例为93.84%。鹭燕医药2021中报显示，公司主营收入84.74亿元，同比上升17.45%。,证券之星智库,,证券之星
1507,97254163,603233.XSHG,A,E,603233,大参林,XSHG,12452,2021-10-13 09:22:53,2021-10-13 09:35:21,0.36990070343,0.626394212246,2,0.811344563961,0,0.0250120818615,2021-10-13 09:35:23,投资者提问：请问董秘一个毛利率问题。鹭燕医药2021年中期笑声利率7.76...,公司业务以医药批发为主，2020年医药批发业务占销售收入总额的比例为93.84%。本信息由新浪财经从公开信息中摘录，不构成任何投资建议。,问董秘,,新浪财经
1508,97259525,603233.XSHG,A,E,603233,大参林,XSHG,12452,2021-10-13 10:16:43,2021-10-13 10:16:45,0.865804791451,0.132677152753,1,0.565579548478,0,0.140977732837,2021-10-13 10:16:46,政策变革下，连锁药店巨头有望承接持续高业绩,院边店业务则是未来能够快速承接处方外流的零售药店，一心堂上半年新增院边店的拓展工作平稳推进，截止半年报告期末，一心堂二级以上医院院边店门店数达到583家。,制药网,,中国制药网
1509,97987572,603233.XSHG,A,E,603233,大参林,XSHG,12452,2021-10-13 10:36:00,2021-10-25 06:58:04,0.77210354805,0.0111149400473,1,0.397166714072,0,0.158948304504,2021-10-25 06:58:05,防疫产品销售逐渐回归常态新上市的可孚医疗核心竞争力在哪里,经济观察网记者王昕宁10月12日可孚医疗进行创业板上市网上路演会后公司管理层与投资者进行了交流互动净利润为216亿元同比减少2097可孚医疗的产品品类繁多其产品分为代理品牌产品和自有品牌产品,经济观察报,,新浪财经
1510,97263032,603233.XSHG,A,E,603233,大参林,XSHG,12452,2021-10-13 10:49:20,2021-10-13 10:49:21,0.925388216972,0.00788952875882,1,0.470583637245,0,0.158948304504,2021-10-13 10:49:24,防疫产品销售逐渐回归常态 新上市的可孚医疗核心竞争力在哪里？,可孚医疗进行创业板上市网上路演，会后公司管理层与投资者进行了交流互动。净利润为2.16亿元，同比减少20.97%。可孚医疗的产品品类繁多，其产品分为代理品牌产品和自有品牌产品。,经济观察网,,东方财富网
1511,97324727,603233.XSHG,A,E,603233,大参林,XSHG,12452,2021-10-14 07:53:33,2021-10-14 07:53:35,0.0111208306625,0.92938542366,2,0.934945838992,1,0.733129370213,2021-10-14 07:53:37,大参林：融资净买入78.31万元，融资余额1.6亿元（10-13）,大参林融资融券信息显示，2021年10月13日融资净买入78.31万元。融资方面，当日融资买入870.9万元，融资偿还792.59万元，融资净买入78.31万元。,东方财富Choice数据,,东方财富网
1512,97500899,603233.XSHG,A,E,603233,大参林,XSHG,12452,2021-10-15 00:00:00,2021-10-16 11:49:06,0.7171241045,0.278848141432,1,0.637410193682,0,0.0847101658583,2021-10-16 11:49:08,益丰再收12家药店 一细节透露湖北或有大动作,无论是从过往门店的数据，还是营收贡献度来看，益丰进一步完善和加强湖北市场的布局无可厚非，在资本运作方面有新的动作是意料之中。,21世纪药店　,,中国医药网
1513,97408690,603233.XSHG,A,E,603233,大参林,XSHG,12452,2021-10-15 07:45:01,2021-10-15 07:45:09,0.00804024375975,0.867305278778,2,0.871325400658,1,0.820234064758,2021-10-15 07:45:12,大参林：连续3日融资净买入累计1143.32万元（10-14）,大参林融资融券信息显示，2021年10月14日融资净买入424.82万元。融资方面，当日融资买入1166.57万元，融资偿还741.75万元，融资净买入424.82万元，连续3日净买入累计1143.32万元。,东方财富Choice数据,,东方财富网
1514,97421127,603233.XSHG,A,E,603233,大参林,XSHG,12452,2021-10-15 09:30:13,2021-10-15 09:30:16,0.423437923193,0.573599994183,2,0.785318955779,0,0.0847101658583,2021-10-15 09:30:17,益丰再收12家药店，一细节透露湖北或有大动作,以农业为主营业务的大湖股份发布公告，其下属全资子公司德海医贸及下属全资孙公司德海大药房与益丰大药房签署《资产收购框架协议》，出售德海大药房名下全部在营的12家直营药房。,21世纪药店,,米内
1515,97433432,603233.XSHG,A,E,603233,大参林,XSHG,12452,2021-10-15 11:12:47,2021-10-15 11:12:49,0.999784886837,0.000195866930881,1,0.500088310349,1,0.588854640722,2021-10-15 11:12:49,一连锁药店巨头再收12家门店，加速布局湖北市场,】近年来，通过“新建+并购”不断增加门店，以达到更大的市场份额和规模效应，已经成为大型连锁药店发展的核心逻辑。,制药网,,中国制药网
1516,97467057,603233.XSHG,A,E,603233,大参林,XSHG,12452,2021-10-15 17:45:48,2021-10-15 17:45:49,0.0104938428849,0.983665049076,2,0.988911970519,0,0.17503465265,2021-10-15 17:45:50,大参林联合珠海市凤凰园成立健康管理公司，前者持股70%,大参林医药集团股份有限公司新增对外投资，新增投资企业为珠海市香洲区宸康健康管理有限公司，投资比例70%。该公司由大参林医药集团股份有限公司持股70%，珠海市凤凰园发展有限公司持股30%。,乐居财经,,乐居
1517,97513264,603233.XSHG,A,E,603233,大参林,XSHG,12452,2021-10-16 00:00:00,2021-10-17 07:57:09,0.999990582466,7.62483796279e-06,1,0.500002916071,0,0.0312313914299,2021-10-17 07:57:09,医药行业周报流通中药反弹重视低估值放量逻辑,本周生物医药所有细分子板块市场表现分化明显其中中药医药流通板块有所上涨其余板块略有调整医药行业相对沪深300的估值溢价率为168较上周环比低79pct略低于四年来中枢水平,浙商证券股份有限公司,孙建,新浪财经
1518,97492348,603233.XSHG,A,E,603233,大参林,XSHG,12452,2021-10-16 07:38:17,2021-10-16 07:38:21,0.0107284076512,0.988614082336,2,0.993978286162,-1,-0.925238737464,2021-10-16 07:38:23,大参林10月15日被沪股通减持40.97万股,大参林被沪股通减持40.97万股，已连续3日被沪股通减持，共计144.9万股，最新持股量为1873.43万股，占公司A股总股本的2.37%。,东方财富Choice数据,,东方财富网
1519,97533034,603233.XSHG,A,E,603233,大参林,XSHG,12452,2021-10-17 00:00:00,2021-10-18 07:57:51,0.999918699265,3.88226471841e-05,1,0.499998172279,1,0.753271289418,2021-10-18 07:57:54,医药与健康护理行业周报三季报相继披露关注业绩高增长公司,上周上证综下跌06SW医药生物指数下跌20涨跌幅在28个申万一级行业中排名第20三季报相继披露我们认为疫情对国内企业的影响已基本消除可以继续看好业绩确定性高的企业,海通证券股份有限公司,贺文斌/余文心,新浪财经
1520,97520227,603233.XSHG,A,E,603233,大参林,XSHG,12452,2021-10-17 15:47:32,2021-10-17 15:47:33,0.00161970139015,0.996819138527,2,0.997628989222,0,0.0535760462284,2021-10-17 15:47:33,大参林603233SH大参转债将于10月22日付息,大参林发布公告公司于2020年10月22日公开发行的可转换公司债券将于2021年10月22日开始支付自2020年10月22日至2021年10月21日期间的利息,智通财经网,,腾讯网
1521,97520309,603233.XSHG,A,E,603233,大参林,XSHG,12452,2021-10-17 15:52:22,2021-10-17 15:52:23,0.00235915742815,0.997470855713,2,0.998650434427,0,0.0523052081466,2021-10-17 15:52:23,大参林：“大参转债”将于10月22日付息,大参林发布公告，公司于2020年10月22日公开发行的可转换公司债券将于2021年10月22日开始支付自2020年10月22日至2021年10月21日期间的利息。,,,同花顺
1522,97652135,603233.XSHG,A,E,603233,大参林,XSHG,12452,2021-10-18 00:00:00,2021-10-19 14:48:21,0.101120650768,0.896260917187,2,0.946821242571,0,-0.000719266012311,2021-10-19 14:48:23,大参林医药集团股份有限公司关于可转换公司债券2021年付息的公告,大参林医药集团股份有限公司于2020年10月22日公开发行的可转换公司债券将于2021年10月22日开始支付自2020年10月22日至2021年10月21日期间的利息,,中国证券报,搜狐财经
1523,97538866,603233.XSHG,A,E,603233,大参林,XSHG,12452,2021-10-18 09:03:36,2021-10-18 09:03:38,0.999977111816,1.557678479e-05,1,0.500004132693,0,0.0746527731419,2021-10-18 09:03:40,【医药】深入推进福建三明模式，促进医疗体系高质量发展,看好政策支持下的医疗服务持续发展：10月15日，国务院办公厅发布《国务院深化医药卫生体制改革领导小组关于深入推广福建省三明市经验 深化医药卫生体制改革的实施意见》，进一步推进医疗保障高质量发展，民营医疗有望受益。,金融界网,开源证券,证券之星
1524,97546423,603233.XSHG,A,E,603233,大参林,XSHG,12452,2021-10-18 09:53:01,2021-10-18 09:53:03,0.999988675117,1.94816925614e-06,1,0.499996285728,1,0.79283876881,2021-10-18 09:53:06,医药生物行业跨市场周报三季报业绩期来临关注业绩与估值匹配的核心赛道,10月11日10月15日A股医药生物指数下跌198跑输沪深300指数202pp跑输创业板综指205pp排名2028表现相对较差部分高估值赛道回调明显,光大证券股份有限公司,林小伟/黄卓/王明瑞/吴佳青,新浪财经
1525,97547281,603233.XSHG,A,E,603233,大参林,XSHG,12452,2021-10-18 09:58:28,2021-10-18 09:58:29,0.0929606035352,0.906764388084,2,0.953244689852,0,0.163275221735,2021-10-18 09:58:29,大参林成立便利店公司，注册资本500万元,大参林新增一则对外投资，投资企业为广东参林便利店有限公司，投资比例为100%。广东参林便利店有限公司成立于2021年10月15日，法定代表人为柯国强，注册资本为500万元，经营范围包括电子烟雾化器销售。,乐居财经,,乐居
1526,97552249,603233.XSHG,A,E,603233,大参林,XSHG,12452,2021-10-18 10:41:24,2021-10-18 10:41:26,0.999951601028,1.56934056577e-05,1,0.49999149392,1,0.684882336855,2021-10-18 10:41:26,医药生物行业周报国家将深入推广福建省三明市医改经验,SW医药生物走势较弱跑输沪深3002021年10月11日10月15日SW医药生物行业指数下跌198跌幅在所有申万一级行业指数中居第九,,,新浪财经
1527,97559458,603233.XSHG,A,E,603233,大参林,XSHG,12452,2021-10-18 12:03:31,2021-10-18 12:03:32,0.999980926514,1.12209290819e-05,1,0.500001684186,0,0.0746527731419,2021-10-18 12:03:37,医药生物行业周报深入推进福建三明模式促进医疗体系高质量发展,各细分子板块分化明显低估值的医药商业和中药板块涨幅较大受三季度业绩等因素搅动医疗服务调整较多,开源证券股份有限公司,蔡明子,新浪财经
1528,97566099,603233.XSHG,A,E,603233,大参林,XSHG,12452,2021-10-18 14:08:56,2021-10-18 14:08:58,0.998835504055,4.72099782201e-06,1,0.499422473025,0,0.0786098867655,2021-10-18 14:09:01,2021年凯度BrandZ最具价值中国品牌排行榜（附完整榜单）,中国上海——凯度今日发布“2021年凯度BrandZ最具价值中国品牌100强排行榜”，最具价值的100个中国品牌总价值同比增长57%，达到1.56万亿美元。,市场资讯,,新浪财经
1529,97567929,603233.XSHG,A,E,603233,大参林,XSHG,12452,2021-10-18 14:39:10,2021-10-18 14:39:13,0.997900366783,0.00200300337747,1,0.500953186769,0,0.0786098867655,2021-10-18 14:39:15,凯度发布2021年最具价值中国品牌排行榜腾讯升至榜首,凯度今日发布2021年凯度BrandZ最具价值中国品牌100强排行榜最具价值的100个中国品牌总价值同比增长57达到156万亿美元虽然中国品牌在过去一年里经历了挑战但顶级品牌仍然展示了强大的抗冲击韧性和品牌价值提升实力,新浪科技,,新浪财经
1530,97576142,603233.XSHG,A,E,603233,大参林,XSHG,12452,2021-10-18 16:07:57,2021-10-18 16:07:58,0.0088042858988,0.990320265293,2,0.994722408243,0,-0.0030032992363,2021-10-18 16:08:00,投资者提问：请问董事柯金龙先生3月31号前占公司股份数1.4亿股，但到了6...,公司会严格按照《上海证券交易所股票上市规则》等相关规则要求进行信息披露，感谢您的关注。本信息由新浪财经从公开信息中摘录，不构成任何投资建议。,问董秘,,新浪财经
1531,97576144,603233.XSHG,A,E,603233,大参林,XSHG,12452,2021-10-18 16:07:57,2021-10-18 16:07:58,0.0088042858988,0.990320265293,2,0.994722408243,0,-0.0030032992363,2021-10-18 16:08:00,投资者提问：贵公司可转债已满足下修条件，请问董事会有这方面计划吗？,公司会严格按照《上海证券交易所股票上市规则》等相关规则要求进行信息披露，感谢您的关注。本信息由新浪财经从公开信息中摘录，不构成任何投资建议。,问董秘,,新浪财经
