,newsID,secID,equType,assetClass,ticker,secShortName,exchangeCD,partyID,newsPublishTime,newsInsertTime,degreeProp1St,degreeProp2St,relatedCompanyDegree,relatedCompanyScore,sentiment,sentimentScore,updateTime,newsTitle,newsSummary,newsOriginSource,newsAuthor,newsPublishSite
299,86651246,600717.XSHG,A,E,600717,天津港,XSHG,1223,2021-04-09 09:50:50,2021-04-09 09:50:52,0.34809717536,0.585401117802,2,0.759449705482,1,0.751856612414,2021-04-09 09:50:54,杭叉集团营收突破百亿 超4成净利拟分红,4月8日晚，杭叉集团披露2020年年报，公司去年实现营业收入114.52亿元，同比增长29.34%。扣非净利润7.82 亿元，同比增长 44.04%。通过上述对外投资进一步提升了产能，丰富了产品品类，拓展了产业链空间，使主业更稳更强。,证券时报e公司,,同花顺
300,86667773,600717.XSHG,A,E,600717,天津港,XSHG,1223,2021-04-09 13:58:48,2021-04-09 13:58:49,0.99969959259,0.000242206500843,1,0.500092002796,1,0.812792969123,2021-04-09 13:58:51,【奋斗百年路 启航新征程】京津冀协同发展交上优异答卷,京雄城际铁路是京津冀协同发展国家战略的重要交通支撑，是京津冀城际交通网的重要组成部分。京津冀协同发展战略实施以来，河北省唐山市曹妃甸区抢抓发展机遇，2014年至今，先后签约北京项目371个，协议总投资4802.46亿元。,和讯,,和讯网
301,86689612,600717.XSHG,A,E,600717,天津港,XSHG,1223,2021-04-09 18:53:30,2021-04-09 18:53:32,0.994131743908,0.00494397291914,1,0.502009844873,1,0.733133016899,2021-04-09 18:53:34,武强：率先打造转型出雏型的“华远样板”,着重提升国际化经营能力，实施外贸主体+进出口基地“双轮驱动”，培育壮大外贸主体，做实华北木材进口集散地、全国最大的麻纺织品出口基地、铝镁合金材料出口加工基地三大进出口基地。,,,同花顺
302,86722048,600717.XSHG,A,E,600717,天津港,XSHG,1223,2021-04-10 21:11:16,2021-04-10 21:11:16,0.0145514113829,0.983592152596,2,0.990867858287,1,0.947469721362,2021-04-10 21:11:18,天津港集团一季度完成集装箱吞吐量4469万标准箱同比增长204,一季度天津港集团完成集装箱吞吐量4469万标准箱同比增长204创出历史同期最高纪录完成货物吞吐量11亿吨同比增长149实现首季生产开门红,证券时报网,,和讯网
303,86732292,600717.XSHG,A,E,600717,天津港,XSHG,1223,2021-04-11 16:26:07,2021-04-11 16:26:08,0.999771177769,0.000100063334685,1,0.499985652219,0,0.0816423498094,2021-04-11 16:26:09,一周钢铁行业概览（4.6-4.9）,民营钢铁企业粗钢产量11062万吨，同比增长13.5%，日均产钢187.49万吨。进口矿方面，现货市场稳中小涨，期货市场整体跟随成材波动。河钢全力助建“未来之城”雄安新区建设。,兰格钢铁网,,和讯网
304,86759627,600717.XSHG,A,E,600717,天津港,XSHG,1223,2021-04-12 10:17:06,2021-04-12 10:17:07,0.391490757465,0.549752354622,2,0.745497733355,0,0.108142241836,2021-04-12 10:17:10,天津农商行违法遭罚未按规定履行客户身份识别义务,中国人民银行天津分行网站近日公布的行政处罚信息公示表显示天津农村商业银行股份有限公司存在未按照规定履行客户身份识别义务的违法行为,,,金融界
305,86780579,600717.XSHG,A,E,600717,天津港,XSHG,1223,2021-04-12 15:28:24,2021-04-12 15:28:28,0.606193780899,0.343731701374,1,0.646828591824,0,0.162802479416,2021-04-12 15:28:30,安信证券--煤炭行业周报：供给偏紧格局未改 预计动力煤跌幅有限,动力煤港口价格小幅回落： 截至 4月 9日，煤炭资源网显示秦皇岛港 动力煤价格报收于 722元/吨，周环比下降 13元/吨。,金融界,,同花顺
306,86792566,600717.XSHG,A,E,600717,天津港,XSHG,1223,2021-04-12 17:39:10,2021-04-12 17:39:11,0.232686519623,0.765781342983,2,0.882124602795,0,0.0863796621561,2021-04-12 17:39:12,投资者提问：公司的销售业务前面几年一直是微薄利润，2020年直接亏损了，为...,2020年销售业务亏损主要是因为燃供公司亏损。公司已于2021年初实施燃供公司股权转让，一是有利于公司进一步聚焦主业，提升主业集中度，释放管理资源，优化资源配置。有利于改善公司经营业绩，提升净利润和每股收益水平，为投资者带来更大回报。,问董秘,,新浪财经
307,86792567,600717.XSHG,A,E,600717,天津港,XSHG,1223,2021-04-12 17:39:10,2021-04-12 17:39:11,0.232686519623,0.765781342983,2,0.882124602795,0,0.0863796621561,2021-04-12 17:39:13,投资者提问：请问公司2020年散杂货业务中煤炭、矿石、钢材等货品的营业占比...,公司完成货物吞吐量42，104万吨，较去年同期增长2.24%。散杂货吞吐量22，786万吨，较去年同期增长2.71%。公司将持续开拓市场、降本增效，努力提升公司经营业绩，为广大投资者带来更好回报。,问董秘,,新浪财经
308,86792568,600717.XSHG,A,E,600717,天津港,XSHG,1223,2021-04-12 17:39:10,2021-04-12 17:39:11,0.872453153133,0.101383954287,1,0.537610530853,0,0.0863796621561,2021-04-12 17:39:13,投资者提问：公司与中远海控的合作情况如何？,公司如有相关信息达到披露标准，将及时履行信息披露义务。本信息由新浪财经从公开信息中摘录，不构成任何投资建议。,问董秘,,新浪财经
309,86803386,600717.XSHG,A,E,600717,天津港,XSHG,1223,2021-04-12 20:06:00,2021-04-12 20:06:01,0.0626044273376,0.937088906765,2,0.968391120434,1,0.753867542744,2021-04-12 20:06:01,快看！雄安新区“海上门户”这样打造,走进位于雄安新区的天津港集团雄安新区服务中心，工作人员正在热情地为客户办理出口等业务。,雄安发布,,同花顺
310,86827250,600717.XSHG,A,E,600717,天津港,XSHG,1223,2021-04-13 09:01:20,2021-04-13 09:01:24,0.96192085743,0.0272705927491,1,0.508231021464,1,0.605085802823,2021-04-13 09:01:25,中信证券：啤酒板块一季度复苏良好，成本压力下关注提价趋势,叠加2021年的奥运会及2022年初的冬奥会，体育活动望推动新一轮高端营销活动，我们持续看好啤酒行业高端化的投资价值。,,,金融界
311,86863298,600717.XSHG,A,E,600717,天津港,XSHG,1223,2021-04-13 16:36:52,2021-04-13 16:37:05,0.999645352364,0.000245249771979,1,0.500067925954,0,0.156232848018,2021-04-13 16:37:07,北京：中关村“科技之花”经开区“结果”,研发10余年后，中关村企业主线科技公司CEO张天雷不久前把自动驾驶运营总部项目落在了经开区，成为“三城一区”创新链、产业链无缝对接的最新案例。,网信北京,,同花顺
312,86864492,600717.XSHG,A,E,600717,天津港,XSHG,1223,2021-04-13 16:52:11,2021-04-13 16:52:12,0.0327646434307,0.966409564018,2,0.982791885734,1,0.967316579283,2021-04-13 16:52:12,天津港集团实现首季生产“开门红”,天津港集团主动服务京津冀协同发展和共建“一带一路”，扎实开展“市场年”活动，积极抢抓我国外贸进出口增势明显机遇，拓展远洋干线和“一带一路”航线和内贸航线网络，连续开通多条集装箱和件杂货新航线。,天津市滨海新区新城镇人民政府,,同花顺
313,86880427,600717.XSHG,A,E,600717,天津港,XSHG,1223,2021-04-13 20:35:55,2021-04-13 20:36:09,0.81802791357,0.172439694405,1,0.58145365119,1,0.68288654834,2021-04-13 20:36:09,国家能源集团一季度发电量同比增25%,今年一季度，国家能源集团煤炭产销量、发电量、铁路运量同比均实现较大幅度增长，全部刷新历史同期最高纪录。国家能源集团新闻发言人张玉新介绍，一季度，国家能源集团完成煤炭产量1.41亿吨，同比增长5.9%。,新华网,,和讯网
314,86910331,600717.XSHG,A,E,600717,天津港,XSHG,1223,2021-04-14 10:20:09,2021-04-14 10:20:11,0.446637332439,0.548884093761,2,0.772202759981,0,0.116596287861,2021-04-14 10:20:13,钢坯反弹50，黑色期货大涨，钢价居高难下,由于黑色期货强势反弹，下游终端采购及投机性需求回升，考虑到当前市场资源紧俏，一旦成交出现好转，钢价仍居高难下。三月份钢材出口激增的原因主要是受春节后出口退税政策调整的传闻影响，钢厂加紧生产出口订单，以避免政策调整所带来的附加成本。,,,金融界
315,86939338,600717.XSHG,A,E,600717,天津港,XSHG,1223,2021-04-14 17:47:45,2021-04-14 17:47:47,0.999627709389,0.000318264734233,1,0.500132119429,0,0.108212798834,2021-04-14 17:47:47,铁矿基本面趋弱，静待做空催化,若想做空铁矿石可等待两个时间点，一是在基本面无明显变化的情况下价格突破前期高点，则意味着铁矿石价格相对高估。,期货日报,,同花顺
316,86953613,600717.XSHG,A,E,600717,天津港,XSHG,1223,2021-04-14 21:26:16,2021-04-14 21:26:21,0.997925519943,0.00199413090013,1,0.500956890872,0,0.0882311955094,2021-04-14 21:26:24,天津航运指数一季度环比上涨15.7% 高位震荡或将持续,2021年一季度末，中国北方内外贸海运价格的风向标——天津航运指数收于1243.21点，环比2020年四季度最后一个发布日累计上涨15.7%。由于国际集装箱运价和干散货运价的不确定性仍存，天津航运指数或将持续高位震荡。,新华网,,和讯网
317,86966010,600717.XSHG,A,E,600717,天津港,XSHG,1223,2021-04-15 07:10:33,2021-04-15 07:10:57,0.999851942062,9.4048838946e-05,1,0.50002001987,0,0.116312733293,2021-04-15 07:11:03,行业景气观察：3月出口结构分化，新能源车产销继续高增,3月份集成电路进出口金额当月同比增幅继续扩大，贸易逆差扩大。截至2021年4月13日，Brent原油现货价格周环比上行1.25%至63.39美元/桶，WTI原油价格上行1.43%至60.18美元/桶。,,,金融界
318,87040436,600717.XSHG,A,E,600717,天津港,XSHG,1223,2021-04-16 07:39:55,2021-04-16 07:39:57,0.00590288452804,0.993407726288,2,0.996359168552,0,0.111907923035,2021-04-16 07:39:59,天津港(600717)融资融券信息(04-15),天津港2021年4月15日融资净买额873，922元，融券余额262，319，335元。,东方财富Choice数据,财智星,东方财富网
319,87113079,600717.XSHG,A,E,600717,天津港,XSHG,1223,2021-04-17 07:57:41,2021-04-17 07:57:45,0.00444683106616,0.992590427399,2,0.994813842932,0,0.112715050206,2021-04-17 07:57:48,天津港(600717)融资融券信息(04-16),天津港2021年4月16日融资净买额-2，902，264元，融券余额259，417，071元。,东方财富Choice数据,财智星,东方财富网
320,87144765,600717.XSHG,A,E,600717,天津港,XSHG,1223,2021-04-19 03:30:47,2021-04-19 03:30:48,0.991985559464,0.00799761060625,1,0.503990390338,1,0.748897594959,2021-04-19 03:30:51,港口大规模整合迎接互联贸易时代,得益于京津冀协同发展战略津冀两地港口携手相融变对手为握手变竞争为竞合有融乃大一个世界级港口群的轮廓日益清晰起来,经济参考报,,东方财富网
321,87147012,600717.XSHG,A,E,600717,天津港,XSHG,1223,2021-04-19 07:30:46,2021-04-19 07:30:56,0.25218936801,0.744312286377,2,0.870406970382,0,0.110839806497,2021-04-19 07:31:04,焦炭期价短期或震荡 关注焦企限产,期货大幅升水现货，盘面提前预支两轮提涨，预计焦炭后市震荡为主，建议暂时观望，建议关注焦企限产政策，基差或随着现货提涨逐步收敛。,和讯期货,,和讯网
322,87196927,600717.XSHG,A,E,600717,天津港,XSHG,1223,2021-04-19 18:20:07,2021-04-19 18:20:08,0.996215283871,0.00364397070371,1,0.501751612639,0,0.138204088435,2021-04-19 18:20:10,华为轮值董事长胡厚崑5G实现1到N阶段行业标准非常重要,在博鳌亚洲论坛2021年会5G的未来分论坛上华为副董事长轮值董事长胡厚崑表示5G在各个行业的应用华为在全球参与了100多个5G网络的部署,和讯网,,和讯网
323,87203840,600717.XSHG,A,E,600717,天津港,XSHG,1223,2021-04-19 20:22:30,2021-04-19 20:22:32,0.973679602146,0.0217677354813,1,0.508607536554,1,0.749345031008,2021-04-19 20:22:36,润邦股份2020年年度董事会经营评述,在我国加速贯彻落实工业转型升级规划和战略性新兴产业发展规划的背景下，高端装备制造业如何实现由“大”到“强”，由“中国制造”向“中国创造”的升级发展对于中国经济稳速高质增长具有重要的战略价值和意义。,同花顺金融研究中心,,同花顺
324,87209191,600717.XSHG,A,E,600717,天津港,XSHG,1223,2021-04-19 22:21:38,2021-04-19 22:21:39,0.997054338455,9.58548625931e-05,1,0.49862302409,1,0.625150699914,2021-04-19 22:21:39,上天入地、省钱省人省心……电信大咖博鳌聊5G热点,“实现井下采煤机的无人操控，整个采煤机在井下全自动运行，人在井上的工作室进行操控。”制造业这个领域是一个长尾，需要不断地提炼总结，变成标准，变成模块。,,,金融界
325,87289790,600717.XSHG,A,E,600717,天津港,XSHG,1223,2021-04-21 06:25:18,2021-04-21 06:25:20,0.825057446957,0.173490718007,1,0.586019441485,1,0.612006370723,2021-04-21 06:25:20,蓝天下 货物运输更快了,一艘进境货轮驶入天津港码头，船刚靠岸，一批由河北雄县立亚包装材料有限公司进口的聚乙烯货物被迅速装到卡车上，直接运往雄安新区。,中国青年报,,同花顺
326,87332903,600717.XSHG,A,E,600717,天津港,XSHG,1223,2021-04-21 16:38:25,2021-04-21 16:38:26,0.0244470369071,0.973490536213,2,0.985714054666,1,0.930701529095,2021-04-21 16:38:29,服务“双循环”新发展格局！天津港钢材“水上巴士”再添转水新航线,天津港集团充分发挥“一带一路”海陆交汇点和服务全面对外开放国际枢纽港作用，服务以国内大循环为主体、国内国际双循环相互促进的新发展格局。,天津港官微,,同花顺
327,87337848,600717.XSHG,A,E,600717,天津港,XSHG,1223,2021-04-21 17:38:54,2021-04-21 17:44:20,0.999562680721,0.000349113252014,1,0.500130453613,1,0.695983438194,2021-04-21 17:44:30,【绿色周报】碳中和指数在上海股交中心上线，首条直通雄安清洁能源大动脉开工,我国首条直通雄安新区的清洁能源“大动脉”——国家管网蒙西煤制天然气外输管道项目一期工程于4月13日开工。,标准排名官号微信号,,和讯网
328,87343076,600717.XSHG,A,E,600717,天津港,XSHG,1223,2021-04-21 18:59:27,2021-04-21 18:59:29,0.430372387171,0.564282178879,2,0.779468372464,1,0.731542877108,2021-04-21 18:59:29,上海雅仕2020年年度董事会经营评述,阿拉山口和霍尔果斯口岸出口集装箱业务收入同比去年大幅上涨，为2021年进一步打开一带一路班列业务奠定了良好的基础。,同花顺金融研究中心,,同花顺
329,87355774,600717.XSHG,A,E,600717,天津港,XSHG,1223,2021-04-21 23:36:04,2021-04-21 23:36:07,0.442318409681,0.545931577682,2,0.767090782523,1,0.714774432033,2021-04-21 23:36:08,上海雅仕2020年净利6425.98万 董事长孙望平薪酬60.2万,挖贝网4月21日，上海雅仕近日发布2020年度报告，报告期内公司实现营业收入1，733，897，515.63元，同比下滑1.22%。,,,金融界
330,87357924,600717.XSHG,A,E,600717,天津港,XSHG,1223,2021-04-22 02:10:56,2021-04-22 02:10:57,0.998918414116,0.00103241042234,1,0.50049161748,1,0.64923973307,2021-04-22 02:11:01,焦炭期货十年蜕变产业企业享有私人订制服务,证券日报记者从相关产业人士处获悉10年间大商所多次根据现货贸易变化和企业诉求对焦炭期货的合约规则交割范围和交割制度等进行优化调整使产业企业切实感受到了私人定制服务的优越和便利性鼓励和推动更多企业参与其中,证券日报,,同花顺
331,87358823,600717.XSHG,A,E,600717,天津港,XSHG,1223,2021-04-22 02:45:46,2021-04-22 02:45:47,0.0101862922311,0.989205360413,2,0.994298506528,0,0.0070257743937,2021-04-22 02:45:48,天津港股份有限公司关于召开2020年年度股东大会的提示性公告,经公司九届七次董事会审议通过决定于2021年4月28日召开公司2020年年度股东大会公司于2021年3月25日发布了天津港股份有限公司关于召开2020年年度股东大会的通知,中国证券报-中证网,,新浪财经
332,87364517,600717.XSHG,A,E,600717,天津港,XSHG,1223,2021-04-22 07:53:27,2021-04-22 07:53:28,0.00566235184669,0.994296133518,2,0.997127309442,1,0.933121330431,2021-04-22 07:53:30,天津港积极箱助促外贸,由地中海航运公司费思轮进口的11万个标准集装箱空箱在天津港太平洋国际码头完成作业这是今年以来天津港首次完成单航次规模超万箱的外贸进口空箱作业,,今晚报,搜狐财经
333,87419315,600717.XSHG,A,E,600717,天津港,XSHG,1223,2021-04-22 21:30:27,2021-04-22 21:30:29,0.753932952881,0.23922984302,1,0.616196319461,1,0.817233879864,2021-04-22 21:30:31,北化股份2020年年度董事会经营评述,归属于上市公司股东的净利润90，179，154.54元，同比减少33.98%。为有效降低行业需求萎缩对公司产品销售市场的冲击，公司将全力保障专项订货，继续实施“差异化”和“一户一策”等策略，巩固国内及传统市场，开拓外贸及新市场。,同花顺金融研究中心,,同花顺
334,87471036,600717.XSHG,A,E,600717,天津港,XSHG,1223,2021-04-23 16:53:58,2021-04-23 16:54:01,0.576427578926,0.398647546768,1,0.686861336231,1,0.744552794471,2021-04-23 16:54:02,博迈科2020年年度董事会经营评述,全球能源市场受到短期油价波动冲击，投资节奏发生变化，随着油价回升，市场行情随之恢复，但部分项目投资出现延后。,同花顺金融研究中心,,同花顺
335,87473828,600717.XSHG,A,E,600717,天津港,XSHG,1223,2021-04-23 17:30:48,2021-04-23 17:30:52,0.512836039066,0.398874908686,1,0.655292928219,1,0.635735927522,2021-04-23 17:30:53,博迈科同时发布2020年年度报告及2021年第一季度报告,博迈科同时发布2020年年度报告及2021年第一季度报告，在盈利能力良好的成绩单中，博迈科的强劲增长尤为引人瞩目。,大京网,,和讯网
336,87483760,600717.XSHG,A,E,600717,天津港,XSHG,1223,2021-04-23 20:08:39,2021-04-23 20:08:41,0.304672896862,0.694218456745,2,0.846554905176,0,0.154988463223,2021-04-23 20:08:41,力合科技2020年年度董事会经营评述,创新了城市环境监管服务模式，开发了配套数据模型与应用软件，逐步实现了“数据制造”向“数据应用”延伸，为“河长制”全流域管控、城市大气污染精准管控等项目提供了有力的数据与决策建议。,同花顺金融研究中心,,同花顺
337,87487205,600717.XSHG,A,E,600717,天津港,XSHG,1223,2021-04-23 21:30:52,2021-04-23 21:30:54,0.559882104397,0.437499344349,1,0.717440396547,1,0.780901349336,2021-04-23 21:30:55,好消息！国际物流公司获批进境肉类指定监管场地资质,国际物流公司获海关总署批复，取得进境肉类指定监管场地资质，具备了进境肉类样品初步检验、样品预处理、暂存放等功能，对推进天津港冷链物流聚集，打造国内一流营商服务环境，形成综合性冷链产业基地和物流体系具有重要意义。,天津港官微,,同花顺
338,87518562,600717.XSHG,A,E,600717,天津港,XSHG,1223,2021-04-25 10:36:29,2021-04-25 10:36:32,0.820430457592,0.159075647593,1,0.569290876389,0,0.184268363938,2021-04-25 10:36:33,沿着高速看中国| 京津塘高速公路：铸造北方“黄金通道”,一段仅需1个多小时车程的距离，让货物中转“上天”“入海”更加便捷。这条路，京津塘高速公路，堪称中国北方的“黄金通道”。密布环绕的高速公路打通了区域协同的“脉络”，空间上的“一体化”转为时间上的“同城化”。,和讯,,和讯网
339,87552572,600717.XSHG,A,E,600717,天津港,XSHG,1223,2021-04-26 08:03:55,2021-04-26 08:04:11,0.0917802155018,0.884734272957,2,0.930624380708,1,0.869111770764,2021-04-26 08:04:13,天津港：4月23日融资净偿还249.23万元 上一交易日净买入80.11万元,4月23日融资买入374.18万元，融资偿还623.40万元，融资净偿还249.23万元，当前融资余额为2.63亿元。天津港4月23日融资融券余额较昨日减少247.08万元至2.77亿元。,同花顺金融研究中心,,同花顺
340,87582678,600717.XSHG,A,E,600717,天津港,XSHG,1223,2021-04-26 14:25:12,2021-04-26 14:25:14,0.862239539623,0.0787829831243,1,0.509902752936,0,0.184128775448,2021-04-26 14:25:15,安信证券--煤炭行业周报：动力煤继续大涨 一季报行情开启,动力煤港口、产地价格大幅上涨： 截至 4月 23日，煤炭资源网显示 秦皇岛港动力煤价格报收于 787元/吨，周环比上涨 35元/吨。由于煤炭企业的煤化工产品原料煤多以自产为主，成本相对稳定，化 工品价格上涨有望带动业绩弹性释放。,,,同花顺
341,87637641,600717.XSHG,A,E,600717,天津港,XSHG,1223,2021-04-27 09:54:25,2021-04-27 09:54:29,0.947379767895,0.0149605339393,1,0.488650417887,1,0.678439463675,2021-04-27 09:54:30,华安证券--计算机行业周报：商用车辅助驾驶渗透率提升 特定场景率先落地,锐明技术加大商用车辅助驾驶投入，引入毫米波雷达解决盲区检测高级辅助驾驶在商用车中应用广泛，尤其是因为多数商用车的体积相对较大，盲区监测一直是行业痛点。,,,同花顺
342,87662884,600717.XSHG,A,E,600717,天津港,XSHG,1223,2021-04-27 15:58:38,2021-04-27 15:58:40,0.908586323261,0.0454756394029,1,0.499768801033,1,0.727737295628,2021-04-27 15:58:41,博迈科：业务范围再拓展 新签FPSO上部模块详细设计订单,博迈科发布新闻称与国际知名FPSO总承包商——MODEC签订FPSO上部模块详细设计及建造订单。,大京网,,和讯网
343,87682500,600717.XSHG,A,E,600717,天津港,XSHG,1223,2021-04-27 20:49:16,2021-04-27 20:49:19,0.781620442867,0.183169677854,1,0.573979899287,1,0.661447206885,2021-04-27 20:49:20,双杰电气2020年年度董事会经营评述,积极推进再融资事项，完成非公开股票的发行工作 2020年2月，公司启动2020年度非公开发行A股股票事项。“新基建”、“区域发展”等扩大内需战略相继推出，“一带一路”战略深入推进，全球能源的绿色发展与电气化程度不断提升。,同花顺金融研究中心,,同花顺
344,87689208,600717.XSHG,A,E,600717,天津港,XSHG,1223,2021-04-27 23:09:39,2021-04-27 23:09:44,0.565370380878,0.42495855689,1,0.70764374733,1,0.680102589726,2021-04-27 23:09:45,天海防务2021年一季度董事会经营评述,公司2021年一季度营业收入增长，但净利润同比减少的原因，主要系船海工程EPC业务收入增长所致，但受主要原材料成本上涨和人工成本上涨等原因导致营业利润增长有限。,同花顺金融研究中心,,同花顺
345,87756528,600717.XSHG,A,E,600717,天津港,XSHG,1223,2021-04-28 18:18:22,2021-04-28 19:26:34,0.330231964588,0.653905391693,2,0.819021373987,1,0.674368532002,2021-04-28 19:26:36,中远海控(01919)：中远海运港口拟转让欧亚码头30%股权予天津港股份指定的境外子公司,本次交易及集装箱公司交易整体而言将有利于中远海运港口与天津港股份进一步发挥各方优势，优化资源配置，提升综合竞争力及提高企业效益。,,黄明森,智通财经网
346,87752940,600717.XSHG,A,E,600717,天津港,XSHG,1223,2021-04-28 18:25:31,2021-04-28 18:25:32,0.105627700686,0.884738862514,2,0.937552712858,1,0.647005197778,2021-04-28 18:25:33,中遠海控01919中远海运港口拟转让欧亚码头30股权予天津港股份指定的境外子公司,本次交易及集装箱公司交易整体而言将有利于中远海运港口与天津港股份进一步发挥各方优势优化资源配置提升综合竞争力及提高企业效益,智通财经,,和讯网
347,87754467,600717.XSHG,A,E,600717,天津港,XSHG,1223,2021-04-28 18:49:43,2021-04-28 18:49:45,0.71142488718,0.284092873335,1,0.639805316925,0,0.137503360584,2021-04-28 18:49:46,中远海运港口01199HK拟作价27亿元出售天津欧亚码头30权益,格隆汇4月28日丨中远海运港口宣布于2021年4月28日公司与天津港订立天津欧亚股权转让协议内容有关出售公司于天津欧亚码头持有的全部30股权透过出售公司的全资附属公司中远海运港口的100股权,格隆汇APP,,新浪财经
348,87754468,600717.XSHG,A,E,600717,天津港,XSHG,1223,2021-04-28 18:49:43,2021-04-28 18:49:45,0.292866289616,0.6990852952,2,0.845518440008,1,0.753552722931,2021-04-28 18:49:46,中远海控01919HK中远海运港口与天津港股份签订股权转让协议,中远海控01919HK中远海运港口与天津港股份签订股权转让协议,格隆汇APP,,新浪财经
349,87760204,600717.XSHG,A,E,600717,天津港,XSHG,1223,2021-04-28 20:24:09,2021-04-28 20:24:10,0.0278103556484,0.968167722225,2,0.982072900049,1,0.909568636119,2021-04-28 20:24:12,天津港600717SH一季度归母净利润同比增长7439至197亿元,天津港发布2021年第一季度报告该集团期内营业收入为3191亿元同比增长1790归属于上市公司股东的扣除非经常性损益的净利润196亿元同比增长7331,,张展雄,智通财经网
350,87762375,600717.XSHG,A,E,600717,天津港,XSHG,1223,2021-04-28 21:10:06,2021-04-28 21:10:08,0.848999917507,0.103246100247,1,0.527746059,0,0.178131534904,2021-04-28 21:10:09,恒基达鑫2020年年度董事会经营评述,行业情况 随着科技的发展，工业转型步伐的加快，汽车，电子，造纸，航天，钢铁等行业对化工品的需求越来越大。实现利润总额12，053.11万元，同比增长84.81%。,同花顺金融研究中心,,同花顺
