,newsID,secID,equType,assetClass,ticker,secShortName,exchangeCD,partyID,newsPublishTime,newsInsertTime,degreeProp1St,degreeProp2St,relatedCompanyDegree,relatedCompanyScore,sentiment,sentimentScore,updateTime,newsTitle,newsSummary,newsOriginSource,newsAuthor,newsPublishSite
0,81494744,600717.XSHG,A,E,600717,天津港,XSHG,1223,2021-01-01 18:10:56,2021-01-01 18:10:57,0.0121473986655,0.987336933613,2,0.993410632946,1,0.903552212659,2021-01-01 18:10:58,天津港新年新增两条海铁联运班列通道,2021年第一天，来自黑龙江绥化、河北邢台的两列首发海铁联运班列抵达天津港，迎来了新年海铁联运业务“开门红”。,中国新闻网,,和讯网
1,81501126,600717.XSHG,A,E,600717,天津港,XSHG,1223,2021-01-02 10:16:24,2021-01-02 10:16:27,0.999127566814,0.000369941873942,1,0.499933725281,0,0.0989169992507,2021-01-02 10:18:07,逢低采购库存小降 不锈钢预计企稳回升,铬矿进口量同比保持较大降幅，国内铬矿港口库存下降趋势，且铬铁进口量延续下降至年内新低，不过国内前期检修停产恢复产能继续释放，铬铁价格持稳为主。10月份中国镍矿进口总量为509.82万吨，环比减111.08万吨，降幅17.89%。,和讯期货,,和讯网
2,81504186,600717.XSHG,A,E,600717,天津港,XSHG,1223,2021-01-02 14:44:30,2021-01-02 14:44:39,0.948063373566,0.0519036278129,1,0.525935314596,1,0.728112955578,2021-01-02 14:44:40,对接北京服务雄安 京津冀海上门户“竞合”加速三地融合,辞旧迎新之际，作为京津冀及中国“三北”地区海上门户的天津港持续发力，助力京津冀交通一体化。近年来，该港围绕京津冀协同发展，服务对接北京，助推营商环境改善。天津港依托港口设施资源，为雄安进出口货物提供港口绿色通道服务优先保障。,中国新闻网,,和讯网
3,81515946,600717.XSHG,A,E,600717,天津港,XSHG,1223,2021-01-03 14:02:11,2021-01-03 14:02:12,0.996374189854,0.00360762653872,1,0.501794721466,1,0.591464871913,2021-01-03 14:02:13,中欧班列（长满欧）新年首发,2021年首列中欧班列满载100标箱货物驶往德国纽伦堡。该公司表示，2021年，将依托长春兴隆口岸积极打造中欧班列集结中心，协调周边地区乃至全国货物在中国东北地区集散，形成“干支结合、枢纽集散”，促进吉林省及长春市快速融入国内国际双循环。,中国新闻网,,和讯网
4,81547154,600717.XSHG,A,E,600717,天津港,XSHG,1223,2021-01-04 10:40:26,2021-01-04 10:40:28,0.0758160948753,0.905605196953,2,0.94351324439,1,0.775166408625,2021-01-04 10:40:29,2020年集装箱吞吐量1835万标准箱创历史新高 天津港集团再当“大胃王”,截至2020年12月30日，2020年天津港集团集装箱吞吐量完成1835万标准箱，同比增长6.1%，创出年度集装箱吞吐量历史新高。,和讯,,和讯网
5,81576993,600717.XSHG,A,E,600717,天津港,XSHG,1223,2021-01-04 17:41:32,2021-01-04 17:41:33,0.999716103077,5.59202635486e-05,1,0.499913971802,0,0.168315118179,2021-01-04 17:41:44,中国港口码头行业调研及产业发展趋势研究预测报告,随后，报告对港口码头行业做了重点企业经营状况分析，最后分析了中国港口码头行业发展趋势与投资预测。本研究报告数据主要采用国家统计数据，海关总署，问卷调查数据，商务部采集数据等港口码头。,,lhw随便聊聊,搜狐财经
6,81578422,600717.XSHG,A,E,600717,天津港,XSHG,1223,2021-01-04 17:59:19,2021-01-04 17:59:21,0.998970031738,0.000860323722009,1,0.500345339591,0,0.181133811548,2021-01-04 17:59:31,中国港口码头行业调研及产业投资格局研究预测报告,随后，报告对港口码头行业做了重点企业经营状况分析，最后分析了中国港口码头行业发展趋势与投资预测。本研究报告数据主要采用国家统计数据，海关总署，问卷调查数据，商务部采集数据等港口码头。,,海阔天空110,搜狐财经
7,81583363,600717.XSHG,A,E,600717,天津港,XSHG,1223,2021-01-04 18:59:06,2021-01-04 18:59:07,0.991465806961,0.00809810589999,1,0.503831009381,1,0.623567476869,2021-01-04 18:59:22,兰格视点：1月4日钢铁行业概览,财新中国制造业PMI为53%，环比下降1.9个百分点，但仍显著高于荣枯线，显示疫情后经济恢复仍在持续。虽然今日期货表现强势，但是现货市场已经显露疲态，北方市场基本进入淡季疲软期，南方年前赶工的较多，预计今年企业会延迟放假。,兰格钢铁网,,同花顺
8,81601478,600717.XSHG,A,E,600717,天津港,XSHG,1223,2021-01-05 06:04:48,2021-01-05 06:04:52,0.973615288734,0.0256617739797,1,0.512469418347,1,0.748582854494,2021-01-05 06:04:52,滨海—中关村科技园发挥政策创新优势—— 牵线建生态 畅联京津冀,这是北京蓝星清洗有限公司化学品板块整体迁入天津滨海—中关村科技园后，首批在天津滨海新区安家的职工。面积10.3平方公里的天津滨海—中关村科技园是京津两地携手共建的京津冀协同创新示范区。,经济日报,,同花顺
9,81634344,600717.XSHG,A,E,600717,天津港,XSHG,1223,2021-01-05 14:08:21,2021-01-05 14:08:22,0.999811470509,6.46317639621e-05,1,0.499970367018,0,0.176812769286,2021-01-05 14:08:30,2021-2027年中国沿海港口行业市场研究分析及投资决策建议报告,智研咨询发布的《2021-2027年中国沿海港口行业市场研究分析及投资决策建议报告》共十二章。随后，报告对沿海港口做了重点企业经营状况分析，最后分析了沿海港口行业发展趋势与投资预测。,,谭璐,搜狐财经
10,81668148,600717.XSHG,A,E,600717,天津港,XSHG,1223,2021-01-06 00:13:16,2021-01-06 00:13:25,0.999462425709,0.000477352528833,1,0.500208565383,0,-0.0137515306473,2021-01-06 00:13:30,会计如戏，全靠演技――2020年上市公司奇葩奇闻录,甩锅黑客――*ST金洲营业利润高于营业收入 2019年年报显示，*ST金洲实体经营直营门店深圳金叶展厅2019年度实现营业收入2106 万元，实现营业利润竟然达到了6700万元。,财税闲谈,,新浪财经
11,81698384,600717.XSHG,A,E,600717,天津港,XSHG,1223,2021-01-06 11:40:45,2021-01-06 11:40:46,0.948014438152,0.0511678382754,1,0.525175057352,0,0.084719928354,2021-01-06 11:40:48,天津农商银行河西两宗违法遭罚原支行副行长遭禁业,银保监会网站今日公布的行政处罚决定书显示天津农村商业银行股份有限公司河西支行存在员工行为管理不当和内部控制缺失的违法违规事实被天津银保监局罚款人民币50万元培育全员合规风险零容忍思想,中国经济网,,金融界
12,81699026,600717.XSHG,A,E,600717,天津港,XSHG,1223,2021-01-06 11:51:52,2021-01-06 11:51:53,0.97212100029,0.0277075450867,1,0.513768045232,0,0.122226575762,2021-01-06 11:51:56,天津农商银行宁河中支违法遭罚50万内控管理不到位,史振杰对天津农商银行宁河中支贷款三查不到位行为负有直接责任从业人员应遵循公平竞争恪守客户自愿原则拒绝执行本法第三十七条规定的措施的,中国经济网,,金融界
13,81744200,600717.XSHG,A,E,600717,天津港,XSHG,1223,2021-01-07 07:32:20,2021-01-07 07:32:25,0.471724659204,0.525951445103,2,0.761813774705,0,0.117953178287,2021-01-07 07:32:31,行业景气观察：全球半导体销售额同比增幅扩大 农产品价格景气上行,动力煤价格上涨，焦炭和焦煤期货价格上涨，京唐港炼焦煤库存上涨，秦皇岛港煤炭和天津港焦炭库存下降。截至1月5日，伦敦黄金现货价格为1940.35美元/盎司，周环比上行3.52%。,金融界网站,,金融界
14,81755204,600717.XSHG,A,E,600717,天津港,XSHG,1223,2021-01-07 09:34:17,2021-01-07 09:34:19,0.331955581903,0.667115926743,2,0.833093717694,1,0.704634362832,2021-01-07 09:34:19,“丝路海运”航线达七十条,日前召开的2020年“丝路海运”年会暨福建港口集团客户报告会，发布第六批8条“丝路海运”命名航线。“丝路海运”命名航线采用国际一流服务标准，畅通中国与“一带一路”沿线国家和地区的贸易物流。,交通部网站,,同花顺
15,81813714,600717.XSHG,A,E,600717,天津港,XSHG,1223,2021-01-08 05:37:12,2021-01-08 05:37:16,0.996176958084,0.00319243432023,1,0.501280913362,1,0.6552911181,2021-01-08 05:37:17,京津中关村科技城 让企业集中精力加速发展（推动京津冀协同发展）,作为京津中关村科技城首个竣工企业的负责人，王大志对科技城的邻居们有特别的亲切感，他们都在这片14.5平方公里的热土上埋下希望的种子，借京津冀协同发展的春风破土发芽。,人民日报,,同花顺
16,81854765,600717.XSHG,A,E,600717,天津港,XSHG,1223,2021-01-08 15:39:13,2021-01-08 15:39:46,0.999365508556,0.000501947070006,1,0.500184701348,0,0.171452302858,2021-01-08 15:39:47,嘉里化工沧州物流中心举行开仓仪式 深化化工物流布局促进区域发展,嘉里化工物流位于沧州临港经济技术开发区的物流中心正式启动并投入运营，为配合政府防控要求，此次活动特别采用了“云开仓”形式。沧州物流中心的开仓运营，标志着嘉里物流在国内化工物流的战略实施驶入快车道，标志着企业化工战略的蓝图正徐徐铺开。,和讯,,和讯网
17,81861320,600717.XSHG,A,E,600717,天津港,XSHG,1223,2021-01-08 17:05:41,2021-01-08 17:05:44,0.800434052944,0.195218294859,1,0.595435321331,0,0.0706835158169,2021-01-08 17:20:03,炉料市场一周概览,进口矿方面期货市场再次破位爬升但是破位后动力不足形成高位震荡格局港口现货市场价格整体小幅探涨块矿与卡粉投机火热上海地区重废市场价格在2690元较上周上调60元,兰格钢铁网,,同花顺
18,81907039,600717.XSHG,A,E,600717,天津港,XSHG,1223,2021-01-10 09:17:23,2021-01-10 09:17:29,0.205816194415,0.790698885918,2,0.893606983125,0,0.155223709345,2021-01-10 09:17:39,狂欢之后，双焦路在何方？,焦炭利润率逼近历史高点，当前焦炭利润率为26.9%，螺纹-焦炭利润率差值达到0.7%的历史极低位。中国12月财新制造业PMI录得53，不及预期，环比回落1.9PP。吨焦利润高位驱动，叠加落后产能推空，焦企开工率高于同期平均水平。,和讯期货,,和讯网
19,82005264,600717.XSHG,A,E,600717,天津港,XSHG,1223,2021-01-12 08:43:05,2021-01-12 08:43:08,0.00818424671888,0.990891516209,2,0.994983639568,1,0.855638988689,2021-01-12 08:43:09,2020年天津港集装箱吞吐量创历史新高,一艘货轮停靠在天津港欧亚国际集装箱码头。天津港年度集装箱吞吐量创历史新高，全年完成1835万标准箱，同比增长6.1%。,经济参考报,,同花顺
20,82014521,600717.XSHG,A,E,600717,天津港,XSHG,1223,2021-01-12 10:04:31,2021-01-12 10:04:33,0.01050447952,0.983444452286,2,0.988696692046,1,0.982869198348,2021-01-12 10:04:37,天津港保税区获评国家外贸转型升级基地 海洋装备产业集聚效应显现,天津港保税区被商务部认定为2020年国家外贸转型升级基地，成为全国新认定的64个基地之一。,自然资源部网站,,同花顺
21,82073740,600717.XSHG,A,E,600717,天津港,XSHG,1223,2021-01-13 07:59:42,2021-01-13 07:59:44,0.00444683106616,0.992590427399,2,0.994813842932,0,0.0857605427504,2021-01-13 07:59:57,天津港(600717)融资融券信息(01-12),天津港2021年1月12日融资净买额-1，233，144元，融券余额282，403，798元。,东方财富Choice数据,财智星,东方财富网
22,82089092,600717.XSHG,A,E,600717,天津港,XSHG,1223,2021-01-13 10:27:34,2021-01-13 10:27:37,0.999839067459,0.00015605702356,1,0.500075590753,1,0.751399382576,2021-01-13 10:27:38,深度融入京津冀协同发展战略 朝阳“四接三引”全力推进先导区建设,主攻京津冀、深耕京津冀、融入京津冀，朝阳将全力抓好通道对接、产业对接、市场对接、平台对接和引进企业、资本、人才工作。,网信辽宁,,同花顺
23,82091287,600717.XSHG,A,E,600717,天津港,XSHG,1223,2021-01-13 10:47:13,2021-01-13 10:47:14,0.983135640621,0.00751442695037,1,0.499082247261,1,0.645760003477,2021-01-13 10:47:16,异动股揭秘：汽车整车板块异动 中国重汽触及涨停,中国重汽今日触及涨停板，该股近一年涨停4次。中国重汽是国内15吨级以上载重汽车最大的生产企业，是国内重卡行业运行质量最好的企业之一，连同集团在产销规模上已进入世界重卡行业最前列。该股今日触及涨停，后市或有继续冲高动能。,同花顺金融研究中心,,同花顺
24,82117025,600717.XSHG,A,E,600717,天津港,XSHG,1223,2021-01-13 17:03:24,2021-01-13 17:03:31,0.775894165039,0.0666634663939,1,0.454610548913,1,0.645760003477,2021-01-13 17:03:41,中国重汽01月13日涨停分析,中国重汽01月13日涨停收盘，股价上涨9.99%，收盘价为37.76元。中国重汽涨停原因类别为汽车制造概念+无人驾驶。,同花顺AI资讯社,,同花顺
25,82143741,600717.XSHG,A,E,600717,天津港,XSHG,1223,2021-01-14 07:21:07,2021-01-14 07:21:12,0.999443352222,0.000555335194804,1,0.500277011306,0,0.0886665448546,2021-01-14 07:21:22,液化气价格持续上行，乘用车产销同比增速放缓,镜头厂商玉晶光营收同比增幅缩小，大立光营收同比跌幅缩小，亚洲光学营收同比由负转正。截至2021年1月12日，Brent原油现货价格上行7.09%至56.32美元/桶，WTI原油价格上行6.57%至53.21美元/桶。,金融界网,,金融界
26,82147040,600717.XSHG,A,E,600717,天津港,XSHG,1223,2021-01-14 08:00:08,2021-01-14 08:00:17,0.00424505211413,0.992760419846,2,0.994882945903,0,0.0853859039024,2021-01-14 08:00:33,天津港(600717)融资融券信息(01-13),天津港2021年1月13日融资净买额9，169，081元，融券余额291，572，879元。,东方财富Choice数据,财智星,东方财富网
27,82176019,600717.XSHG,A,E,600717,天津港,XSHG,1223,2021-01-14 13:46:48,2021-01-14 13:46:50,0.489594548941,0.508206069469,2,0.75300334394,0,0.128846393526,2021-01-14 13:46:52,32.16万亿元！再创历史新高！中国外贸为啥这么牛？,海关总署称，我国外贸进出口从2020年6月份起连续7个月实现正增长，全年进出口、出口总值双双创历史新高，成为全球唯一实现货物贸易正增长的主要经济体。,中国新闻网,,和讯网
28,82177018,600717.XSHG,A,E,600717,天津港,XSHG,1223,2021-01-14 14:02:03,2021-01-14 14:02:04,0.999610722065,0.000356732780347,1,0.500162093813,0,0.187457182817,2021-01-14 14:02:13,中国港口设备行业“十四五”规划建议与发展形势展望报告2021年版,8.2.6 大连重工&middot。,,鸿晟信合研究院,搜狐财经
29,82201608,600717.XSHG,A,E,600717,天津港,XSHG,1223,2021-01-14 19:45:48,2021-01-14 19:45:49,0.420638442039,0.571570396423,2,0.781889617443,0,0.10217762664,2021-01-14 19:45:59,价格弱稳 成交清淡,国内锰矿弱稳运行，个别贸易商报价平稳，但市场实际零散成交清淡，部分矿种价格有小幅调整。,我的钢铁网,,同花顺
30,82216553,600717.XSHG,A,E,600717,天津港,XSHG,1223,2021-01-15 07:46:03,2021-01-15 07:46:05,0.991969168186,0.0073152561672,1,0.50329984026,0,0.155093492568,2021-01-15 07:46:09,新世界内地进退 出售非核心资产与设广州总部,广州市人民政府与新世界发展有限公司签订《战略合作协议》暨新世界中国地产有限公司总部落户广州揭牌活动在广州周大福金融中心举行。在新创建出售非核心业务的同时，新世界中国却高调宣布要在广州设立总部，并要加大投资。,观点地产网,,同花顺
31,82303870,600717.XSHG,A,E,600717,天津港,XSHG,1223,2021-01-17 08:04:13,2021-01-17 08:04:15,0.998342990875,0.00141765316948,1,0.500589148607,0,0.162868479267,2021-01-17 08:04:28,2021-2026年中国港口物流市场调查研究及行业投资潜力预测报告,本报告对中国港口物流行业的发展现状、竞争格局及市场供需形势进行了具体分析，并从行业的政策环境、经济环境、社会环境及技术环境等方面分析行业面临的机遇及挑战。,,华经—张鑫,搜狐财经
32,82304927,600717.XSHG,A,E,600717,天津港,XSHG,1223,2021-01-17 09:19:27,2021-01-17 09:19:29,0.208184927702,0.788309216499,2,0.89240168035,0,0.105824095756,2021-01-17 09:19:35,新增产能投产强预期下 焦炭还能涨吗？,12月CPI、PPI同比均好于预期，金融数据表明货币政策逐步常态化，进出口持续增长，挖机重卡销量数据亮眼表明工业生产热度不减，宏观经济向好态势仍在持续。,和讯期货,,和讯网
33,82329850,600717.XSHG,A,E,600717,天津港,XSHG,1223,2021-01-18 09:22:03,2021-01-18 09:22:24,0.00654182676226,0.992883682251,2,0.996154595632,1,0.944712072285,2021-01-18 09:22:28,天津港自动化码头建设取得重要进展,1月17日拍摄的经过全流程自动化升级改造的天津港集装箱码头。当日，天津港传统集装箱码头全流程自动化升级改造项目实现全面运营。在建的天津港北疆港区C段智能化集装箱码头一号泊位启动联调联试。,经济参考报,,同花顺
34,82330175,600717.XSHG,A,E,600717,天津港,XSHG,1223,2021-01-18 09:26:35,2021-01-18 09:26:36,0.999644398689,0.000286020891508,1,0.500108220236,0,0.103702373803,2021-01-18 09:26:48,送别2020！“拼”字当头盘点 汽车产业事件篇,面对突如其来的新冠肺炎疫情，得益于国家一系列的有效举措，在全行业的奋力拼搏下，中国汽车产业以“V”型反转为“十三五”画上句点，再次彰显国民经济支柱产业地位。,中国经济网,,同花顺
35,82333577,600717.XSHG,A,E,600717,天津港,XSHG,1223,2021-01-18 09:55:23,2021-01-18 09:55:25,0.846314311028,0.148033827543,1,0.571190983057,0,0.178488647193,2021-01-18 09:55:33,【“十三五”成就巡礼】我国汽车工业转型步入高质量发展阶段,“十三五”期间，我国汽车工业规模稳步增长，新能源汽车市场蓬勃发展，智能化、网联化正成为汽车工业转型升级的新牵引力，产业全面进入高质量发展阶段。2020年汽车产销量双双突破2500万辆，再次领跑全球，汽车行业表现出强大的发展韧性和内生动力。,和讯,,和讯网
36,82333876,600717.XSHG,A,E,600717,天津港,XSHG,1223,2021-01-18 09:57:07,2021-01-18 09:57:10,0.999274790287,0.000571872573346,1,0.500209267717,1,0.720878845453,2021-01-18 09:57:13,曹妃甸积极融入协同发展一盘棋,在京津冀协同发展的国家战略中曹妃甸区把握疏解联动突破关键词积极融入京津冀协同发展一盘棋打造北京产业转移首选地非首都功能疏解新空间在全球性钢铁行业不振的严峻形势下2014年首钢京唐公司就实现了扭亏为盈,和讯,,和讯网
37,82334495,600717.XSHG,A,E,600717,天津港,XSHG,1223,2021-01-18 10:03:02,2021-01-18 10:03:04,0.685031592846,0.305329918861,1,0.647845715284,0,0.177028638497,2021-01-18 10:03:09,我国汽车工业转型步入高质量发展阶段,“十三五”期间，我国汽车工业规模稳步增长，新能源汽车市场蓬勃发展，智能化、网联化正成为汽车工业转型升级的新牵引力，产业全面进入高质量发展阶段。2020年汽车产销量双双突破2500万辆，再次领跑全球，汽车行业表现出强大的发展韧性和内生动力。,和讯网,,同花顺
38,82363120,600717.XSHG,A,E,600717,天津港,XSHG,1223,2021-01-18 16:28:08,2021-01-18 16:28:09,0.175126165152,0.821626067162,2,0.909189149737,0,0.0699316322803,2021-01-18 16:28:11,盘整运行 成交略有减弱,海外矿山端来看，UMK对华最新一轮报盘在4.7美金左右，环比3月再次上调，而国内接货尚可，虽有部分议价，但从海外端反馈，则表示除了粉矿一般，其他矿种成交不错，而随着2-4月海外矿山端对华报价的阶梯上调，使得国内港口锰矿现货支撑度有所加强。,我的钢铁网,,同花顺
39,82371019,600717.XSHG,A,E,600717,天津港,XSHG,1223,2021-01-18 17:51:48,2021-01-18 17:51:49,0.0229188706726,0.97071146965,2,0.982170904987,1,0.769420606177,2021-01-18 17:51:57,天津港北疆港区C段智能化集装箱码头1#泊位顺利实现联调联试,在天津港北疆港区C段智能化集装箱码头，无人电动集卡整齐列队，七彩岸桥巍然矗立。,天津港官微,,同花顺
40,82415421,600717.XSHG,A,E,600717,天津港,XSHG,1223,2021-01-19 10:59:43,2021-01-19 10:59:50,0.986186981201,0.0136774349958,1,0.506770925596,0,0.131965415925,2021-01-19 10:59:52,“猪坚强”“牛魔王”“羊贵妃”为何接连上阵,“猪坚强”“牛魔王”“羊贵妃”为何接连上阵,中国商报,,同花顺
41,82441272,600717.XSHG,A,E,600717,天津港,XSHG,1223,2021-01-19 17:26:23,2021-01-19 17:26:24,0.982806563377,0.016933247447,1,0.508336529136,0,0.134175093845,2021-01-19 17:26:29,新华财经|天津航运指数2021年第3周环比上涨1.57%,2021年第3周，中国北方内外贸海运价格的风向标——天津航运指数收于1205.04点，相比1月8日累计上涨1.57%。,新华网,,和讯网
42,82446006,600717.XSHG,A,E,600717,天津港,XSHG,1223,2021-01-19 18:22:55,2021-01-19 18:22:56,0.926800251007,0.071459800005,1,0.534859925508,1,0.87141296044,2021-01-19 18:23:01,技术创新 推动“老”码头迎来“智慧革命”,全球首创传统集装箱码头全流程自动化升级改造项目在天津港实现全面运营。振华重工还基于模拟仿真、数字化等技术，为用户提供一站式解决方案，助力传统码头实现自动化升级改造。振华重工通过技术创新，持续助力全球码头自动化、智能化发展建设。,振华重工官微,,同花顺
43,82448494,600717.XSHG,A,E,600717,天津港,XSHG,1223,2021-01-19 19:00:26,2021-01-19 19:00:28,0.912376224995,0.0847617685795,1,0.540949881077,0,0.0984124146402,2021-01-19 19:00:34,期钢跌破4300 需求下降明显 钢价继续跌,午后随着期货的大幅下挫，现货市场心态悲观，商家报价继续走低。钢厂废钢库存现目前仍旧偏低，远不足钢厂废钢需求，同时怕公共卫生事件的发酵，钢厂有强烈补库意愿，因此就废钢市场来看，废钢价格短期难以下跌。,我的钢铁网,,同花顺
44,82472068,600717.XSHG,A,E,600717,天津港,XSHG,1223,2021-01-20 08:37:26,2021-01-20 08:37:28,0.999910473824,4.61638119305e-05,1,0.500001400724,1,0.81744600758,2021-01-20 08:37:34,从“星火”到“燎原” 5G产业化应用之路还要走多远,目前全国已建设开通5G基站超过70万个，累计终端连接数已超过2亿，5G网络正加速成型。未来大量的电网生产业务将承载于运营商5G公网，如何对电力5G业务实现全流程管控面临挑战。加大研发创新投入，打通产业链上下游。,经济参考报,,同花顺
45,82475031,600717.XSHG,A,E,600717,天津港,XSHG,1223,2021-01-20 09:02:29,2021-01-20 09:02:52,0.232686519623,0.765781342983,2,0.882124602795,0,0.0863796621561,2021-01-20 09:03:02,投资者提问：请问到2021年一月15日最新的股东人数，谢谢。,请问到2021年一月15日最新的股东人数，谢谢。股东数请查阅公司定期披露的相关公告，截至公司第三季度报告披露日期2020年10月30日，我公司股东数为95，441户。,问董秘,,新浪财经
46,82475032,600717.XSHG,A,E,600717,天津港,XSHG,1223,2021-01-20 09:02:29,2021-01-20 09:02:52,0.209143489599,0.790167152882,2,0.894738897681,0,0.0863796621561,2021-01-20 09:03:03,投资者提问：为何公司从不发布年度业绩快报？,公司依据《上海证券交易所股票上市规则》及相关规定，进行年报等定期报告的披露工作，始终严格按照相关规定履行信息披露义务。通过投资者电话、上证e互动等方式与投资者进行交流互动，在合法合规的基础上向投资者传递公司信息。,问董秘,,新浪财经
47,82476053,600717.XSHG,A,E,600717,天津港,XSHG,1223,2021-01-20 09:12:27,2021-01-20 09:12:27,0.000884401844814,0.999083995819,2,0.999526196741,1,0.958088101633,2021-01-20 09:12:30,"天津港联手北方港口打造海上""巴士""",波罗的海国际航运中心发展指数显示，2020年天津排名全球航运中心第二十位，天津港位居中国大陆港口第六位。20年后，天津港已联合秦皇岛、黄骅等10余个环渤海港口，开辟内支线中转航线19条，打造了环渤海货物海上“巴士”――“天天班”。,,,金融界
48,82480590,600717.XSHG,A,E,600717,天津港,XSHG,1223,2021-01-20 09:54:21,2021-01-20 09:54:28,0.00297407410108,0.996823549271,2,0.998310586321,1,0.955084029026,2021-01-20 09:54:41,天津港联手北方港口打造海上“巴士”―― 环渤海湾崛起世界级港口群,波罗的海国际航运中心发展指数显示，2020年天津排名全球航运中心第二十位，天津港位居中国大陆港口第六位。20年后，天津港已联合秦皇岛、黄骅等10余个环渤海港口，开辟内支线中转航线19条，打造了环渤海货物海上“巴士”――“天天班”。,经济日报,,同花顺
49,82497349,600717.XSHG,A,E,600717,天津港,XSHG,1223,2021-01-20 14:10:16,2021-01-20 14:10:17,0.0380038060248,0.958002686501,2,0.977004589513,1,0.781782460213,2021-01-20 14:10:19,天津港C段码头自动驾驶联调成功,天津移动联合天津港集团、中国移动上海产业研究院、北京主线科技有限公司等共同完成北疆港区C段智能化集装箱码头1#泊位联调联试展示工作。天津移动进行了持续三周的基于5G网络无人集卡远程控制实操测试。,飞象网,,同花顺
