,newsID,secID,equType,assetClass,ticker,secShortName,exchangeCD,partyID,newsPublishTime,newsInsertTime,degreeProp1St,degreeProp2St,relatedCompanyDegree,relatedCompanyScore,sentiment,sentimentScore,updateTime,newsTitle,newsSummary,newsOriginSource,newsAuthor,newsPublishSite
888,97671968,600717.XSHG,A,E,600717,天津港,XSHG,1223,2021-10-19 18:36:22,2021-10-19 18:36:24,0.985005795956,0.013554696925,1,0.506057594903,0,0.143963198364,2021-10-19 18:36:24,“品饮汇”展会现场5天交易额超5000万,10月14日至18日，2021年秋季全国第105届糖酒交易会场外交易分会场“品饮汇”精品饮料主题展，在天津空港经济区天津圣光皇冠假日酒店成功举办。,天津港保税区天津空港经济区,,同花顺
889,97706768,600717.XSHG,A,E,600717,天津港,XSHG,1223,2021-10-20 09:15:44,2021-10-20 09:15:45,0.215821817517,0.779376387596,2,0.887287296355,0,0.119685098529,2021-10-20 09:15:47,20211020生猪现货稳定为主 基差再走弱,进口：9月进口量87万吨，同比增加33万吨，榨季累计进口633万吨，同比增加68%。玉米现货市场端，新季丰产格局下，伴随着北方主产区开始步入新粮上市高峰期，现货市场在未接受集中上市冲击前，不宜轻易言底。,,,同花顺
890,97763079,600717.XSHG,A,E,600717,天津港,XSHG,1223,2021-10-20 21:12:13,2021-10-20 21:12:14,0.999970316887,1.45675503518e-05,1,0.499999725994,1,0.661711617187,2021-10-20 21:12:16,商务部：大宗消费、升级消费增长较快，推动出台进一步促消费措施,广州提出深入实施“尚品”“提质”“强能”“通达”“美誉”五大工程，打造“广聚天下客、广卖天下货、广货卖天下”的国际消费高地。挖掘武陵山区生态旅游资源，推进“大仙女山”“乌江画廊”“古镇边城”等特色消费集聚区建设。,智通财经,,和讯网
891,97763549,600717.XSHG,A,E,600717,天津港,XSHG,1223,2021-10-20 21:22:46,2021-10-20 21:22:48,0.901160240173,0.0984139665961,1,0.548994086683,1,0.801192480326,2021-10-20 21:22:49,全球首个！徐工参建的“智慧零碳”码头正式投运,天津港重新开港69周年之际，在北疆港区C段码头七彩廊道前，隆重举办了天津港第二集装箱码头有限公司暨全球首个智慧零碳码头投产运营仪式。,徐工机械官微,,同花顺
892,97788025,600717.XSHG,A,E,600717,天津港,XSHG,1223,2021-10-21 09:00:24,2021-10-21 09:00:28,0.815413236618,0.107607498765,1,0.515314117074,0,0.135339099914,2021-10-21 09:00:32,行业景气观察：9月全社会用电量同比增幅扩大，工业机器人产量当月同比增幅收窄,9月份工业机器人产量当月同比增幅收窄，金属切削机床产量当月同比和累计同比增幅均收窄。截至2021年10月19日，Brent原油现货价格周环比上行1.58%至85.08美元/桶，WTI原油价格上行2.88%至82.96美元/桶。,,,金融界
893,97834575,600717.XSHG,A,E,600717,天津港,XSHG,1223,2021-10-21 18:25:02,2021-10-21 18:25:07,0.892474532127,0.00127407035325,1,0.447511336417,0,0.0787914773997,2021-10-21 18:25:12,干货2021年中国港口行业龙头企业市场竞争格局分析上港集团发展领先于宁波港,中国拥有全球第一大货物吞吐港口宁波舟山港第一大集装箱吞吐港口上海港而宁波港上港集团分别是上述两大港口的主要运营主体以较大的体量规模优势位居行业龙头地位,前瞻产业研究院,,东方财富网
894,97870793,600717.XSHG,A,E,600717,天津港,XSHG,1223,2021-10-22 09:10:20,2021-10-22 09:10:22,0.99024438858,0.00934283994138,1,0.504465034232,0,0.0941876783967,2021-10-22 09:10:22,20211022轮胎开工环比大幅度修复,进口：9月进口量87万吨，同比增加33万吨，榨季累计进口633万吨，同比增加68%。现货整体稳定，期货跟随整体市场环境下跌，弱基差得到部分修复。,,,同花顺
895,97885614,600717.XSHG,A,E,600717,天津港,XSHG,1223,2021-10-22 11:19:41,2021-10-22 11:19:43,0.519087731838,0.265178322792,1,0.524722188711,1,0.754962757975,2021-10-22 11:19:43,机器人：公司未参与天津港北疆港区C段智能化集装箱码头项目的基建工作,有投资者向机器人提问， 10月17日，全球首个“智慧零碳”码头――天津港北疆港区C段智能化集装箱码头正式投产运营。该码头是天津港努力打造世界一流的智慧港口、绿色港口的最新重大成果，成为以全新模式引领世界港口智能化升级和低碳发展的中国范例。,同花顺金融研究中心,,同花顺
896,97897719,600717.XSHG,A,E,600717,天津港,XSHG,1223,2021-10-22 15:02:36,2021-10-22 15:02:37,0.469292163849,0.530587613583,2,0.765233695507,0,0.104321689904,2021-10-22 15:02:38,住津全国政协委员莅临恒银科技集中考察,10月19日至20日，市政协组织住津全国政协委员围绕“看发展、强信心，奋进‘十四五’”主题在津开展集中考察。江浩然代表公司对住津全国政协委员考察团莅临公司调研指导表示欢迎，对盛茂林主席等领导长期以来对恒银科技的大力支持表示感谢。,恒银科技官微,,同花顺
897,97908615,600717.XSHG,A,E,600717,天津港,XSHG,1223,2021-10-22 16:33:11,2021-10-22 16:33:13,0.156575798988,0.83544164896,2,0.913729548454,1,0.902445343789,2021-10-22 16:33:13,共商煤炭保供 共话未来合作 天津港集团“四千行动”走进乌海,天津港集团“四千行动”走进乌海煤炭客户座谈会在内蒙古乌海成功举办。座谈会邀请了中国铁路呼和浩特局集团有限公司乌海货运中心、天津南环铁路有限公司等铁路单位，以及煤炭贸易商和物流供应商约20家客户，近70人参会，共商煤炭保供，共话未来合作。,天津港官微,,同花顺
898,97974637,600717.XSHG,A,E,600717,天津港,XSHG,1223,2021-10-24 16:26:53,2021-10-24 16:26:55,0.471582084894,0.453373193741,1,0.689164236188,1,0.766959445924,2021-10-24 16:26:55,东南网架签署BIPV光伏建筑一体化项目投资协议,东南网架公告全资子公司天津东南公司控股孙公司东南网架福斯特与天津港保税区管理委员会签订BIPV光伏建筑一体化北方总部项目投资框架协议合资公司致力于屋顶分布式光伏电站项目的开发投资光伏发电业务和BIPV总承包项目建设,,,金融界
899,97976202,600717.XSHG,A,E,600717,天津港,XSHG,1223,2021-10-24 17:15:33,2021-10-24 17:15:34,0.0544736981392,0.940544605255,2,0.967781454325,1,0.938589837076,2021-10-24 17:15:35,东南网架(002135.SZ)与天津港保税区管理委员会签署投资框架协议 加快向新能源领域转型,东南网架发布公告，公司全资子公司天津东南钢结构有限公司、公司控股孙公司浙江东南网架福斯特碳中和科技有限公司与天津港保税区管理委员会签订了《“BIPV光伏建筑一体化”北方总部项目投资框架协议》。,智通财经,,和讯网
900,97977139,600717.XSHG,A,E,600717,天津港,XSHG,1223,2021-10-24 17:43:08,2021-10-24 17:43:09,0.010471323505,0.988453924656,2,0.993689586408,1,0.943100474495,2021-10-24 17:43:09,东南网架与天津港保税区管理委员会签署投资框架协议 加快向新能源领域转型,东南网架发布公告，公司全资子公司天津东南钢结构有限公司、公司控股孙公司浙江东南网架福斯特碳中和科技有限公司与天津港保税区管理委员会签订了《“BIPV光伏建筑一体化”北方总部项目投资框架协议》。,,,同花顺
901,97978056,600717.XSHG,A,E,600717,天津港,XSHG,1223,2021-10-24 18:31:27,2021-10-24 18:31:28,0.406071305275,0.569811165333,2,0.77284681797,1,0.716919032112,2021-10-24 18:31:29,东南网架最新公告：签署BIPV光伏建筑一体化项目投资协议,东南网架公告，全资子公司天津东南、公司控股孙公司东南网架福斯特与天津港保税区管理委员会签订《“BIPV光伏建筑一体化”北方总部项目投资框架协议》。东南网架2021中报显示，公司主营收入53.64亿元，同比上升31.83%。,证券之星,,和讯网
902,97978437,600717.XSHG,A,E,600717,天津港,XSHG,1223,2021-10-24 18:49:57,2021-10-24 18:50:02,0.391451060772,0.57161796093,2,0.767343491316,1,0.701257157698,2021-10-24 18:50:03,东南网架签署BIPV光伏建筑一体化项目投资协议,讯东南网架公告，全资子公司天津东南、公司控股孙公司东南网架福斯特与天津港保税区管理委员会签订了《“BIPV光伏建筑一体化”北方总部项目投资框架协议》。,,,同花顺
903,97982043,600717.XSHG,A,E,600717,天津港,XSHG,1223,2021-10-24 21:39:04,2021-10-24 21:39:05,0.0105290077627,0.988335132599,2,0.99359963648,1,0.963073159754,2021-10-24 21:39:05,天津港集团前三季度共完成货物吞吐量351亿吨同比增长45,天津港集团前三季度共完成货物吞吐量351亿吨同比增长45,证券时报网,,同花顺
904,97982724,600717.XSHG,A,E,600717,天津港,XSHG,1223,2021-10-24 22:22:25,2021-10-24 22:22:26,0.0164636410773,0.982248306274,2,0.990480126813,1,0.973843516759,2021-10-24 22:22:27,东南网架(002135.SZ)：与天津港保税区管委会签订“BIPV光伏建筑一体化”北方总部项目投资框架协议,浙江东南网架福斯特碳中和科技有限公司与天津东南钢结构有限公司拟在天津港保税区注册成立合资新公司，拟注册资金1亿元，天津东南钢结构出资7500万元，占股75%。,格隆汇,,和讯网
905,97985360,600717.XSHG,A,E,600717,天津港,XSHG,1223,2021-10-25 02:15:35,2021-10-25 02:15:37,0.600151479244,0.390542656183,1,0.690618395805,1,0.662892020494,2021-10-25 02:15:37,东南网架BIPV项目“再下一城”,东南网架10月24日晚发布公告，与天津港保税区管理委员会签订“BIPV光伏建筑一体化”北方总部项目投资框架协议，项目规模达1000MW。,,,同花顺
906,97996275,600717.XSHG,A,E,600717,天津港,XSHG,1223,2021-10-25 09:10:28,2021-10-25 09:10:31,0.975010275841,0.00103158864658,1,0.488536726567,1,0.680945325643,2021-10-25 09:10:36,商办 | 万达商业披露招股书，小米15.5亿元上海拿地，上海实业拟转让滨江城开中心股权,大宗交易方面，上海实业拟向徐汇国资转让滨江城开中心项目公司股权，鹏博士向宝能创展转让5个数据中心交易完成过户。20城市商办土地推出环比上周量降价升，商办土地成交环比上周量降价升。,中指研究院 微信号,,和讯网
907,98004632,600717.XSHG,A,E,600717,天津港,XSHG,1223,2021-10-25 10:03:15,2021-10-25 10:03:16,0.808435618877,0.0956226810813,1,0.49984049052,0,0.143757775426,2021-10-25 10:03:17,10月25日六家公司公告出现利好：骆驼股份与三峡电能签订合作协议,骆驼股份公告，公司与三峡电能能源管理有限公司于2021年10月21日签订了《关于光伏及储能项目的合作协议》，各方拟在光伏项目及储能项目等领域展开合作，力争在2025年前共同完成不低于150MW分布式光伏项目及不低于1GWh 储能项目。,证券之星,,和讯网
908,98009487,600717.XSHG,A,E,600717,天津港,XSHG,1223,2021-10-25 10:51:01,2021-10-25 10:51:02,0.999680042267,0.000186297489563,1,0.500026318623,1,0.612951567024,2021-10-25 10:51:06,重磅！中国碳达峰碳中和顶层设计出台！｜新闻麻辣烫,《意见》同时提出，加快煤炭减量步伐，“十四五”时期严控煤炭消费增长，“十五五”时期逐步减少。,金蜜蜂 微信号,,和讯网
909,98013093,600717.XSHG,A,E,600717,天津港,XSHG,1223,2021-10-25 11:34:42,2021-10-25 11:34:43,0.0262744110078,0.972207605839,2,0.985344811343,0,0.178377925605,2021-10-25 11:34:44,天津港董秘回复：公司对参与外轮作业人员均实施集中居住、闭环管理。公司结合生产任务计划、往年用工情况，通过建立储备人员台账和工作机制流程等方式，完善人员储备应急预案。,公司对参与外轮作业人员均实施集中居住、闭环管理。公司结合生产任务计划、往年用工情况，通过建立储备人员台账和工作机制流程等方式，完善人员储备应急预案。单季度扣非净利润2.79亿元，同比上升7.19%。,证券之星智库,,证券之星
910,98043044,600717.XSHG,A,E,600717,天津港,XSHG,1223,2021-10-25 17:45:12,2021-10-25 17:45:13,0.0172467324883,0.980577349663,2,0.989200715907,1,0.909178789519,2021-10-25 17:45:13,赞！远航码头公司成功实现“天津港―乌海”首列敞顶箱发运,首列“天津港――乌海”“公转铁”“散改集”敞顶箱专列满载3072吨铁矿石，由远航码头公司南26#装车楼出发驶往乌海，这是继宁夏之后，远航码头公司成功促成敞顶箱发运的第二个西北地区重要城市。,天津港官微,,同花顺
911,98046981,600717.XSHG,A,E,600717,天津港,XSHG,1223,2021-10-25 18:23:22,2021-10-25 18:23:27,0.998453021049,0.00140500010457,1,0.500631510629,0,0.120306279883,2021-10-25 18:23:31,兰格视点：10.25日钢铁行业概览,关于大宗商品是否将进入“超级周期”的话题逐渐升温。中国煤炭工业协会发布今年冬季煤炭保供稳价工作倡议，确保群众温暖过冬的决策部署，努力增产曾供，推动煤炭价格理性回归，抑制煤炭价格过快上涨，保持煤炭供应工业和人民群众温暖过冬。,,,同花顺
912,98051598,600717.XSHG,A,E,600717,天津港,XSHG,1223,2021-10-25 19:07:56,2021-10-25 19:07:59,0.103138051927,0.889422774315,2,0.940991800278,1,0.951265062252,2021-10-25 19:07:59,BIPV“再下一城”，东南网架与天津港保税区管理委员会签订投资框架协议,浙江东南网架股份有限公司在BIPV领域“再下一城”，成功与天津港保税区管理委员会签订“BIPV光伏建筑一体化”北方总部项目投资框架协议，项目规模达1000MW，实现“绿色建筑+BIPV”转型发展新突破。,东南网架官微,,同花顺
913,98116179,600717.XSHG,A,E,600717,天津港,XSHG,1223,2021-10-26 14:18:25,2021-10-26 14:18:27,0.380617886782,0.615840435028,2,0.806149378419,0,0.114710883051,2021-10-26 14:18:27,印度硅铁价格进一步上涨,上周四，印度硅铁价格再创新高，原因是国际价格上涨以及供应紧张。由于集装箱短缺，海运费高加上国际硅铁价格高涨，目前印度买家只关注国内硅铁，导致当地市场供应短缺加剧，价格进一步上涨...,,,同花顺
914,98137584,600717.XSHG,A,E,600717,天津港,XSHG,1223,2021-10-26 17:17:16,2021-10-26 17:17:18,0.999180972576,0.00079394254135,1,0.500384428829,0,0.137529804371,2021-10-26 17:17:18,天津自贸试验区机场片区维修再制造产业联盟成立,天津港保税区是我国保税维修再制造业务门类最多、政策创新最密集的区域，其所辖中国自由贸易试验区机场片区于10月21日正式成立维修再制造产业联盟。,天津港保税区天津空港经济区,,同花顺
915,98139180,600717.XSHG,A,E,600717,天津港,XSHG,1223,2021-10-26 17:28:37,2021-10-26 17:28:38,0.0328756608069,0.965746104717,2,0.982183935121,1,0.923680621386,2021-10-26 17:28:39,中标进口大众天津港清关及仓储管理服务项目,国机汽车下属企业中进汽贸联合中进进口成功中标大众汽车销售有限公司天津港进口清关及仓储管理服务项目。未来，中进汽贸将与中进进口继续协同配合，为进口大众提供满意的服务，为国机汽车的发展同拼搏、共助力。,国机汽车官微,,同花顺
916,98188457,600717.XSHG,A,E,600717,天津港,XSHG,1223,2021-10-27 08:59:47,2021-10-27 08:59:48,0.999457418919,3.11412550218e-05,1,0.499759850714,0,0.112224020809,2021-10-27 08:59:49,20211027商品涨跌互现，能化多数下跌,现货端，石化继续下调出库价，场内交投气氛欠佳，中间商跟跌报盘，现货市场成交一般，实盘价格侧重商谈。进口：9月进口量87万吨，同比增加33万吨，榨季累计进口633万吨，同比增加68%。,,,同花顺
917,98200165,600717.XSHG,A,E,600717,天津港,XSHG,1223,2021-10-27 10:11:38,2021-10-27 10:11:42,0.675711214542,0.0671910718083,1,0.40504667908,1,0.725260996819,2021-10-27 10:11:43,中红医疗：目前公司拥有南北方两大生产基地，分别位于河北唐山和江西九江,公司回答表示，尊敬的投资者，您好，公司主要从事高品质丁腈手套、PVC手套等医用及工业用一次性防护手套的研发、生产与销售，是国内最早生产销售PVC手套和丁腈手套的企业之一。公司拥有南北方两大生产基地，分别位于河北唐山和江西九江。,同花顺金融研究中心,,同花顺
918,98256999,600717.XSHG,A,E,600717,天津港,XSHG,1223,2021-10-27 19:51:20,2021-10-27 19:51:22,0.659727990627,0.324773848057,1,0.65463784337,1,0.81055909656,2021-10-27 19:51:22,天保能源中标保税区智慧路灯合同能源管理项目,天保能源公司中标天津港保税区智慧路灯合同能源管理项目。,天津天保控股有限公司,,同花顺
919,98261753,600717.XSHG,A,E,600717,天津港,XSHG,1223,2021-10-27 20:48:05,2021-10-27 20:48:07,0.928843140602,0.0295282453299,1,0.493949815631,1,0.767135316879,2021-10-27 20:48:07,恒华科技获26家机构调研：当前公司正在积极参与各地县域光伏推进工作 包括四川、云南、重庆、浙江等地（附调研问答）,恒华科技10月27日发布投资者关系活动记录表，公司于2021年10月26日接受26家机构单位调研，机构类型为保险公司、其他、基金公司、证券公司、阳光私募机构。,同花顺综合,,同花顺
920,98274206,600717.XSHG,A,E,600717,天津港,XSHG,1223,2021-10-28 04:26:08,2021-10-28 04:26:09,0.967882454395,0.00590319745243,1,0.48984442465,1,0.766044263542,2021-10-28 04:26:11,恒华科技：有知名机构千合资本参与的，共30家机构于10月26日调研我司，,恒华科技2021三季报显示，公司主营收入3.98亿元，同比下降22.77%。,证券之星,,和讯网
921,98291524,600717.XSHG,A,E,600717,天津港,XSHG,1223,2021-10-28 08:51:28,2021-10-28 08:51:37,0.613769710064,0.385737985373,1,0.692622840405,0,0.117984855175,2021-10-28 08:51:41,9月移动通信基站产量同比转正，蔬菜、生猪等价格上行——行业景气观察,截至10月26日，Brent原油现货价格周环比上行0.98%至85.91美元/桶，WTI原油价格上行2.04%至84.65美元/桶。,,,金融界
922,98293009,600717.XSHG,A,E,600717,天津港,XSHG,1223,2021-10-28 09:01:00,2021-10-28 09:01:01,0.215821817517,0.779376387596,2,0.887287296355,0,0.112212006748,2021-10-28 09:01:01,20211028黑色系领跌商品,国际金价收高，但仍维持在关键的1800美元关口之下。美元疲软和美国国债收益率回落，使黄金期货获得支撑。进口：9月进口量87万吨，同比增加33万吨，榨季累计进口633万吨，同比增加68%。,,,同花顺
923,98308462,600717.XSHG,A,E,600717,天津港,XSHG,1223,2021-10-28 10:27:18,2021-10-28 10:27:20,0.979691207409,0.0127452509478,1,0.502590854652,1,0.735728105903,2021-10-28 10:27:21,安信证券：给予美锦能源买入评级，目标价位16.52元,28安信证券股份有限公司周泰，李航对美锦能源进行研究并发布了研究报告《三季度业绩大增，有望受益于氢能产业发展提速》，本报告对美锦能源给出买入评级，认为其目标价位为16.52元，当前股价为11.26元，预期上涨幅度为46.71%。,证券之星,,和讯网
924,98311579,600717.XSHG,A,E,600717,天津港,XSHG,1223,2021-10-28 10:52:22,2021-10-28 10:52:24,0.999488830566,0.000388124200981,1,0.500132539484,1,0.731950587034,2021-10-28 10:52:27,施懿宸：碳中和背景下我国绿色港口建设之初步探讨,《绿色港口等级评价指南》中设置了“理念”“行动”“管理”和“效果”4类评价项目，每类评价项目下设有1~2项评价内容，总计7项评价内容。,,,同花顺
925,98325297,600717.XSHG,A,E,600717,天津港,XSHG,1223,2021-10-28 14:21:24,2021-10-28 14:21:26,0.333832889795,0.664520859718,2,0.831437304616,0,0.177006306872,2021-10-28 14:21:25,力推一站式供应链中心卖好车发布千帆计划,讯在近日重启扬帆平行进口车滨海论坛上汽车交易服务平台卖好车正式发布千帆计划千帆计划将投入1亿元自有资金打造的平行进口车一站式供应链服务中心将基于数字化手段向平行进口车产业链上下游提供全链路服务,,,同花顺
926,98337903,600717.XSHG,A,E,600717,天津港,XSHG,1223,2021-10-28 16:16:15,2021-10-28 16:16:16,0.987438857555,0.0109492884949,1,0.504668717273,0,0.133380249143,2021-10-28 16:16:16,宁波海运:2021三季报净利润1.79亿 同比增长27.86%,数据四舍五入，查看更多财务数据&gt。,同花顺财报,,同花顺
927,98338858,600717.XSHG,A,E,600717,天津港,XSHG,1223,2021-10-28 16:22:04,2021-10-28 16:22:05,0.771903514862,0.225317493081,1,0.611269250512,0,0.0716486662626,2021-10-28 16:22:06,28日铁矿石行情：进口矿价格下行 短期弱势整理,10月28日国内铁矿石市场弱势下行。全天市场成交量价均弱，市场上PB块资源活跃度相对较高，山东港口PB块成交价937-955元，较上一工作日跌幅20-30元不等，综上预计10月29日国内铁矿石市场弱势整理。,,,同花顺
928,98349868,600717.XSHG,A,E,600717,天津港,XSHG,1223,2021-10-28 17:29:05,2021-10-28 17:29:06,0.0290066320449,0.965743243694,2,0.980246559717,1,0.68749191165,2021-10-28 17:29:08,天津港：2021年第三季度净利润约1.86亿元 同比下降24.9%,第三季度公司实现营业收入约36.77亿元，同比下降8.02%。实现归属于上市公司股东的净利润约1.86亿元，同比下降24.9%。实现基本每股收益0.06元，同比下降40%。,每日经济新闻,,东方财富网
929,98350574,600717.XSHG,A,E,600717,天津港,XSHG,1223,2021-10-28 17:33:46,2021-10-28 17:33:49,0.00688434485346,0.991423666477,2,0.994865838904,0,0.173660402745,2021-10-28 17:33:51,天津港：2021年第三季度净利润约1.86亿元，同比下降24.9％,第三季度公司实现营业收入约36.77亿元，同比下降8.02%。实现归属于上市公司股东的净利润约1.86亿元，同比下降24.9%。实现基本每股收益0.06元，同比下降40%。,每日经济新闻,,腾讯网
930,98362770,600717.XSHG,A,E,600717,天津港,XSHG,1223,2021-10-28 19:12:31,2021-10-28 19:12:32,0.0115849133581,0.984680116177,2,0.990472572856,1,0.967301756144,2021-10-28 19:12:32,天津港600717SH前三季度归母净利润同比增711至67亿元,天津港披露2021年第三季度报告公司前三季度实现营收10784亿元同比增长1232归母净利润67亿元同比增长711第三季度归母净利186亿元同比下降249,,皮腾飞,智通财经网
931,98363388,600717.XSHG,A,E,600717,天津港,XSHG,1223,2021-10-28 19:19:45,2021-10-28 19:19:46,0.306679010391,0.686350703239,2,0.839690208435,1,0.969503372908,2021-10-28 19:19:46,天津港发展(03382)：天津港股份前三季度归母净利同比增长7.1%至6.695亿元,天津港发展发布附属公司天津港股份有限公司截至20219月30日止九个月业绩，营业总收入107.84亿元，同比增长12.3%。归属于母公司股东的净利润6.695亿元，同比增长7.1%。,,谢雨霞,智通财经网
932,98369586,600717.XSHG,A,E,600717,天津港,XSHG,1223,2021-10-28 20:17:05,2021-10-28 20:18:44,0.00235800957307,0.99702256918,2,0.998201573966,-1,-0.631161379814,2021-10-28 20:18:45,天津港600717SH第三季度净利降2490至186亿元,格隆汇10月28日丨天津港公布2021年第三季度报告公司实现营业收入3677亿元同比下降802归属于上市公司股东的扣除非经常性损益的净利润185亿元同比下降2507,,,格隆汇
933,98373538,600717.XSHG,A,E,600717,天津港,XSHG,1223,2021-10-28 21:01:05,2021-10-28 21:01:07,0.059485565871,0.939662337303,2,0.969405120239,1,0.972039050236,2021-10-28 21:01:08,天津港发展天津港股份前三季度归母净利同比增长71至6695亿元,天津港发展发布附属公司天津港股份有限公司截至20219月30日止九个月业绩营业总收入10784亿元同比增长123,智通财经,,同花顺
934,98390278,600717.XSHG,A,E,600717,天津港,XSHG,1223,2021-10-29 05:31:56,2021-10-29 05:31:57,0.0227156747133,0.976716399193,2,0.988074236549,1,0.947706295736,2021-10-29 05:31:58,财报速递：天津港前三季度净利6.70亿元 同比增长7.11%,天津港发布2021年三季报，公司2021年1-9月实现营业收入107.84亿元，同比增长12.32%，归属于上市公司股东的净利润为6.70亿元，同比增长7.11%，每股收益为0.2600元。,同花顺金融研究中心,,同花顺
935,98396343,600717.XSHG,A,E,600717,天津港,XSHG,1223,2021-10-29 07:50:05,2021-10-29 07:50:06,0.818559765816,0.107433132827,1,0.516713015735,1,0.683147543669,2021-10-29 07:50:08,美锦能源合作昇辉科技加码氢能煤焦市场高位运行前三季盈利20亿,公司近日与昇辉智能科技股份有限公司签署战略合作框架协议双方将在氢气的制储运加可再生氢能供应链氢动力核心装备氢能关键零部件制造氢能源车辆运营推广碳资产运营管理等开展深度合作,,,金融界
936,98412218,600717.XSHG,A,E,600717,天津港,XSHG,1223,2021-10-29 09:40:47,2021-10-29 09:42:40,0.21747367084,0.779482483864,2,0.888219319284,1,0.922663830221,2021-10-29 09:42:40,天津港发展03382HK旗下天津港A首九个月纯利增71,天津港发展0000公布旗下天津港股份008截至9月底止首九个月收入10784亿元人民币按年增1232期内纯利为669亿元按年增711每股基本盈利026元,,,阿思达克财经
