,newsID,secID,equType,assetClass,ticker,secShortName,exchangeCD,partyID,newsPublishTime,newsInsertTime,degreeProp1St,degreeProp2St,relatedCompanyDegree,relatedCompanyScore,sentiment,sentimentScore,updateTime,newsTitle,newsSummary,newsOriginSource,newsAuthor,newsPublishSite
595,92576828,600717.XSHG,A,E,600717,天津港,XSHG,1223,2021-07-28 20:03:01,2021-07-28 20:03:02,0.0046124253422,0.995289683342,2,0.997595896013,1,0.901975949854,2021-07-28 20:03:03,全球首个零碳码头发布天津港集团世界一流绿色港口启新程,为全面贯彻落实碳达峰碳中和战略目标加快构建绿色港口发展新格局7月28日在中国港口协会2021绿色与安全港口大会上天津港集团发布零碳码头将天津港C段智能化集装箱码头打造成为全球首个人工智能零碳码头,天津港官微,,同花顺
596,92581075,600717.XSHG,A,E,600717,天津港,XSHG,1223,2021-07-28 21:15:59,2021-07-28 21:16:02,0.0708919167519,0.912208199501,2,0.947654157877,0,0.00255171209574,2021-07-28 21:16:02,天津港薛晓莉鞠兆欣因工作调整辞去董事职务,今日晚间天津港发布公告称公司董事会收到董事薛晓莉董事鞠兆欣的书面辞职报告因工作调整薛晓莉鞠兆欣申请辞去公司董事职务薛晓莉曾任天津港有限公司招商部副部长招商一部副部长投资部副部长天津港股份有限公司董事会秘书董事会办公室主任天津港股份有限公司董事,中国经济网,,腾讯网
597,92583115,600717.XSHG,A,E,600717,天津港,XSHG,1223,2021-07-28 21:57:08,2021-07-28 21:59:03,0.00292420573533,0.996608018875,2,0.998070121743,1,0.863329492882,2021-07-28 21:59:04,天津港600717SH确认收购中远海欧亚100股权最终转让价为2696亿元,格隆汇7月28日丨天津港公布此前披露公司通过指定境外SPV子公司收购中远海运港口有限公司100股权从而间接持有天津港欧亚国际集装箱码头有限公司30股权,,,格隆汇
598,92589900,600717.XSHG,A,E,600717,天津港,XSHG,1223,2021-07-29 02:22:07,2021-07-29 02:22:10,0.759531319141,0.186132922769,1,0.565898582339,1,0.621855013259,2021-07-29 02:22:13,中远海运控股股份有限公司 关于控股子公司收购天津港集装箱码头有限公司部分股权进展公告,详见公司于2021年2月26日披露的《关于控股子公司收购天津港集装箱码头有限公司部分股权的公告》。,证券日报,,新浪财经
599,92590203,600717.XSHG,A,E,600717,天津港,XSHG,1223,2021-07-29 02:31:17,2021-07-29 02:31:21,0.896070718765,0.0377139337361,1,0.485749293119,0,0.119091878086,2021-07-29 02:31:27,中远海运控股股份有限公司关于股票期权激励计划限制行权期间的提示性公告,本公司股票期权激励计划首次授予期权已于2021年6月3日正式进入第1个行权期有效行权期为2021年6月3日至2022年6月2日目前处于行权阶段,,,证券时报网
600,92593267,600717.XSHG,A,E,600717,天津港,XSHG,1223,2021-07-29 06:01:02,2021-07-29 06:01:20,1.24698431136e-07,0.999999880791,2,0.99999994314,0,-0.0572292424738,2021-07-29 06:01:23,天津港股份有限公司关于董事辞职的公告,委托人应在委托书中“同意”、“反对”或“弃权”意向中选择一个并打“√”，对于委托人在本授权委托书中未作具体指示的，受托人有权按自己的意愿进行表决。,中国证券报-中证网,,新浪财经
601,92595321,600717.XSHG,A,E,600717,天津港,XSHG,1223,2021-07-29 07:12:50,2021-07-29 07:14:38,0.978692829609,0.00742697482929,1,0.496773389634,0,0.0898720264435,2021-07-29 07:14:42,铁合金：下有底 关注期现套利机会,政策面来说，目前政策对合金产量的影响要大于需求，因此，合金价格如果出现期货大幅贴水现货，或现货跌至高值生产成本区间，则合金做多是风险较小的。2季度锰矿进口利润先增后减，5月锰矿进口利润转正，但6月以后海外矿山价格上调，利润重新回负。,新浪网,,和讯网
602,92639632,600717.XSHG,A,E,600717,天津港,XSHG,1223,2021-07-29 16:10:28,2021-07-29 16:10:33,0.298757702112,0.682087600231,2,0.831466451287,1,0.6443405509,2021-07-29 16:10:35,博迈科2021年半年度董事会经营评述,报告期内公司成功签署了原油日处理量为8万桶天然气日处理量为248亿标准立方英尺单日注水量为39万桶最大可存储100万桶原油的MV33项目详细设计合同,同花顺金融研究中心,,同花顺
603,92647206,600717.XSHG,A,E,600717,天津港,XSHG,1223,2021-07-29 17:29:21,2021-07-29 17:29:38,0.999872326851,9.37645236263e-05,1,0.500029927949,1,0.644665980339,2021-07-29 17:29:38,智慧物联做好居然大生态的腿解决家居大件物流痛点,居然之家数字化转型的根本目的是让家装家居快乐简单作为居然之家的腿智慧物流平台通过轻资产和重运营把线性服务能力提升了起来真正让家居家装行业生态巨人落地奔跑,居然之家官微,,同花顺
604,92681596,600717.XSHG,A,E,600717,天津港,XSHG,1223,2021-07-30 08:05:04,2021-07-30 08:05:15,0.0937763005495,0.882120907307,2,0.929009057581,1,0.89763884414,2021-07-30 08:05:18,天津港：7月29日融资净买入181.84万元 上一交易日净偿还260.31万元,7月29日融资买入358.55万元，融资偿还176.71万元，融资净买入181.84万元，当前融资余额为2.41亿元。天津港7月29日融资融券余额较昨日增加186.00万元至2.55亿元。,同花顺金融研究中心,,同花顺
605,92693919,600717.XSHG,A,E,600717,天津港,XSHG,1223,2021-07-30 10:02:22,2021-07-30 10:02:23,0.785775363445,0.204871281981,1,0.597758963704,1,0.655885643512,2021-07-30 10:02:25,半年报解读|博迈科FPSO在手订单充裕 海上风电与氢能有望成为新利润增长点,大客户FPSO追加订单不断，博迈科半年度营收净利双增，而模块化的业务模式，或可迅速切入海上风能与氢能业务，有望成为新的利润增长点。,财联社,,和讯网
606,92702198,600717.XSHG,A,E,600717,天津港,XSHG,1223,2021-07-30 11:29:21,2021-07-30 11:29:22,0.00936218444258,0.989833116531,2,0.994514208753,1,0.963682717737,2021-07-30 11:29:23,天津港将建设全球首个零碳码头,在中国港口协会2021绿色与安全港口大会上，天津港集团宣布将把天津港C段智能化集装箱码头打造成为全球首个人工智能零碳码头，将实现年能耗量百分之百清洁能源、百分之百自给自足。,中国经济网,,同花顺
607,92712761,600717.XSHG,A,E,600717,天津港,XSHG,1223,2021-07-30 14:29:58,2021-07-30 14:30:08,0.0483077913523,0.940222322941,2,0.964376218617,1,0.920616906043,2021-07-30 14:30:08,省港航集团与天津港集团深化江海港口战略合作,安徽省港航集团与天津港集团在天津市签署战略合作框架协议，共同构建天津与安徽港口间贸易和运输通道，协同打造安全、便捷、高效的供应链新格局。,安徽国资,,同花顺
608,92741223,600717.XSHG,A,E,600717,天津港,XSHG,1223,2021-07-30 19:34:13,2021-07-30 19:34:14,0.921944022179,0.0231410712004,1,0.48411308229,1,0.583958472311,2021-07-30 19:34:15,运价上涨利润猛增32倍巨头中远海控1248亿布局集装箱码头,中国出口集装箱运价指数再次刷新了历史纪录7月7日晚中远海控发布2021年上半年度业绩预增公告预计公司上半年实现归母净利润约为37093亿元去年同期约为1137亿元同比增加近32倍一箱难求带动集装箱生产商业务暴增,时代财经,,同花顺
609,92749879,600717.XSHG,A,E,600717,天津港,XSHG,1223,2021-07-30 21:54:00,2021-07-30 21:54:14,0.999318361282,0.000606169516686,1,0.500265350158,1,0.816910725087,2021-07-30 21:54:15,“懂行人”倾力而为 “5新”合力释放天津数字经济无限潜能,过去，天津因漕运而兴起，素有“九河下梢”、“河海要冲”之称。数据中心建设为城市建立经济运行“画像”，精准掌握城市电力信息，辅助各类决策的制定实施，推动国网天津电力由“用好电”向“用好能”转变，助力天津“碳达峰”与“碳中和”目标实现。,华为官微,,同花顺
610,92766603,600717.XSHG,A,E,600717,天津港,XSHG,1223,2021-07-31 10:20:57,2021-07-31 10:21:31,0.995117545128,0.00117167585995,1,0.498730448424,0,0.0635246135294,2021-07-31 10:21:34,铁合金：供应充足需求减少 后市行情趋向偏弱,2021年上半年，硅铁、锰硅期货呈现震荡上行，其中硅铁期价涨幅较大。上半年，铁合金行业受能耗双控限电影响，但是由于限电的区域性，在高利润的驱动下，暂未限电区域高负荷生产，所以产量并没有呈现连续减少，也造就了期价走势反复，但是整体来看是呈现向上行情。上半年，下游的需求旺盛，由于钢厂高炉高位开工。下半年，夏季用电旺季过后，对于铁合金行业用电限制或将减弱，供应将会维持高位。在“碳中和”背景下，下游产量将会缩减，对于铁合金的需求也将减少。在供应充足需求减少的情况下，硅铁、锰硅市场将弱势运行。,新浪网,,和讯网
611,92768457,600717.XSHG,A,E,600717,天津港,XSHG,1223,2021-07-31 12:03:55,2021-07-31 12:04:03,0.9467202425,0.0492156073451,1,0.522575728595,0,0.174890056998,2021-07-31 12:04:04,优质订单持续释放 博迈科营收净利双增长,博迈科发布的2021年半年度报告显示，公司实现营业收入19.95亿元，同比增长106.36%。,证券日报网,,同花顺
612,92769114,600717.XSHG,A,E,600717,天津港,XSHG,1223,2021-07-31 12:52:23,2021-07-31 12:52:25,0.648976206779,0.332688868046,1,0.657176971436,1,0.666542844847,2021-07-31 12:52:28,服务“一带一路” 天津市推进北方国际航运枢纽建设,天津市第十七届人民代表大会常务委员会第二十八次会议审议通过了《天津市推进北方国际航运枢纽建设条例》，将于2021年9月1日起正式施行。,中国日报网,,同花顺
613,92776969,600717.XSHG,A,E,600717,天津港,XSHG,1223,2021-07-31 21:24:51,2021-07-31 21:24:54,0.997918069363,0.00175184907857,1,0.50071088376,1,0.75434372928,2021-07-31 21:24:55,上半年我国区域经济复苏向好、亮点纷呈,上半年，区域经济持续复苏，湖北经济全面恢复，东部沿海出口规模创历史最好水平，中西部地区加快崛起，北方部分省份下滑势头得到遏制，区域发展的协调性增强。海南自由贸易港上半年进出口同比增长46.1%，显著高于全国外贸总体增速。,国家发改委网站,,同花顺
614,92802530,600717.XSHG,A,E,600717,天津港,XSHG,1223,2021-08-02 08:05:05,2021-08-02 08:05:38,0.102470763028,0.87039989233,2,0.921635273844,1,0.787398421764,2021-08-02 08:05:39,天津港：7月30日融资净买入149.61万元 环比减少17.73%,7月30日融资买入313.96万元，融资偿还164.35万元，融资净买入149.61万元，当前融资余额为2.43亿元。天津港7月30日融资融券余额较昨日增加161.90万元至2.56亿元。,同花顺金融研究中心,,同花顺
615,92847115,600717.XSHG,A,E,600717,天津港,XSHG,1223,2021-08-02 16:40:24,2021-08-02 16:40:30,0.130892202258,0.868591845036,2,0.934037946165,1,0.633069726452,2021-08-02 16:40:30,高压岸电成效初显 滚装码头公司用心践行“绿色港口”理念,滚装码头公司积极践行绿色发展理念，以落实“双碳”战略为契机，坚持绿色发展、低碳发展，全力构建本质绿色发展模式。,天津港官微,,同花顺
616,92862708,600717.XSHG,A,E,600717,天津港,XSHG,1223,2021-08-02 19:30:28,2021-08-02 19:30:29,0.996151506901,0.00380183802918,1,0.50187759148,0,0.164973925054,2021-08-02 19:30:30,智通港股研报精读(08.02) | 关注汽车板块龙头股、航运板块龙头股和工程机械板块龙头股,3月煤炭开采和洗选业固定资产投资额累计增长 10.8%，煤炭价格于去年三季度开始触底反弹，煤炭行业目前处于上行周期，为设备采购需求提供保障。,智通财经,,和讯网
617,92941269,600717.XSHG,A,E,600717,天津港,XSHG,1223,2021-08-03 18:24:51,2021-08-03 18:24:53,0.788621604443,0.102050937712,1,0.496361739933,1,0.824894333631,2021-08-03 18:24:55,大步跨越 招商港口集装箱权益吞吐量跃升至全球第二,在2020年疫情影响全球港口业集装箱吞吐量下降1.2%的大背景下，招商港口集装箱权益吞吐量实现逆势增长，极大彰显了公司的抗风险能力及成长韧性。,飞象网,,同花顺
618,92942198,600717.XSHG,A,E,600717,天津港,XSHG,1223,2021-08-03 18:40:35,2021-08-03 18:40:36,0.998533368111,0.00136798724998,1,0.500634671305,0,0.146859000623,2021-08-03 18:40:38,安全环保高压政策监管下 石化仓储企业转型谋发展,过去的2020年虽然受到新冠疫情影响，国内许多行业受到了颠覆性的影响，但石化仓储行业却逆势而上，市场需求量激增，而受制于当前安全环保政策趋严，市场监管力度加大，石化仓储行业正面临格局化转变。,我的钢铁网,,同花顺
619,92945370,600717.XSHG,A,E,600717,天津港,XSHG,1223,2021-08-03 19:13:23,2021-08-03 19:14:35,0.901180207729,0.0917231068015,1,0.542313210666,0,0.165475007519,2021-08-03 19:14:38,中远海运港口收购天津集装箱码头权益最终作价12.48亿元,中远海运港口、天津港股份与中远海运港口共同签署《股权转让协议之补充协议》，各方最终确定标的股权的转让价格为人民币134887.59万元。,航运交易公报,,新浪财经
620,92948432,600717.XSHG,A,E,600717,天津港,XSHG,1223,2021-08-03 19:56:44,2021-08-03 19:56:46,0.91186273098,0.0643686503172,1,0.520300015807,1,0.594258302078,2021-08-03 19:56:49,中兴通讯首席发展官崔丽：澎湃“数”动能 助力“智”生长,在2021全球数字经济大会上，中兴通讯首席发展官崔丽以线上的方式出席并做了《澎湃“数”动能，助力“智”生长》的主题发言，分享中兴通讯结合与产业、行业和生态伙伴两年多的实践，并提炼三大应用创新方向和四大数字基座创新发展方向。,中兴通讯官微,,同花顺
621,93001088,600717.XSHG,A,E,600717,天津港,XSHG,1223,2021-08-04 14:35:09,2021-08-04 14:36:04,0.393148005009,0.593273222446,2,0.789847224951,0,0.142342694476,2021-08-04 14:36:06,【研报-锰】2021年二季度海外矿山季报摘要及国内表现,2021年二季度，国内硅锰市场受内蒙，宁夏，广西等多地环保政策影响，导致开工率低于上季度，现货偏紧，叠加锰矿成本端的价格支撑，价格持续高位运行。,我的钢铁网,,同花顺
622,93019179,600717.XSHG,A,E,600717,天津港,XSHG,1223,2021-08-04 18:06:33,2021-08-04 18:06:34,0.284693151712,0.714605748653,2,0.85695232451,1,0.85434313938,2021-08-04 18:06:36,奥利给！临港港务公司风电叶片作业创纪录,作业中，该公司与海关、船方积极沟通，细化作业流程，合理规划倒运路线，科学调配人力和机力，克服装船难度，高标准、严要求完成风电叶片装船作业，获得客户、船方一致好评。,天津港官微,,同花顺
623,93055936,600717.XSHG,A,E,600717,天津港,XSHG,1223,2021-08-05 09:21:36,2021-08-05 09:25:10,0.709503352642,0.287611544132,1,0.642363220453,0,0.120238645375,2021-08-05 09:25:15,行业景气观察：北美半导体设备出货额同比增幅扩大，水泥价格止跌,截至2021年8月3日，Brent原油现货价格周环比下行1.79%至73.66美元/桶，WTI原油价格下行1.52%至70.56美元/桶。,,,金融界
624,93061920,600717.XSHG,A,E,600717,天津港,XSHG,1223,2021-08-05 10:08:22,2021-08-05 10:08:22,0.999571621418,0.000236775871599,1,0.500022586581,0,0.0918623417616,2021-08-05 10:08:23,突破6300元/吨大关 纸浆期货大涨,新纪元期货纸浆分析师王晨告诉记者，从月线级别看，自2020年8月开始的纸浆期货进入牛市，由于宏观复苏经济回暖，刺激计划助燃通胀预期，纸浆期货跟随大宗商品一起上涨。,,,金融界
625,93173993,600717.XSHG,A,E,600717,天津港,XSHG,1223,2021-08-06 17:24:05,2021-08-06 17:24:09,0.824870526791,0.169019684196,1,0.581454947591,1,0.749032717198,2021-08-06 17:24:10,广发证券：维持山西焦煤“买入”评级 目标价9.46元,山西焦煤是炼焦煤行业龙头，受益煤焦价格上行，公司估值有望提升，预计21-23年EPS分别为0.95/0.95/0.96元，目标价9.46元，对应21年PE10倍，维持“买入”评级。,智通财经,,同花顺
626,93182732,600717.XSHG,A,E,600717,天津港,XSHG,1223,2021-08-06 19:43:46,2021-08-06 19:43:50,0.151039212942,0.839306414127,2,0.914826020598,1,0.949056136142,2021-08-06 19:43:51,成果斐然！天津港保税区上半年引进重点招商项目671个,今年上半年，天津港保税区以项目为抓手，以效益为目标，围绕“串链、补链、强链”，全力引进大好项目落户，招商引资成果斐然。,天津港保税区天津空港经济区,,同花顺
627,93201364,600717.XSHG,A,E,600717,天津港,XSHG,1223,2021-08-07 06:04:32,2021-08-07 06:04:33,0.00963842310011,0.988120675087,2,0.992939886637,0,0.00620867956895,2021-08-07 06:04:35,天津港股份有限公司关于召开2021年第一次临时股东大会的提示性公告,经公司九届十八次临时董事会审议通过，决定于2021年8月13日召开公司2021年第一次临时股东大会。公司于2021年7月29日发布了《天津港股份有限公司关于召开2021年第一次临时股东大会的通知》。,中国证券报-中证网,,新浪财经
628,93245378,600717.XSHG,A,E,600717,天津港,XSHG,1223,2021-08-09 08:42:58,2021-08-09 08:43:00,0.921847939491,0.0768336132169,1,0.537757582963,1,0.691627298295,2021-08-09 08:43:01,天津市国企成功入选国有重点企业 管理标杆创建行动,国务院国资委公布了国有重点企业管理标杆创建行动标杆企业、标杆项目和标杆模式名单。,天津国资,,同花顺
629,93268845,600717.XSHG,A,E,600717,天津港,XSHG,1223,2021-08-09 12:58:04,2021-08-09 12:58:05,0.999684333801,0.000256648199866,1,0.500098815101,1,0.618944389746,2021-08-09 12:58:07,聚力技术创新 融入“数字化+航运”时代变革,发展智慧集装箱码头、数字船厂，搭建大数据船舶与贸易情报系统，构建港航大数据的运营创新协同平台，如今数字化转型在航运领域已初显成效，大数据、人工智能等技术已渗透进船舶、港口、水运、物流等航运产业的方方面面。,中国金融新闻网,,同花顺
630,93269205,600717.XSHG,A,E,600717,天津港,XSHG,1223,2021-08-09 13:06:47,2021-08-09 13:06:48,0.764392733574,0.231549426913,1,0.6137457937,0,0.089298286289,2021-08-09 13:06:49,我的农产品：7月高粱市场回顾及8月展望,本月高粱价格前期较为平稳，月底高粱小幅上涨，7月下旬，高粱价格小幅上涨。2021年上半年，高粱进口量一直维持高位，6月份达到近三年来的进口峰值。目前国内中小型酒厂及家庭作坊用进口高粱的占比较大。,我的钢铁网,,同花顺
631,93285150,600717.XSHG,A,E,600717,天津港,XSHG,1223,2021-08-09 16:36:38,2021-08-09 16:36:43,0.00340179959312,0.996482372284,2,0.99818327208,1,0.929966796003,2021-08-09 16:36:46,天津港集团智慧港口建设扎实推进,在位于集装箱公司北区的天津港港口自动驾驶示范区内，“新海欣”轮正进行着井然有序的全流程自动化作业。天津港集团以“创新年”为抓手，加强创新驱动，引领高质量发展，推动“智慧港口”建设取得多项国际领先的技术成果。,天津港官微,,同花顺
632,93286643,600717.XSHG,A,E,600717,天津港,XSHG,1223,2021-08-09 16:53:25,2021-08-09 16:53:28,0.106882199645,0.891503632069,2,0.944944731891,0,0.0707432873547,2021-08-09 16:53:29,【锰矿】南北港存表现不一 价格表现欠佳,短期硅锰等合金呈现强势状态，但厂家端与矿商端对于后期走势信心偏弱，仍为大概率会冲高回落，而锰矿端则仍将由承办支撑，在无特殊外因的情况下，较难有突出表现，而短期可能会由于限电稍稍缓解，成交应该有所好转。,我的钢铁网,,同花顺
633,93292114,600717.XSHG,A,E,600717,天津港,XSHG,1223,2021-08-09 17:48:37,2021-08-09 17:48:44,0.997912585735,0.00203275657259,1,0.50098904944,0,0.132060156018,2021-08-09 17:48:48,旺季需求叠加供给紧张 盘面价格持续上行,在几大国际主要港口煤炭价中，欧洲ARA三港煤炭价格指数、南非理查德港煤炭价格指数以及澳大利亚纽卡斯尔港煤炭价格指数均震荡上涨。,和讯期货,,和讯网
634,93303908,600717.XSHG,A,E,600717,天津港,XSHG,1223,2021-08-09 20:09:32,2021-08-09 20:09:33,0.31932297349,0.676613390446,2,0.836274877191,0,0.136966009066,2021-08-09 20:09:35,供需拐点将至 铁合金价格重心逐步下移,生铁，粗钢，再生钢铁原料，铬铁等产品将实行零进口暂定汇率：而硅铁，铬铁，高纯生铁等产品的出口关税将适当调高，调整后分别实行25%出口税率，20%出口暂定税率，15%出口暂定税率。,期货日报,,同花顺
635,93305006,600717.XSHG,A,E,600717,天津港,XSHG,1223,2021-08-09 20:30:53,2021-08-09 20:30:56,0.716890215874,0.246068894863,1,0.6045140028,1,0.646005038545,2021-08-09 20:30:58,捷强装备2021年半年度董事会经营评述,行业政策影响 报告期内，公司所处行业属于中国证监会2012年10月发布的《上市公司行业分类指引》中的C35专用设备制造业。军队对应核化生安全装备需求将在未来较长一段时期内呈现增长趋势。,同花顺金融研究中心,,同花顺
636,93312254,600717.XSHG,A,E,600717,天津港,XSHG,1223,2021-08-09 23:13:05,2021-08-09 23:13:06,0.495590806007,0.498890310526,2,0.74668571353,1,0.876566715725,2021-08-09 23:13:08,预计年底建成！贝因美天津工厂项目主体完工,贝因美位于天津港保税区的天津工厂项目已完成主体建筑施工，同时次结构和安装工作正有条不紊推进中，计划年底建成并具备投产条件。天津工厂项目是贝因美立足华北着眼全国的战略发展规划建设的重点项目，建成投产后可实现较高的经济效益和社会效益。,天津港保税区天津空港经济区,,同花顺
637,93327437,600717.XSHG,A,E,600717,天津港,XSHG,1223,2021-08-10 08:31:46,2021-08-10 08:31:50,0.998111963272,0.000551802746486,1,0.499607784383,0,0.0644370660186,2021-08-10 08:31:50,兰格视点：8.9日钢铁行业概览,7月外贸数据开启下半年进出口稳定增长序幕 海关总署7月份外贸数据显示，以人民币计价，7月份进出口总值3.27万亿元，同比增长11.5%，环比下降0.8%。,兰格钢铁网,,同花顺
638,93345223,600717.XSHG,A,E,600717,天津港,XSHG,1223,2021-08-10 11:22:27,2021-08-10 11:22:28,0.134459093213,0.865397870541,2,0.932627417147,0,0.0343365877867,2021-08-10 11:22:29,天津农商银行上半年净利润同比增1.16% 提出5年内上市目标,天津农商银行在官网披露2021年上半年经营业绩。今年上半年，天津农商银行实现了营业收入、净利润、ROE、拨备覆盖率等6项关键指标的增长。,和讯银行,,和讯网
639,93351663,600717.XSHG,A,E,600717,天津港,XSHG,1223,2021-08-10 13:10:28,2021-08-10 13:10:29,0.134459093213,0.865397870541,2,0.932627417147,0,0.0343365877867,2021-08-10 13:10:31,天津农商银行上半年净利润同比增长1.16% 提出5年内上市目标,天津农商银行在官网披露2021年上半年经营业绩。今年上半年，天津农商银行实现了营业收入、净利润、ROE、拨备覆盖率等6项关键指标的增长。,和讯财经,,证券之星
640,93365811,600717.XSHG,A,E,600717,天津港,XSHG,1223,2021-08-10 16:19:45,2021-08-10 16:19:47,0.388228744268,0.609138011932,2,0.803252384067,1,0.740125063434,2021-08-10 16:19:50,关注国际市场 四公司化肥出口显著增长,满载5.25万吨化肥的“清风”轮平稳驶离四公司码头，驶往南非。四公司抢抓国家化肥出口政策调整和国际市场变化有利时机，深入推进“四千行动”，积极尝试“介入式全过程物流”服务新实践。,天津港官微,,同花顺
641,93377608,600717.XSHG,A,E,600717,天津港,XSHG,1223,2021-08-10 18:17:29,2021-08-10 18:17:30,0.84189414978,0.15269985795,1,0.57364693284,0,0.142612056434,2021-08-10 18:17:31,锰矿：现货弱稳 南北略分化,港口锰矿现货价格整体持稳运行，但南方地区由于广西限电仍较严重，开工率不高，面临大面积停产减产情况，同时入港较为集中，钦州港港口库存快速累积，市场情绪较弱，有部分贸易商出货情绪较浓，部分主流矿现货价格下探。,我的钢铁网,,同花顺
642,93413261,600717.XSHG,A,E,600717,天津港,XSHG,1223,2021-08-11 09:16:20,2021-08-11 09:16:23,0.886918008327,0.0109066348523,1,0.454365639016,0,0.0529189355671,2021-08-11 09:16:24,宏川智慧：国内偶发的石化仓储/生产企业安全事故对石化仓储行业的供需关系会产生一定的影响,国内偶发的石化仓储/生产企业安全事故对石化仓储行业的供需关系会产生一定的影响，随着监管趋严，供给端在缩减，但需求却在增加。,同花顺金融研究中心,,同花顺
643,93456024,600717.XSHG,A,E,600717,天津港,XSHG,1223,2021-08-11 17:51:15,2021-08-11 17:51:17,0.879552781582,0.0919575840235,1,0.531733974814,1,0.628235327452,2021-08-11 17:51:18,中创物流2021年半年度董事会经营评述,中创物流2021年半年度董事会经营评述,同花顺金融研究中心,,同花顺
